NAME,B01003_001E,B01003_001EA,B01003_001M,B01003_001MA,american indian area/alaska native area/hawaiian home land
"Osage Reservation, OK",47311.0,,-555555555.0,*****,2595
"Torres-Martinez Reservation, CA",2511.0,,310.0,,4255
"Hassanamisco Reservation (state), MA",0.0,,12.0,,9150
"Ramapough (state) SDTSA, NJ",994.0,,167.0,,9850
"Twin Hills ANVSA, AK",63.0,,22.0,,7650
"Cherokee Tribe of Northeast Alabama (state) SDTSA, AL",14453.0,,719.0,,9560
"Sac and Fox OTSA, OK",58194.0,,706.0,,5820
"Stevens Village ANVSA, AK",11.0,,6.0,,7520
"Lummi Reservation, WA",5583.0,,392.0,,2070
"Meherrin (state) SDTSA, NC",7630.0,,459.0,,9825
"Santa Ana Pueblo, NM",695.0,,102.0,,3480
"Swinomish Reservation and Off-Reservation Trust Land, WA",2915.0,,133.0,,4075
"White Earth Reservation and Off-Reservation Trust Land, MN",9845.0,,165.0,,4595
"Hanapepe Hawaiian Home Land, HI",11.0,,8.0,,5011
"Kaw/Ponca joint-use OTSA, OK",26375.0,,198.0,,5950
"Cantwell ANVSA, AK",183.0,,65.0,,6255
"Fort Berthold Reservation, ND",7260.0,,322.0,,1160
"Navajo Nation Reservation and Off-Reservation Trust Land, AZ--NM--UT",172875.0,,2223.0,,2430
"Rincon Reservation and Off-Reservation Trust Land, CA",932.0,,166.0,,3165
"Pauma and Yuima Reservation, CA",242.0,,87.0,,2715
"Santa Rosa Reservation, CA",73.0,,26.0,,3525
"Nelson Lagoon ANVSA, AK",74.0,,28.0,,7025
"Tazlina ANVSA, AK",354.0,,139.0,,7560
"Nambe Pueblo and Off-Reservation Trust Land, NM",1613.0,,122.0,,2400
"Winnemucca Indian Colony, NV",29.0,,17.0,,4635
"Allakaket ANVSA, AK",170.0,,30.0,,6070
"Benton Paiute Reservation and Off-Reservation Trust Land, CA",109.0,,55.0,,0185
"Ohkay Owingeh, NM",6541.0,,495.0,,2510
"Tonkawa OTSA, OK",3918.0,,78.0,,5860
"Mooretown Rancheria and Off-Reservation Trust Land, CA",160.0,,60.0,,2340
"Waiehu Hawaiian Home Land, HI",1507.0,,222.0,,5241
"Pedro Bay ANVSA, AK",20.0,,14.0,,7205
"Big Sandy Rancheria and Off-Reservation Trust Land, CA",148.0,,59.0,,0265
"Haliwa-Saponi (state) SDTSA, NC",8713.0,,646.0,,9745
"Waccamaw Siouan (state) SDTSA, NC",2008.0,,278.0,,9970
"Ambler ANVSA, AK",299.0,,74.0,,6075
"Akiak ANVSA, AK",416.0,,53.0,,6025
"McGrath ANVSA, AK",283.0,,45.0,,6895
"Solomon ANVSA, AK",0.0,,9.0,,7500
"Skull Valley Reservation, UT",29.0,,30.0,,3840
"Sand Point ANVSA, AK",1372.0,,160.0,,7410
"Paiute (UT) Reservation, UT",378.0,,132.0,,2625
"Waiohinu Hawaiian Home Land, HI",0.0,,11.0,,5283
"Chemehuevi Reservation, CA",352.0,,73.0,,0585
"Fort Mojave Reservation and Off-Reservation Trust Land, AZ--CA--NV",1754.0,,331.0,,1235
"Kalispel Reservation and Off-Reservation Trust Land, WA",210.0,,77.0,,1735
"Chickahominy (state) SDTSA, VA",3601.0,,189.0,,9580
"Ramona Village, CA",0.0,,12.0,,3070
"Wales ANVSA, AK",170.0,,35.0,,7740
"Fort McDowell Yavapai Nation Reservation, AZ",1104.0,,90.0,,1220
"Lower Sioux Indian Community, MN",551.0,,100.0,,2055
"Ouzinkie ANVSA, AK",180.0,,63.0,,7180
"Narragansett Reservation, RI",0.0,,13.0,,2415
"Chignik Lagoon ANVSA, AK",75.0,,30.0,,6300
"Chefornak ANVSA, AK",501.0,,69.0,,6275
"Salamatof ANVSA, AK",1015.0,,141.0,,7400
"Jamul Indian Village, CA",0.0,,12.0,,1670
"Rosebud Indian Reservation and Off-Reservation Trust Land, SD",11418.0,,177.0,,3235
"Bay Mills Reservation and Off-Reservation Trust Land, MI",1263.0,,121.0,,0170
"Shinnecock Reservation (state), NY",16.0,,20.0,,9370
"Timbi-Sha Shoshone Reservation and Off-Reservation Trust Land, CA--NV",24.0,,10.0,,4180
"Nienie Hawaiian Home Land, HI",0.0,,11.0,,5166
"Picuris Pueblo, NM",2216.0,,243.0,,2785
"Maluohai Hawaiian Home Land, HI",1238.0,,201.0,,5148
"Manzanita Reservation and Off-Reservation Trust Land, CA",61.0,,36.0,,2115
"Mississippi Choctaw Reservation, MS",7867.0,,490.0,,2300
"Tonawanda Reservation, NY",452.0,,120.0,,4225
"San Felipe Pueblo/Santa Ana Pueblo joint-use area, NM",0.0,,12.0,,4930
"Tanana ANVSA, AK",242.0,,38.0,,7540
"Tyonek ANVSA, AK",348.0,,85.0,,7655
"Panaewa (Agricultural) Hawaiian Home Land, HI",649.0,,98.0,,5176
"Newhalen ANVSA, AK",121.0,,46.0,,7035
"Ho-Chunk Nation Reservation and Off-Reservation Trust Land, WI--MN",1632.0,,211.0,,1450
"Lone Pine Reservation, CA",157.0,,48.0,,1970
"San Manuel Reservation and Off-Reservation Trust Land, CA",51.0,,33.0,,3445
"Honolulu Makai Hawaiian Home Land, HI",0.0,,11.0,,5030
"Arctic Village ANVSA, AK",153.0,,32.0,,6140
"Mary's Igloo ANVSA, AK",0.0,,9.0,,6915
"Nunam Iqua ANVSA, AK",167.0,,42.0,,7133
"Acoma Pueblo and Off-Reservation Trust Land, NM",2784.0,,256.0,,0010
"South Naknek ANVSA, AK",41.0,,20.0,,7505
"Tuscarora Nation Reservation, NY",1078.0,,123.0,,4360
"Yavapai-Prescott Reservation, AZ",368.0,,195.0,,4710
"Caddo-Wichita-Delaware OTSA, OK",15327.0,,456.0,,5540
"Tanacross ANVSA, AK",141.0,,50.0,,7535
"Dry Creek Rancheria and Off-Reservation Trust Land, CA",0.0,,12.0,,0955
"Augustine Reservation, CA",0.0,,12.0,,0125
"Eastern Chickahominy (state) SDTSA, VA",251.0,,83.0,,9675
"Manley Hot Springs ANVSA, AK",80.0,,29.0,,6900
"Stebbins ANVSA, AK",473.0,,64.0,,7510
"Oscarville ANVSA, AK",64.0,,25.0,,7175
"Poospatuck Reservation (state), NY",692.0,,214.0,,9300
"Blue Lake Rancheria and Off-Reservation Trust Land, CA",72.0,,29.0,,0325
"North Fork Rancheria and Off-Reservation Trust Land, CA",138.0,,50.0,,2495
"Pit River Trust Land, CA",0.0,,12.0,,2835
"Chuathbaluk ANVSA, AK",124.0,,37.0,,6335
"Noatak ANVSA, AK",422.0,,48.0,,7085
"Nikolski ANVSA, AK",26.0,,12.0,,7075
"Galena ANVSA, AK",510.0,,67.0,,6525
"Santa Clara Pueblo and Off-Reservation Trust Land, NM",11693.0,,703.0,,3495
"Santa Ynez Reservation, CA",263.0,,137.0,,3540
"Honokaia Hawaiian Home Land, HI",0.0,,11.0,,5026
"Chickasaw OTSA, OK",312615.0,,731.0,,5580
"Hualapai Indian Reservation and Off-Reservation Trust Land, AZ",1590.0,,181.0,,1545
"Mohegan Reservation and Off-Reservation Trust Land, CT",283.0,,228.0,,2320
"Guidiville Rancheria and Off-Reservation Trust Land, CA",58.0,,48.0,,1400
"Tampa Reservation, FL",0.0,,13.0,,4130
"Fallon Paiute-Shoshone Colony and Off-Reservation Trust Land, NV",74.0,,51.0,,1070
"Kanehili Hawaiian Home Land, HI",1659.0,,631.0,,5067
"Miami OTSA, OK",226.0,,28.0,,5730
"Gakona ANVSA, AK",103.0,,51.0,,6520
"Sault Sainte Marie Reservation and Off-Reservation Trust Land, MI",2180.0,,387.0,,3635
"Manokotak ANVSA, AK",804.0,,156.0,,6905
"Aleknagik ANVSA, AK",204.0,,39.0,,6045
"Kaibab Indian Reservation, AZ",253.0,,88.0,,1720
"Upper Lake Rancheria, CA",105.0,,80.0,,4430
"Chilkat ANVSA, AK",49.0,,14.0,,6310
"Koyuk ANVSA, AK",271.0,,46.0,,6825
"Battle Mountain Reservation and Off-Reservation Trust Land, NV",407.0,,197.0,,0165
"Fort Apache Reservation, AZ",15515.0,,799.0,,1140
"Kolaoa Hawaiian Home Land, HI",0.0,,11.0,,5123
"Quileute Reservation, WA",451.0,,87.0,,3030
"Coconut Creek Trust Land, FL",0.0,,13.0,,0690
"Oneida Nation Reservation, NY",0.0,,12.0,,2555
"Keokea (Agricultural) Hawaiian Home Land, HI",165.0,,137.0,,5114
"Gulkana ANVSA, AK",76.0,,56.0,,6560
"Duck Valley Reservation, NV--ID",1351.0,,234.0,,0965
"Waiahole Hawaiian Home Land, HI",42.0,,25.0,,5223
"Akiachak ANVSA, AK",567.0,,64.0,,6020
"Sitka ANVSA, AK",4701.0,,219.0,,7475
"Lac du Flambeau Reservation, WI",3413.0,,76.0,,1825
"United Cherokee Ani-Yun-Wiya Nation SDTSA, AL",6496.0,,524.0,,9950
"Wells Colony, NV",99.0,,48.0,,4580
"Warm Springs Reservation and Off-Reservation Trust Land, OR",4296.0,,249.0,,4545
"Pitkas Point ANVSA, AK",122.0,,31.0,,7235
"Cow Creek Reservation and Off-Reservation Trust Land, OR",182.0,,62.0,,0815
"Huron Potawatomi Reservation and Off-Reservation Trust Land, MI",62.0,,30.0,,1550
"Morongo Reservation and Off-Reservation Trust Land, CA",777.0,,187.0,,2360
"Anahola (Residential) Hawaiian Home Land, HI",1670.0,,262.0,,5004
"Koyukuk ANVSA, AK",62.0,,19.0,,6830
"Keaukaha Hawaiian Home Land, HI",1693.0,,226.0,,5106
"Craig ANVSA, AK",1613.0,,100.0,,6385
"Leech Lake Reservation and Off-Reservation Trust Land, MN",11229.0,,306.0,,1940
"Four Winds Cherokee (state) SDTSA, LA",31380.0,,1242.0,,9720
"Shoalwater Bay Indian Reservation and Off-Reservation Trust Land, WA",78.0,,47.0,,3780
"Lalamilo Hawaiian Home Land, HI",63.0,,35.0,,5133
"Ruby ANVSA, AK",207.0,,36.0,,7310
"Unalaska ANVSA, AK",4781.0,,132.0,,7695
"Little Traverse Bay Reservation and Off-Reservation Trust Land, MI",73.0,,46.0,,1963
"Muckleshoot Reservation and Off-Reservation Trust Land, WA",4049.0,,421.0,,2375
"San Felipe Pueblo/Santo Domingo Pueblo joint-use area, NM",0.0,,12.0,,4940
"Kapaa Hawaiian Home Land, HI",0.0,,11.0,,5071
"Siletz Reservation and Off-Reservation Trust Land, OR",675.0,,159.0,,3795
"Sac and Fox Nation Reservation and Off-Reservation Trust Land, NE--KS",141.0,,38.0,,3285
"Eastern Cherokee Reservation, NC",9191.0,,605.0,,0990
"Ekwok ANVSA, AK",80.0,,25.0,,6460
"Takotna ANVSA, AK",23.0,,15.0,,7530
"Clifton Choctaw (state) SDTSA, LA",476.0,,106.0,,9630
"Chalkyitsik ANVSA, AK",115.0,,35.0,,6265
"Golovin ANVSA, AK",128.0,,33.0,,6540
"Poarch Creek Reservation and Off-Reservation Trust Land, AL--FL",356.0,,111.0,,2865
"Chickaloon ANVSA, AK",27331.0,,630.0,,6290
"Tununak ANVSA, AK",339.0,,60.0,,7645
"Lac Vieux Desert Reservation, MI",226.0,,63.0,,1830
"Anahola (Agricultural) Hawaiian Home Land, HI",200.0,,56.0,,5003
"Kaltag ANVSA, AK",172.0,,52.0,,6690
"Citizen Potawatomi Nation-Absentee Shawnee OTSA, OK",124874.0,,1161.0,,5600
"Cherokee OTSA, OK",517039.0,,1479.0,,5550
"Grayling ANVSA, AK",176.0,,37.0,,6550
"Minnesota Chippewa Trust Land, MN",0.0,,9.0,,2285
"Pascua Pueblo Yaqui Reservation and Off-Reservation Trust Land, AZ",4111.0,,272.0,,2680
"Pleasant Point Reservation, ME",723.0,,87.0,,2850
"Table Mountain Rancheria, CA",9.0,,14.0,,4110
"Pawnee OTSA, OK",16197.0,,83.0,,5780
"Council ANVSA, AK",0.0,,9.0,,6380
"Santa Rosa Rancheria, CA",940.0,,189.0,,3520
"Kamoku-Kapulena Hawaiian Home Land, HI",36.0,,17.0,,5066
"Panaewa (Residential) Hawaiian Home Land, HI",1327.0,,188.0,,5177
"Grindstone Indian Rancheria, CA",256.0,,93.0,,1395
"Deering ANVSA, AK",154.0,,31.0,,6400
"Colusa Rancheria, CA",27.0,,21.0,,0750
"Kamaoa-Puueo Hawaiian Home Land, HI",11.0,,9.0,,5056
"Kewalo Hawaiian Home Land, HI",394.0,,121.0,,5120
"Ponca (NE) Trust Land, NE--IA",0.0,,11.0,,2900
"Sulphur Bank Rancheria, CA",46.0,,62.0,,4030
"Otoe-Missouria OTSA, OK",969.0,,161.0,,5760
"Capitan Grande Reservation, CA",0.0,,12.0,,0495
"Isabella Reservation, MI",27617.0,,531.0,,1610
"Belkofski ANVSA, AK",0.0,,9.0,,6195
"Honokowai Hawaiian Home Land, HI",0.0,,11.0,,5029
"Princess Kahanu Estates Hawaiian Home Land, HI",1542.0,,326.0,,5198
"Upolu Hawaiian Home Land, HI",0.0,,11.0,,5222
"Kotlik ANVSA, AK",811.0,,76.0,,6815
"Platinum ANVSA, AK",13.0,,7.0,,7245
"Keanae-Wailua Hawaiian Home Land, HI",13.0,,21.0,,5104
"Chevak ANVSA, AK",1144.0,,161.0,,6285
"Barona Reservation and Off-Reservation Trust Land, CA",876.0,,112.0,,0155
"Stewart Community, NV",122.0,,56.0,,3980
"Eklutna ANVSA, AK",43.0,,38.0,,6450
"Napakiak ANVSA, AK",369.0,,47.0,,7010
"Likely Rancheria, CA",0.0,,12.0,,1955
"Kamiloloa-Makakupaia Hawaiian Home Land, HI",77.0,,35.0,,5061
"Wind River Reservation and Off-Reservation Trust Land, WY",26855.0,,427.0,,4610
"Kongiganak ANVSA, AK",441.0,,68.0,,6810
"Hannahville Indian Community and Off-Reservation Trust Land, MI",656.0,,89.0,,1410
"Lake Traverse Reservation and Off-Reservation Trust Land, SD--ND",11052.0,,260.0,,1860
"Lower Elwha Reservation and Off-Reservation Trust Land, WA",603.0,,138.0,,2040
"Ekuk ANVSA, AK",0.0,,9.0,,6455
"Paimiut ANVSA, AK",0.0,,9.0,,7185
"Pamunkey Reservation (state), VA",87.0,,33.0,,9260
"Lanai City Hawaiian Home Land, HI",90.0,,56.0,,5134
"Sycuan Reservation and Off-Reservation Trust Land, CA",172.0,,52.0,,4090
"Yerington Colony, NV",216.0,,115.0,,4725
"Grand Portage Reservation and Off-Reservation Trust Land, MN",722.0,,96.0,,1355
"Golden Hill Paugussett (state) Reservation, CT",1.0,,3.0,,9100
"Pauahi Hawaiian Home Land, HI",0.0,,11.0,,5181
"New Stuyahok ANVSA, AK",557.0,,96.0,,7050
"Nooksack Reservation and Off-Reservation Trust Land, WA",1139.0,,190.0,,2475
"Rumsey Indian Rancheria, CA",2.0,,3.0,,3265
"Bill Moore's ANVSA, AK",0.0,,9.0,,6225
"Ivanof Bay ANVSA, AK",0.0,,9.0,,6650
"Rohnerville Rancheria, CA",23.0,,12.0,,3220
"Saint Croix Reservation and Off-Reservation Trust Land, WI",636.0,,87.0,,3305
"Skagway ANVSA, AK",1061.0,,123.0,,7485
"Fort Yuma Indian Reservation, CA--AZ",1265.0,,278.0,,1280
"Apache Choctaw (state) SDTSA, LA",6903.0,,401.0,,9515
"MaChis Lower Creek (state) SDTSA, AL",22625.0,,562.0,,9820
"Kodiak ANVSA, AK",0.0,,9.0,,6795
"Cheyenne River Reservation and Off-Reservation Trust Land, SD",8556.0,,21.0,,0605
"Greenville Rancheria, CA",28.0,,19.0,,1380
"Tama Reservation (state), GA",11.0,,12.0,,9400
"Kapolei Hawaiian Home Land, HI",0.0,,11.0,,5083
"Leialii Hawaiian Home Land, HI",568.0,,162.0,,5135
"Peoria OTSA, OK",5053.0,,196.0,,5795
"Kipnuk ANVSA, AK",613.0,,65.0,,6750
"Beaver Creek SDTSA, SC",1005.0,,209.0,,9525
"Pine Ridge Reservation, SD--NE",19895.0,,163.0,,2810
"Nondalton ANVSA, AK",114.0,,44.0,,7100
"San Felipe Pueblo, NM",3544.0,,417.0,,3400
"Yakama Nation Reservation and Off-Reservation Trust Land, WA",30810.0,,847.0,,4690
"Waiakea Hawaiian Home Land, HI",0.0,,11.0,,5236
"Canyon Village ANVSA, AK",0.0,,9.0,,6257
"Hooper Bay ANVSA, AK",1101.0,,122.0,,6595
"Saxman ANVSA, AK",360.0,,58.0,,7420
"Shaktoolik ANVSA, AK",294.0,,40.0,,7450
"La Posta Indian Reservation, CA",31.0,,19.0,,1895
"Sappony SDTSA, NC",2611.0,,394.0,,9865
"Pechanga Reservation, CA",343.0,,128.0,,2745
"Quapaw OTSA, OK",5092.0,,180.0,,5810
"Brevig Mission ANVSA, AK",407.0,,41.0,,6240
"Gambell ANVSA, AK",601.0,,55.0,,6530
"Huslia ANVSA, AK",404.0,,50.0,,6610
"Kokhanok ANVSA, AK",150.0,,56.0,,6800
"Coyote Valley Reservation, CA",300.0,,103.0,,0825
"Gila River Indian Reservation, AZ",11150.0,,881.0,,1310
"Ute Mountain Reservation and Off-Reservation Trust Land, CO--NM--UT",1544.0,,360.0,,4470
"Waiohuli (Residential) Hawaiian Home Land, HI",1277.0,,246.0,,5286
"Match-e-be-nash-she-wish Band of Pottawatomi Reservation and Off-Reservation Trust Land, MI",39.0,,59.0,,2150
"Teller ANVSA, AK",182.0,,30.0,,7570
"Santa Ysabel Reservation, CA",198.0,,53.0,,3550
"Haiku Hawaiian Home Land, HI",0.0,,11.0,,5009
"Atqasuk ANVSA, AK",164.0,,56.0,,6165
"Bad River Reservation, WI",1595.0,,153.0,,0140
"East Kapolei Hawaiian Home Land, HI",0.0,,11.0,,5008
"Chitina ANVSA, AK",73.0,,49.0,,6330
"Birch Creek ANVSA, AK",2.0,,3.0,,6235
"Kalawahine Hawaiian Home Land, HI",384.0,,71.0,,5053
"Paukukalo Hawaiian Home Land, HI",845.0,,208.0,,5186
"Rampart ANVSA, AK",60.0,,26.0,,7300
"Tatitlek ANVSA, AK",78.0,,46.0,,7555
"Red Lake Reservation, MN",5859.0,,62.0,,3100
"Snoqualmie Reservation, WA",0.0,,12.0,,3860
"Ponca OTSA, OK",2119.0,,140.0,,5800
"Makah Indian Reservation, WA",1632.0,,170.0,,2085
"Perryville ANVSA, AK",86.0,,31.0,,7215
"White Mountain ANVSA, AK",186.0,,28.0,,7745
"Auburn Rancheria and Off-Reservation Trust Land, CA",0.0,,12.0,,0120
"Fort Pierce Reservation, FL",87.0,,67.0,,1260
"Iowa (KS-NE) Reservation and Off-Reservation Trust Land, KS--NE",173.0,,36.0,,1590
"Crooked Creek ANVSA, AK",90.0,,29.0,,6390
"Telida ANVSA, AK",0.0,,9.0,,7565
"Prairie Band of Potawatomi Nation Reservation, KS",1645.0,,169.0,,2980
"Trinidad Rancheria and Off-Reservation Trust Land, CA",170.0,,76.0,,4275
"Creek OTSA, OK",792241.0,,1465.0,,5620
"Kahikinui Hawaiian Home Land, HI",0.0,,11.0,,5041
"Cocopah Reservation, AZ",1203.0,,197.0,,0695
"Menominee Reservation, WI",3390.0,,241.0,,2175
"Waianae Kai Hawaiian Home Land, HI",782.0,,100.0,,5239
"Klawock ANVSA, AK",675.0,,75.0,,6765
"Standing Rock Reservation, SD--ND",8618.0,,21.0,,3970
"Andreafsky ANVSA, AK",113.0,,28.0,,6095
"Algaaciq ANVSA, AK",527.0,,72.0,,6065
"Eek ANVSA, AK",518.0,,54.0,,6440
"Pokagon Reservation and Off-Reservation Trust Land, MI",86.0,,45.0,,2890
"Iowa OTSA, OK",6590.0,,461.0,,5670
"Klamath Reservation, OR",38.0,,19.0,,1785
"Tuluksak ANVSA, AK",415.0,,58.0,,7630
"Wainwright ANVSA, AK",508.0,,139.0,,7735
"Mashpee Wampanoag Trust Land, MA",0.0,,12.0,,2147
"Round Valley Reservation and Off-Reservation Trust Land, CA",416.0,,109.0,,3250
"Kalaupapa Hawaiian Home Land, HI",75.0,,16.0,,5051
"Minto ANVSA, AK",229.0,,38.0,,6965
"Chehalis Reservation and Off-Reservation Trust Land, WA",922.0,,284.0,,0575
"Holy Cross ANVSA, AK",183.0,,32.0,,6585
"Colorado River Indian Reservation, AZ--CA",9929.0,,367.0,,0735
"Dresslerville Colony, NV",452.0,,127.0,,0940
"Saint Regis Mohawk Reservation, NY",3302.0,,18.0,,3320
"Kaumana Hawaiian Home Land, HI",134.0,,47.0,,5086
"Atka ANVSA, AK",35.0,,19.0,,6150
"South Maui Hawaiian Home Land, HI",0.0,,11.0,,5213
"Mekoryuk ANVSA, AK",226.0,,35.0,,6935
"Big Lagoon Rancheria, CA",4.0,,4.0,,0240
"Occaneechi-Saponi SDTSA, NC",9522.0,,532.0,,9838
"Lesnoi ANVSA, AK",0.0,,9.0,,6860
"Newtok ANVSA, AK",360.0,,53.0,,7055
"Paucatuck Eastern Pequot Reservation (state), CT",36.0,,21.0,,9280
"Wampanoag-Aquinnah Trust Land, MA",66.0,,44.0,,4530
"Knik ANVSA, AK",76056.0,,633.0,,6785
"Tesuque Pueblo and Off-Reservation Trust Land, NM",921.0,,130.0,,4170
"Tuolumne Rancheria, CA",196.0,,71.0,,4330
"Kapaakea Hawaiian Home Land, HI",184.0,,59.0,,5076
"Choctaw OTSA, OK",231451.0,,574.0,,5590
"Stony River ANVSA, AK",41.0,,20.0,,7525
"Laytonville Rancheria, CA",251.0,,76.0,,1925
"Picayune Rancheria and Off-Reservation Trust Land, CA",111.0,,76.0,,2775
"Passamaquoddy Trust Land, ME",0.0,,10.0,,2695
"Walker River Reservation, NV",1209.0,,165.0,,4515
"Miami/Peoria joint-use OTSA, OK",4279.0,,178.0,,5970
"Hughes ANVSA, AK",90.0,,24.0,,6605
"Napaimute ANVSA, AK",0.0,,9.0,,7005
"Alabama-Coushatta Reservation and Off-Reservation Trust Land, TX",606.0,,117.0,,0050
"San Carlos Reservation, AZ",10443.0,,502.0,,3355
"Point Hope ANVSA, AK",592.0,,154.0,,7250
"Burns Paiute Indian Colony and Off-Reservation Trust Land, OR",96.0,,50.0,,0400
"Quartz Valley Reservation and Off-Reservation Trust Land, CA",198.0,,76.0,,3020
"Viejas Reservation and Off-Reservation Trust Land, CA",459.0,,230.0,,4500
"Puukapu Hawaiian Home Land, HI",961.0,,259.0,,5201
"Bridgeport Reservation and Off-Reservation Trust Land, CA",62.0,,48.0,,0350
"Campo Indian Reservation, CA",393.0,,120.0,,0450
"Goshute Reservation, NV--UT",140.0,,56.0,,1340
"Flathead Reservation, MT",29717.0,,332.0,,1110
"L'Anse Reservation and Off-Reservation Trust Land, MI",3564.0,,291.0,,1880
"Homuula-Upper Piihonua Hawaiian Home Land, HI",2.0,,4.0,,5018
"Lac Courte Oreilles Reservation and Off-Reservation Trust Land, WI",2721.0,,211.0,,1815
"Soboba Reservation and Off-Reservation Trust Land, CA",417.0,,106.0,,3870
"Waianae Hawaiian Home Land, HI",2542.0,,263.0,,5238
"Kwethluk ANVSA, AK",653.0,,68.0,,6835
"Fort Independence Reservation, CA",74.0,,22.0,,1195
"Lumbee (state) SDTSA, NC",503825.0,,1605.0,,9815
"Ketchikan ANVSA, AK",13208.0,,116.0,,6725
"Big Pine Reservation and Off-Reservation Trust Land, CA",422.0,,61.0,,0250
"Maricopa (Ak Chin) Indian Reservation and Off-Reservation Trust Land, AZ",1348.0,,320.0,,2130
"San Ildefonso Pueblo and Off-Reservation Trust Land, NM",1881.0,,149.0,,3415
"Shingle Springs Rancheria and Off-Reservation Trust Land, CA",140.0,,86.0,,3750
"Hamilton ANVSA, AK",0.0,,9.0,,6570
"Cahuilla Reservation, CA",82.0,,40.0,,0435
"Fort Sill Apache Indian Reservation, NM",0.0,,12.0,,1270
"Kotzebue ANVSA, AK",3288.0,,25.0,,6820
"Yurok Reservation, CA",811.0,,127.0,,4760
"Dillingham ANVSA, AK",2315.0,,169.0,,6405
"Kekaha Hawaiian Home Land, HI",555.0,,145.0,,5111
"Grand Traverse Reservation and Off-Reservation Trust Land, MI",725.0,,117.0,,1370
"Chignik ANVSA, AK",61.0,,28.0,,6295
"Cattaraugus Reservation, NY",2208.0,,186.0,,0540
"Ely Reservation, NV",230.0,,72.0,,1040
"Kickapoo (KS) Reservation, KS",3983.0,,279.0,,1770
"Nulato ANVSA, AK",257.0,,36.0,,7130
"Honomu Hawaiian Home Land, HI",0.0,,11.0,,5031
"Seneca-Cayuga OTSA, OK",4532.0,,201.0,,5835
"Elk Valley Rancheria and Off-Reservation Trust Land, CA",78.0,,34.0,,1010
"Oneida (WI) Reservation and Off-Reservation Trust Land, WI",24800.0,,412.0,,2560
"Tule River Reservation and Off-Reservation Trust Land, CA",1227.0,,218.0,,4300
"Yankton Reservation, SD",6829.0,,166.0,,4700
"Kickapoo (KS) Reservation/Sac and Fox Nation Trust Land joint-use area, KS",0.0,,10.0,,4910
"Havasupai Reservation, AZ",15.0,,22.0,,1440
"Redwood Valley Rancheria, CA",323.0,,82.0,,3115
"Enterprise Rancheria and Off-Reservation Trust Land, CA",0.0,,12.0,,1055
"Waiku-Hana Hawaiian Home Land, HI",0.0,,11.0,,5248
"Cayuga Nation TDSA, NY",3081.0,,270.0,,8100
"Agua Caliente Indian Reservation and Off-Reservation Trust Land, CA",26028.0,,729.0,,0020
"Fort Yukon ANVSA, AK",533.0,,64.0,,6515
"Emmonak ANVSA, AK",761.0,,86.0,,6480
"Lookout Rancheria, CA",17.0,,10.0,,1980
"Bethel ANVSA, AK",6424.0,,19.0,,6205
"Atmautluak ANVSA, AK",209.0,,45.0,,6160
"Iliamna ANVSA, AK",63.0,,31.0,,6625
"Kasaan ANVSA, AK",75.0,,29.0,,6705
"Napaskiak ANVSA, AK",356.0,,57.0,,7020
"Pilot Point ANVSA, AK",83.0,,44.0,,7225
"Crow Reservation and Off-Reservation Trust Land, MT",7184.0,,327.0,,0845
"Mesa Grande Reservation, CA",78.0,,27.0,,2190
"Noorvik ANVSA, AK",597.0,,82.0,,7110
"MOWA Choctaw Reservation (state), AL",81.0,,40.0,,9240
"Kalskag ANVSA, AK",222.0,,34.0,,6685
"Mechoopda TDSA, CA",3344.0,,341.0,,8450
"Douglas ANVSA, AK",6134.0,,321.0,,6420
"Naknek ANVSA, AK",464.0,,81.0,,6990
"Nanakuli Hawaiian Home Land, HI",5141.0,,477.0,,5161
"Washoe Ranches Trust Land, NV--CA",3096.0,,175.0,,4560
"Hoopa Valley Reservation, CA",3573.0,,388.0,,1490
"Houlton Maliseet Reservation and Off-Reservation Trust Land, ME",325.0,,102.0,,1530
"Ponohawaii Hawaiian Home Land, HI",16.0,,17.0,,5196
"Jamestown S'Klallam Reservation and Off-Reservation Trust Land, WA",9.0,,10.0,,1655
"Los Coyotes Reservation, CA",105.0,,39.0,,1995
"Sauk-Suiattle Reservation, WA",63.0,,31.0,,3625
"Kickapoo OTSA, OK",20991.0,,668.0,,5700
"Elim ANVSA, AK",303.0,,45.0,,6470
"False Pass ANVSA, AK",78.0,,25.0,,6500
"Levelock ANVSA, AK",76.0,,32.0,,6865
"Lime Village ANVSA, AK",8.0,,7.0,,6875
"Piihonua Hawaiian Home Land, HI",92.0,,53.0,,5193
"Clarks Point ANVSA, AK",48.0,,26.0,,6360
"Kobuk ANVSA, AK",143.0,,43.0,,6790
"Santee Reservation, NE",1019.0,,72.0,,3565
"Waimea Hawaiian Home Land, HI",0.0,,11.0,,5281
"Nome ANVSA, AK",4014.0,,71.0,,7095
"Venetie ANVSA, AK",134.0,,27.0,,7725
"Chicken Ranch Rancheria and Off-Reservation Trust Land, CA",0.0,,12.0,,0620
"Makaha Valley Hawaiian Home Land, HI",0.0,,11.0,,5139
"Bois Forte Reservation and Off-Reservation Trust Land, MN",1383.0,,221.0,,0335
"Cedarville Rancheria and Off-Reservation Trust Land, CA",28.0,,27.0,,0555
"Stockbridge Munsee Community and Off-Reservation Trust Land, WI",765.0,,103.0,,4015
"Port Madison Reservation, WA",7846.0,,276.0,,2925
"Santo Domingo Pueblo, NM",3192.0,,341.0,,3585
"New Koliganek ANVSA, AK",161.0,,38.0,,7040
"Yavapai-Apache Nation Reservation, AZ",712.0,,226.0,,4708
"Karuk Reservation and Off-Reservation Trust Land, CA",513.0,,124.0,,1750
"Las Vegas Indian Colony, NV",126.0,,98.0,,1915
"Tunica-Biloxi Reservation and Off-Reservation Trust Land, LA",141.0,,68.0,,4315
"Lualualei Hawaiian Home Land, HI",34.0,,20.0,,5136
"Georgetown ANVSA, AK",0.0,,9.0,,6535
"Eagle ANVSA, AK",25.0,,12.0,,6430
"Port Lions ANVSA, AK",190.0,,64.0,,7275
"Nez Perce Reservation, ID",18770.0,,442.0,,2445
"Mattaponi Reservation (state), VA",48.0,,24.0,,9230
"St. George ANVSA, AK",78.0,,25.0,,7340
"Aroostook Band of Micmac Trust Land, ME",250.0,,69.0,,0115
"Kaohe-Olaa Hawaiian Home Land, HI",0.0,,11.0,,5069
"San Pasqual Reservation, CA",843.0,,157.0,,3460
"Nightmute ANVSA, AK",189.0,,34.0,,7065
"Nisqually Reservation, WA",666.0,,144.0,,2460
"Echota Cherokee (state) SDTSA, AL",56691.0,,1716.0,,9680
"Goodnews Bay ANVSA, AK",192.0,,42.0,,6545
"Mountain Village ANVSA, AK",828.0,,243.0,,6975
"Kalamaula Hawaiian Home Land, HI",421.0,,137.0,,5046
"Big Valley Rancheria, CA",195.0,,100.0,,0275
"Robinson Rancheria and Off-Reservation Trust Land, CA",366.0,,148.0,,3195
"Moloaa Hawaiian Home Land, HI",0.0,,11.0,,5156
"Port Heiden ANVSA, AK",78.0,,34.0,,7270
"Upper Sioux Community and Off-Reservation Trust Land, MN",132.0,,39.0,,4445
"Igiugig ANVSA, AK",62.0,,22.0,,6620
"Little River Reservation and Off-Reservation Trust Land, MI",107.0,,53.0,,1960
"Red Devil ANVSA, AK",21.0,,15.0,,7305
"Resighini Rancheria, CA",14.0,,11.0,,3145
"Skokomish Reservation, WA",761.0,,135.0,,3825
"Keahuolu Hawaiian Home Land, HI",0.0,,11.0,,5098
"King Cove ANVSA, AK",1074.0,,168.0,,6735
"Lake Minchumina ANVSA, AK",14.0,,11.0,,6850
"Akhiok ANVSA, AK",57.0,,31.0,,6015
"Nuiqsut ANVSA, AK",469.0,,171.0,,7125
"Bishop Reservation, CA",1693.0,,170.0,,0290
"Big Cypress Reservation, FL",571.0,,69.0,,0225
"Kickapoo (TX) Reservation and Off-Reservation Trust Land, TX",430.0,,167.0,,1775
"Prairie Island Indian Community and Off-Reservation Trust Land, MN",158.0,,59.0,,2985
"Susanville Indian Rancheria and Off-Reservation Trust Land, CA",577.0,,139.0,,4060
"Tulalip Reservation and Off-Reservation Trust Land, WA",9997.0,,407.0,,4290
"Hopi Reservation and Off-Reservation Trust Land, AZ",9227.0,,613.0,,1505
"Immokalee Reservation, FL",447.0,,165.0,,1555
"Red Cliff Reservation and Off-Reservation Trust Land, WI",1282.0,,107.0,,3085
"Ysleta del Sur Pueblo and Off-Reservation Trust Land, TX",1220.0,,234.0,,4755
"Inaja and Cosmit Reservation, CA",0.0,,12.0,,1560
"Fond du Lac Reservation and Off-Reservation Trust Land, MN--WI",3944.0,,259.0,,1125
"Seminole (FL) Trust Land, FL",0.0,,13.0,,3665
"Northway ANVSA, AK",262.0,,83.0,,7115
"Grand Ronde Community, OR",518.0,,125.0,,1365
"Star Muskogee Creek (state) SDTSA, AL",6190.0,,499.0,,9880
"Taos Pueblo and Off-Reservation Trust Land, NM",5129.0,,551.0,,4140
"Nanticoke Indian Tribe (state) SDTSA, DE",8546.0,,476.0,,9830
"Papakolea Hawaiian Home Land, HI",1505.0,,344.0,,5179
"Wailau Hawaiian Home Land, HI",0.0,,11.0,,5251
"Buckland ANVSA, AK",608.0,,63.0,,6250
"Dot Lake ANVSA, AK",38.0,,23.0,,6415
"Northwestern Shoshone Reservation, UT",0.0,,11.0,,2505
"Pueblo de Cochiti, NM",1661.0,,142.0,,0680
"Schaghticoke Reservation (state), CT",11.0,,21.0,,9350
"St. Michael ANVSA, AK",468.0,,57.0,,7375
"Chignik Lake ANVSA, AK",51.0,,19.0,,6305
