street_url,street_name,neighborhood,description,map_url
https://lastreetnames.com/street/eazy-street/,Eazy Street,Compton,"Named for rapper/entrepreneur Eric “Eazy-E” Wright (1964-1995). Born and raised in Compton, Wright was a high school dropout and drug dealer before turning his life around by entering the local hip hop scene. In 1987, he cofounded Ruthless Records and formed the group N.W.A with other artists like O’Shea “Ice Cube” Jackson and Andre “Dr. Dre” Young. Their debut LPStraight Outta Comptonwas released the following year. Although it remains a landmark album, N.W.A. itself was not to last: tensions between the members brought the group to an end in 1991. Wright then focused on his record label and his solo career until dying from AIDS-related illness just one month after receiving a surprise diagnosis. In honor of Wright’s philanthropy and his influence over popular culture, the City of Compton renamed part of Auto Drive South (atAlameda) Eazy Street on November 22nd, 2023.",https://lastreetnames.com/wp-content/uploads/2024/03/eazy-street-map-1.png
https://lastreetnames.com/street/echandia-street/,Echandia Street,Boyle Heights,"(Mis)named for José María de Echeandía, governor of Mexican-era Alta California in 1825-1831. Little is known about Echeandía, including his birth and death dates, but he was a civil engineer in the Mexican army who, while surveying the boundaries of Mexico City, was ordered to go north and run California. Echeandía didn’t wish to live in foggy Monterey, the territory’s capital, so he operated out of San Diego. He briefly co-governed in 1832-1833 after the unpopular Manuel Victoria was deposed, then went back to Mexico and civil engineering. A “dream map” of Los Angeles, first laid out in 1855 and revised in 1871, reveals city planners’ intentions of naming five thoroughfares after California’s old Mexican governors:Pico,Micheltorena,Alvarado,Figueroa, and Echandia. (His name was misspelled on the map.) Echandia Street was meant to be west of the L.A. River, most likely whereCentral Avenuenow lies. It never existed, but Boyle Heights’s Echandia Street follows its trajectory.",https://lastreetnames.com/wp-content/uploads/2022/05/echandia-street-map.png
https://lastreetnames.com/street/echo-park-avenue/,Echo Park Avenue,Echo Park,"Long ago, L.A.’s primary water source was its river. To help quench the young city’s thirst, areservoirwas dug out here in 1868, with the Los Angeles River feeding it through a ditch. It was christened “Reservoir Site No. 4”; you know it today as Echo Park Lake. Since the City neglected to claim the land around the reservoir, real estate speculator Thomas Kelley snapped part of it up (with financial backing from Dr. WilliamLeMoyneWills and JosephHyans, among others) and began offering “lakeside” lots in 1887 on what he dubbed theMontanatract. After some legal squabbles, Kelley agreed to donate 33 acres back to the city for parkland in 1891. Echo Park was announced the following year, its name supposedly coined by city parks superintendent Joseph Henry Tomlinson for the echoes he heard around the reservoir. The park finally opened in 1895 but would take yet another year to reach its final form. Echo Park Road – now Avenue – was named in 1894.",https://lastreetnames.com/wp-content/uploads/2022/04/echo-park-avenue-map.png
https://lastreetnames.com/street/edendale-place/,Edendale Place,Silver Lake,"The neighborhood of Edendale, site of L.A.’s earliest movie studios (seeSelig Placefor some background), derives its name from the Edendale tract, laid out just south of this street in 1902 by prolific developer Moses LangleyWicks. “Edendale” is simply a compound of “Eden”, as in paradise, and “dale”, as in valley. Wicks didn’t invent the name: it’s been used in English-speaking countries since at least 1828; a short story published that year – author unknown – cited the fictitious Edendale Valley in Herefordshire, UK. As for Edendale Place, it was born in 1906 on the Edendale Terrace tract, owned by a fellow named G. Frean Morcom, about whom little is known, although the lower part ofCerro Gordo Streetwas originally called Morcom Avenue. This tract was quite small and located on property formerly owned by Ozro W.Childsand John S.Maltman. Maltman had been Morcom’s attorney in Chicago in 1875, and the two were partners in an L.A. oil company in 1894, so you can guess how Morcom came by this bit of land.",https://lastreetnames.com/wp-content/uploads/2022/09/edendale-place-map.png
https://lastreetnames.com/street/edgemont-street/,Edgemont Street,East Hollywood,"The name itself is no conundrum: “Edgemont” is derived from “edge of the mountain” and refers to its location in the Hollywood foothills. But Edgemont was originally a short-lived farming settlement, established nearby back in 1886. (Edgemont Street was named by 1888.) While various individuals were associated with Edgemont, it appears the ringleaders were Reverend Elijah Cash (1840-1904) and his wife Emma (later Emma Cash Clapp, 1841-1947; yep, she lived to be 106). Elijah was Canadian; Emma was born in England but raised in Canada. They came to Los Angeles in 1884. Two years later, they had a 20 acre citrus ranch at present-dayLos FelizandCommonwealthwhile Elijah ran the Edgemont Church of Christ at present-dayVermontandAmbrose. By 1891, however, the Cashes had given up on Edgemont and were living in Silver Lake.",https://lastreetnames.com/wp-content/uploads/2023/07/edgemont-street-map.png
https://lastreetnames.com/street/edinburgh-avenue/,Edinburgh Avenue,Beverly Grove,"Edinburgh Avenue was named in 1923, but only on the small bit south of Third Street. From Third up toRosewoodit was called Society Avenue. North of Rosewood it was Donald Avenue. In 1923, folks living on Society petitioned for it to be changed to Donald, claiming the old name made them “open to ridicule” – although Society Avenue sure sounds less ridiculous than Donald Avenue, if you ask me. Anyway, the whole shebang was changed to Edinburgh in 1925. As for the inspiration behind the street name, I’ve got nothing. Edinburgh’s original tract was owned by a trust company run by banker Leo S. Chandler, who had no ties to Scotland. But Scottish place names, with their noble yet rugged appeal, have long been borrowed by Los Angeles streets… and you can’t get more Scottish than Edinburgh.",https://lastreetnames.com/wp-content/uploads/2023/01/edinburgh-avenue-map.png
https://lastreetnames.com/street/edith-avenue/,Edith Avenue,Alhambra,"Named for Edith Octavia Shorb Steele (1872-1954), one of James De Barth and Sue Shorb’s 11 children, many of whom have namesake streets here on what was then the Shorbs’ vast property. (SeeShorb Streetfor more.) Edith was among the first graduates of theRamonaConvent high school, funded by her father. After his death, she moved to San Francisco with most of the other Shorbs in 1900. Her family was central in that city’s high society, although Edith was reportedly less of a social butterfly than her siblings. In 1904, she married Sacramento’s James King Steele. A travel writer who specialized in East Asia, James spent years crisscrossing the Pacific, often with Edith in tow. They even lived in Manila in the early 1930s. On top of raising her own kids, Edith also had to deal with two disturbed brothers, Donald and Norbert. In one 1915 incident, Norbert threatened to kill Edith and her husband, and she tried to have him committed.",https://lastreetnames.com/wp-content/uploads/2022/04/edith-avenue-map.png
https://lastreetnames.com/street/edward-everett-horton-lane/,Edward Everett Horton Lane,Encino,"Bullwinklefans will remember Edward Everett Horton (1886-1970) as the narrator ofFractured Fairy Tales, but the Brooklyn-born actor was a famous face during Hollywood’s Golden Age, playing supporting roles in classics likeThe Front Page,Top Hat, andArsenic and Old Lace. Horton’s 18 acre ranch, whimsically dubbed “Belleigh Acres”, was located here on a former portion ofAmestoy Avenue. Horton, who never married – more on that in a second – lived with his mother here on the ranch. Some famous friends would stay a while too: F. Scott Fitzgerald worked onThe Last Tycoonin Horton’s guest house. It has also been claimed that Horton had a life partner, actor Gavin Gordon (1901-1983), who lived here as well. Of course neither thespian ever publicly addressed his sexuality, so we can only presume. At any rate, Horton was forced to relocate once the 101 freeway cut through his property. This cul-de-sac was named in his honor in 1968.",https://lastreetnames.com/wp-content/uploads/2022/05/edward-everett-horton-lane-map-1.png
https://lastreetnames.com/street/effie-street/,Effie Street,Echo Park,"Effie was a popular girls’ name in the late 19th century, so Effie Street, named by 1884, was surely in honor of somebody’s daughter. But who? There are several candidates, the most likely being Effie Baxter (1864-1938): an 1884 map showsBaxter Streetdirectly north of Effie Street, thus suggesting a connection. (It’s worth mentioning that Effie’s father Reuben Baxter worked for the prominentChildsfamily.) Effie M. Baxter was born in Wisconsin and raised in L.A. An outstanding student according to 1880s newspapers, she went on to become an osteopath, was married and widowed twice over, and lived in Phoenix for many years. She died as Dr. Effie Baxter Brooks.",https://lastreetnames.com/wp-content/uploads/2022/04/effie-street-map.png
https://lastreetnames.com/street/el-camino/,El Camino,Beverly Hills,"This street was originally called Speedway Drive, in honor of the Beverly Hills Speedway, a wooden(!) automobile racetrack that existed here until 1924. (SeeDurant Drivefor more on the Speedway and the streets named after its directors.) The name was changed to El Camino – Spanish for “the way” – in 1930. Some city official must have felt that motorists were misinterpreting “speedway” as permission to race down the street. Nitpickers’ note: This street is officially just El Camino, full stop. Or at least it was – BH’s more recent street signs have it as “S. El Camino Drive”, and in fact various maps were adding the “Drive” even back in the 1930s.",https://lastreetnames.com/wp-content/uploads/2022/07/el-camino-drive-map.png
https://lastreetnames.com/street/el-centro-avenue/,El Centro Avenue,Hollywood,"As you might guess,el centromeans “the center” in Spanish, and this street signified the center of U.S. Senator CorneliusCole’s original ranch. Here Cole founded the town of Colegrove, south ofSunset Boulevard, just as Harvey and DaeidaWilcoxwere establishing Hollywood north of Sunset. (It’s debatable who actually named Sunset, but my money’s on the Wilcoxes.) The El Centro tract and avenue were set up in 1902. One of the Wilcoxes’ streets, which they optimistically dubbed Grand Avenue, would eventually be taken over by El Centro. That probably suited Senator Cole just fine, as there was reportedly bad blood between him and Ida Wilcox.",https://lastreetnames.com/wp-content/uploads/2022/05/el-centro-avenue-map.png
https://lastreetnames.com/street/el-escorpion-road/,El Escorpion Road,Woodland Hills,"It may look like your standard 1960s suburban street, but El Escorpion Road was named way back in 1914 on a tract owned by dairyman George E.Platt. The name alludes to Rancho El Escorpión, once located due north of here. Said rancho – presumably named for the scorpions found therein – was a 1,109.65 acre land grant deeded in 1845 by then-governor PíoPicoto a Chumash chief named Odon, his son-in-law Urbano, and Urbano’s son Manuel. There followed decades of muddled land sales and lawsuits. Of the rancho’s various owners, the most famous was Basque sheepherder Miguel Leonis (1822-1889), whose Leonis Adobe still stands inCalabasas. His housekeeper Espiritu Chijulla (1836-1906), one of Odon’s daughters, became Leonis’s common-law wife and later waged a lengthy legal battle for her share of his estate. She emerged victorious just seven months before her death. George Platt purchased the property from her son Juan in 1912 in order to grow his dairy.",https://lastreetnames.com/wp-content/uploads/2023/03/el-escorpion-road-map.png
https://lastreetnames.com/street/el-manor-avenue/,El Manor Avenue,Westchester,"“El Manor” – a bit of Spanglish for you – refers to Farrar Manor, one of the four tracts that established theWestchesterneighborhood. It was developed in 1941 by Bert C. Farrar(1873-1960), a Michigander who got into real estate while living in Seattle. He came to the Southland in the 1920s and opened theChevy Chasesubdivision in Glendale. Chevy Chase and Farrar Manor remain Farrar’s most significant projects, although much of Farrar Manor’s original acreage was eaten up by LAX’s runway expansion, beginning in the late 1950s. (A street here called Ceylon Avenue disappeared completely after 1969.)",https://lastreetnames.com/wp-content/uploads/2022/04/el-manor-avenue-map.png
https://lastreetnames.com/street/fair-oaks-avenue/,Fair Oaks Avenue,Altadena,"This street, christened by 1875, takes its name from Fair Oaks Ranch, the 262 acre property that convinced a group of settlers to establishPasadena. Benjamin S.Eaton(1823-1909) bought Fair Oaks in 1865. The name was supposedly coined by the ranch’s previous owner, Eliza Griffin Johnston (1821-1896), widow of a Confederate general. (Some say she grew up on a Virginia plantation called Fair Oaks; I’ve found no record of that.) She bought the land from her brother Dr. John S.Griffin(via B.D.Wilson) in late 1862, but didn’t stay long: her son Albert Jr. was killed in the 1863 explosion of PhineasBanning‘s ferry theAda Hancock, so in grief she abandoned the ranch and sold it to Benjamin Eaton, her pseudo brother-in-law. (Eaton’s late wife Helena was sister to Dr. Griffin’s wife Louisa; later, Eliza Johnston’s sonHancockwould marry Eaton’s daughter Mary!) Eaton applied his renowned irrigation skills to the drought-ravaged Fair Oaks and reaped the rewards from its vineyards and orange groves. In 1873, he was visited by Daniel Berry, whose “California Colony ofIndiana” was looking for land to, well, colonize. Eaton told Berry that he’d come to the right place, so Berry’s cohorts formed the San GabrielOrange GroveAssociation, appointed Eaton its president, and Pasadena was underway. Eaton sold Fair Oaks to James Fillmore Crank in 1877.",https://lastreetnames.com/wp-content/uploads/2022/07/fair-oaks-avenue-map.png
https://lastreetnames.com/street/fairbanks-way/,Fairbanks Way,Culver City,"Named for Douglas Fairbanks (1883-1939), one of the biggest stars of silent film. The Denver-born Fairbanks took to the stage as a boy and was touring the country by his teens; he even trod the boards in Los Angeles in 1900. Eventually he found success on Broadway, and while living in New York he married his first wife and fathered his only child, Douglas Fairbanks Jr. Hearing Hollywood’s siren song, Fairbanks and his family moved to L.A. in 1915. Fairbanks quickly became a screen idol, and in 1919, the now world-famous actor established the United Artists motion picture studio with D.W. Griffith, Charlie Chaplin, and Mary Pickford. Fairbanks and Pickford had been romantically involved since 1916, while both were still married to other people. They finally wed in 1920 and moved into their famousPickfairmansion in Beverly Hills. Here in Culver City, Fairbanks Way andPickford Waywere named in 1927 while UA was planning a backlot nearby. (That never came to pass: seeStudio Drive.) Fairbanks’s career fizzled out with the advent of talkies. Pickford left him in 1933 and he died of a heart attack at 56.",https://lastreetnames.com/wp-content/uploads/2022/04/fairbanks-way-map.png
https://lastreetnames.com/street/fairfax-avenue/,Fairfax Avenue,Fairfax,"Fairfax High School, a reliable enough source, says that “Fairfax” refers to Thomas, Baron Cameron, 6th Lord Fairfax (1693-1781), friend and neighbor of George Washington and the only British noble to live in the American colonies. (Fairfax High’s Greenway Court Theatre is named after Lord Fairfax’s Virginia estate.) I don’t know why the City of L.A. chose him as this avenue’s honoree, but my guess is that “Fairfax” was simply a common enough place name, it sounded nice, and it was available. The street was originally called Crescent Avenue back in 1887 – you may presume that’s howCrescent Heightsgot its name – and a June 6th, 1912 news brief noted that City Council was renaming it “West Street” when property owners protested. Four months later, apparently to little protest, it quietly became Fairfax Avenue. Bits of Crescent survived until 1921, when the whole thing officially became Fairfax.",https://lastreetnames.com/wp-content/uploads/2022/07/fairfax-avenue-map.png
https://lastreetnames.com/street/fairmount-road/,Fairmount Road,Burbank,"In the 1920 Woodland Heights development – later reborn as Benmar Hills – not one buttwoalphabetical groups of streets were named after colleges and prep schools, as auniversitywas envisioned here. (SeeAndover Drivefor the other group.) This group began with Amherst Drive and continued with Bethany Road (for the Bethany College in Kansas or the one in West Virginia); Cornell Drive; Delaware Road, for the University of Delaware; Elmhurst Drive, for Elmhurst University in Illinois; Fairmount Road, for Fairmount College (today’s Wichita State); Grinnell Drive, for Iowa’s Grinnell College; and finally Harvard Road, for you-know-what. Now, you might be thinking, “Elmhurst What? The street between Delaware and Fairmount is Walnut Avenue.” In fact the plan was to rename Walnut to Elmhurst, but since Burbank already had an ElmwoodAvenue, Walnut remained Walnut. Seven additional streets were never christened: Indiana, Judson, Kentucky, Lawrence, Mills, Norwich, and Ogden. P.S. The lower bit of Grinnell Drive was born in 1919 with the awkward moniker “Roy-Court Avenue”. No love was lost when it became part of Grinnell in 1922.",https://lastreetnames.com/wp-content/uploads/2022/04/fairmount-road-map.png
https://lastreetnames.com/street/fambrough-street/,Fambrough Street,Santa Clarita,"One of the first streets in L.A. County to be named for a black man – even though he lived in Kern County. Jawayne “Joe” Fambrough (1912-1995) was a Bakersfield entrepreneur who started a successful floor polishing and finishing business (Imperial Floor Service) in 1933. He eventually crossed paths with white Bakersfield builder Wayne Lee Vaughn and by 1955 the two were partners on housing tracts in Bakersfield, Santa Maria, and elsewhere. Santa Clarita’s Fambrough Street was named in 1965 on the Oakridge tract, owned by Vaughn and James E. Smith. Fambrough wasn’t listed as owner, but he was named as a defendant along with Vaughn and Smith in a lawsuit over the land (they won), so we can assume he had a stake here. Joe Fambrough married the Oklahoma-born, Bakersfield-raised Marie Harriet Harris (1914-1981) around 1938; Marie had recently returned to Bakersfield after obtaining her cosmetology license in Hollywood.",https://lastreetnames.com/wp-content/uploads/2022/06/fambrough-street-map.png
https://lastreetnames.com/street/fargo-street/,Fargo Street,Silver Lake,"With a 32° grade, Fargo is one of the steepest streets in Los Angeles, although the lesser-knownEldred Streetin Mount Washington is steeper. Fargo is located in an “alphabet neighborhood”: In 1902, a tract calledEdendale, opened by Moses LangleyWicks, laid out six streets unimaginatively named A, B, C, D, E, and F. Property owners petitioned the City in 1908 to give the poor things real monikers, and suggested Aaron, Branden, Clifford, Duane, Ewing, and Fargo. (The inspirations for these names are lost to time.) The petition, clearly, was approved.",https://lastreetnames.com/wp-content/uploads/2022/04/fargo-street-map.png
https://lastreetnames.com/street/farquhar-street/,Farquhar Street,City Terrace,"The namesake here has got to be architect Robert David Farquhar (1872-1967). My rationale: this street was named in 1927 on a tract developed by Walter H.Leimert, and a 1926 issue ofArchitectural Digestshowcased Leimert’s own house – designed by Robert D. Farquhar. Born in Brooklyn and raised in Newton, MA, Farquhar graduated from both HarvardandMIT, then attended École des Beaux-Arts in Paris. In 1903, he married tennis champ Marion Jones (1879-1965), daughter of Santa Monica cofounder Senator John P. Jones. This high-profile union led to a lot of high-profile California clients for Farquhar: his many projects would include the Festival Hall at San Francisco’s 1915 Panama-Pacific Expo (since demolished), Beverly Hills High School, the William AndrewsClarkJr. Library in West Adams, Clark’s “island mausoleum” at Hollywood Forever, the exclusive California Club in DTLA, and theCanfield–Morenoestate in Silver Lake. He also assisted in designing The Pentagon in 1941. The Farquhars had three sons but divorced in 1926.",https://lastreetnames.com/wp-content/uploads/2024/03/farquhar-street-map.png
https://lastreetnames.com/street/federal-avenue/,Federal Avenue,Mar Vista,"You’re right if you figured that Federal Avenue is called that because it abuts federal property – that is, the West Los Angeles VA Medical Center. But the road’s name actually hopped overWilshiresome time ago. Here’s the story: Federal Street, as it was first called, was laid out in 1905 on theWestgatetract and ran between Wilshire and Montana, alongside what was then called “Soldiers’ Home” (seeVeteran Avenue). South of Wilshire, the road was known as 9th Street, asSawtellewas then its own city. After Los Angeles annexed Sawtelle, 9th Street had to go, so it was briefly and awkwardly rechristened 109th Avenue. It adopted the Federal name in 1925. Years later, in 1956, half of Federal north of Wilshire was absorbed intoSan Vicentewhile the other half was namedBringham Avenueafter a VA supervisor.",https://lastreetnames.com/wp-content/uploads/2022/06/federal-avenue-map.png
https://lastreetnames.com/street/fedora-street/,Fedora Street,Koreatown,"Boring old F Street became Fedora Street in 1897. It was named either for the men’s hat or for the stage drama that inspired said hat. Here’s the story: In 1882, playwright Victorien Sardou wroteFédoraas a vehicle for the legendary French actress Sarah Bernhardt. It was a hit, and when the English version premiered in New York a year later, with Fanny Davenport (a legend in her own right) in the title role, Americans went gaga for all thingsFédora. (Davenport brought the play to Los Angeles in July 1888; the plot concerns the fictional Russian princess Fédora Romazoff, who falls in love with her husband’s assassin.) It’s an oft-repeated myth that Bernhardt donned a man’schapeauin the Paris show and thus the fedora was initially a unisex hat marketed to women. Not true. The first fedora-named hats were introduced in late 1883, they were inspired by the American production, and they were for men. For a while there was a style of ladies’ fashion called a “fedora front” – a curtain-like blouse. But from 1891 onwards, “fedora” primarily referred to men’s hats. P.S. There’s no evidence of Fedora Street ever having had a hat factory or hat store on it.",
https://lastreetnames.com/street/feijoa-avenue/,Feijoa Avenue,Lomita,"The feijoa – officiallyFeijoa sellowiana– is a tree/shrub whose fruit is often called the pineapple guava, as it looks kind of like a guava and has a pineapple-strawberry flavor. Native to southern Brazil and Uruguay, the plant derives its name from Portuguese naturalist João da Silva Feijó (1760-1924). It was first brought to SoCal in the very early 1900s. Here in Lomita, feijoas were successfully cultivated by William Boyes (1859-1936), an Englishman who lived due west of here on Cypress Street. This likely led to the naming of Feijoa Avenue in 1923, although Boyes didn’t own the land it was on.",https://lastreetnames.com/wp-content/uploads/2022/05/feijoa-avenue-map.png
https://lastreetnames.com/street/fellowship-parkway/,Fellowship Parkway,Echo Park,"One of the last truly rustic roads in this part of town, Fellowship Parkway was named by evangelical minister Benjamin Fay Mills (1857-1916). The New Jersey-born Mills was an indisputable progressive, being a vegetarian, suffragist, Christian socialist, and outspoken fan of theBhagavad Gita. After a few years in the Bay Area with the Unitarian Church, Rev. Mills and his wife Mary Russell Mills (c. 1860-1918) came to L.A. in 1904 founded a nondenominational sect called the Los Angeles Fellowship. The Millses themselves lived on Fellowship Parkway, which they named in 1906. They left L.A. for Chicago in 1911, but Mills often came back to preach. A year before his death, Mills resigned from his own sect and rejoined his old church, the Presbyterians.",https://lastreetnames.com/wp-content/uploads/2022/04/fellowship-parkway-map.png
