street_url,street_name,neighborhood,description,map_url
https://lastreetnames.com/street/kauffman-avenue-south-gate/,Kauffman Avenue,South Gate,"What are the odds that Los Angeles County would have two different Kauffman Avenues named for two different Milton Kauffmans, both born in 1882 and died in 1956? Temple City’sKauffman Ave.honors a major developer who built thousands of homes; South Gate’s Kauffman Ave., named in 1923, honors MiltonMelvinKauffman. At least I’m 99% sure it does, as it’s flanked byDorothyandAnnettaavenues – and Milton Melvin Kauffman had daughters named Dorothy and Annetta. A native Pennsylvanian, this Kauffman came to L.A. in the early 1900s and married his first wife Rebecca in 1909. She passed away a decade later and he would wed twice more. He started working for big-time real estate operator William Irving Hollingsworth around 1915 and eventually became his company’s auditor. Hollingsworth was a partner inForest Lawnand thus Kauffman sat on its board of trustees for years. In the 1930s, Kauffman was president of the Claude Neon Electrical Products Corp. – named after neon lighting inventor Georges Claude – and Hollingsworth was behind that too. In his later years, Kauffman went solo and attempted to manufacture a “body vibrator”. Your guess is as good as mine.",https://lastreetnames.com/wp-content/uploads/2024/01/kauffman-avenue-map-1.png
https://lastreetnames.com/street/kauffman-street/,Kauffman Street,El Monte,"Milton Kauffman (1882-1956) would cofound Temple City in 1923 (seeKauffman Avenuefor a bio) and make a fortune building thousands of homes after WWII, but this little byway marks one of his earliest real estate developments – perhaps his very first. The year was 1907, and although Kauffman was still working with his father Isaac in an El Monte general store, he had been buying and selling SGV land for at least four years, and in 1905 he purchased the first of many parcels from millionaire Elias “Lucky”Baldwin. (Articles published later in Kauffman’s life claimed that he’d been an “associate” of Baldwin’s. Not quite true, but he did work for Baldwin’s nephew/estate manager HiramUnruh.) Kauffman Street was born on 5 acres that Kauffman acquired from Frederick W. Tyler, the likely namesake ofTyler Avenue.",https://lastreetnames.com/wp-content/uploads/2024/01/kauffman-street-map.png
https://lastreetnames.com/street/keats-street/,Keats Street,Manhattan Beach,"Shakespeare Beach was a 1903 tract built on 140 acres previously owned by Confederate Army colonel Blanton Duncan (1827-1902). The new owners: streetcar barons MosesShermanand EliClark, who just so happened to have built tracks out to the neighborhood. Although it’s unclear whether they really envisioned Shakespeare Beach as a writers’ colony, as some have claimed, the streets were indeed named for classic poets. Most – Byron, Burns, Milton, Browning, Ruskin, Moore, and Poe – were changed to boring old numbered streets by 1918, but Longfellow Avenue and Homer Street have kept their original appellations, and further east you’ll find the last vestiges of Keats, Shelley, and Tennyson streets.Bard Street, a mile south, was on a 1902 development also owned by Clark but was unrelated to Shakespeare Beach.",https://lastreetnames.com/wp-content/uploads/2022/05/keats-street-map.png
https://lastreetnames.com/street/keeler-street/,Keeler Street,Burbank,"If it weren’t for a short-lived crockery factory, Lockheed may have never come to Burbank. When Keeler Street was named, in 1923, Fred Elbridge Keeler (1872-1951) was VP of the Empire China Company (seeEmpire Avenue). He had come from Mason City, Iowa, where he made a fortune in brick and tile. Bored with the Midwest, he and his wife Mary bought 7 acres onLa BreaTerrace in 1916 and moved in two years later. (They had no children; a nephew was christened Fred Elbridge Keeler II.) Keeler bought several buildings in DTLA and financed some entertainment venues, but in 1921 he fell back on his ceramics background to found Empire China as an outlet for his (and I.R.Landis‘s) clay mine in Nevada. Keeler obviously liked Burbank, because in 1928 he installed his new startup down the road: the Lockheed Aircraft Company. When the sun set on Empire in 1933, Lockheed took over its location as well. By then, Keeler had sold off most of Lockheed and had devoted his life to supporting the arts.",https://lastreetnames.com/wp-content/uploads/2022/05/keeler-street-map.png
https://lastreetnames.com/street/keith-avenue/,Keith Avenue,West Hollywood,"Named in 1921 for Belle Keith Ramage (1880-1944) by her veterinarian/realtor husband Adam (seeRamage Street). Born Beatrice Eliza Keith, she grew up in the small town of Traer, Iowa. There she worked as a teacher before moving to Los Angeles in February 1912 to marry Ramage after a month-long engagement. Ramage hailed from Canada and was living in Riverside at the time. How did these two even meet? There are no clues; an Iowa newspaper said simply, “The groom is not known here.” The Ramages, who had four daughters and a son, split their time between Richmond, CA and various Inland Empire cities until around 1919, when they settled nearMelroseandWestern. They moved to Pasadena by 1926 and spent the rest of their lives there.",https://lastreetnames.com/wp-content/uploads/2022/07/keith-avenue-map.png
https://lastreetnames.com/street/kellogg-drive/,Kellogg Drive,Pomona,"When you see “Kellogg”, you think of breakfast cereal. And indeed, Kellogg Drive is named for Will Keith “W.K.” Kellogg (1860-1951), the corn flake king of Battle Creek, Michigan. (He invented flaked cereal in 1894 with his brother Dr. John Harvey Kellogg (1852-1943), who ran the Battle Creek Sanitarium – as in health spa, not mental hospital.) The company we now call Kellogg’s was founded by W.K. in 1906. It made him fabulously rich, and in 1925 he purchased 377 acres in Pomona for his winter residence and Arabian horse ranch. It eventually grew to 813 acres. Kellogg, a renowned philanthropist, donated the land – along with $600,000 and 95 horses – to the California State University system in 1932. After years of back-and-forth between the state and Kellogg’s foundation, Cal Poly Pomona opened its doors here in 1956.",https://lastreetnames.com/wp-content/uploads/2022/05/kellogg-drive-map.png
https://lastreetnames.com/street/kelowna-street/,Kelowna Street,Arleta,"Kamloops and Kelowna are cities in British Columbia, Canada, so whoever named our Kamloops and Kelowna streets surely had ties to that region. I’m 99% sure the namer in question was Peter Henry Haack (1856-1915) and/or his wife Mathilda (née Rombrot, 1864-1956). They owned a ranch where these two streets originated, and while Peter was a German immigrant, Mathilda did indeed come from BC: the couple married there in 1883 and their only child Henry (1884-1967) was born there as well – shortly before the Haacks fled to California to evade Peter’s unpaid debts. They ran a boarding house in DTLA for several years while Peter made money in the horse trade – then made much more in real estate. At the time of his 1915 death, with properties all over Los Angeles and 6,000 acres in Tulare County, he was reportedly worth $1.25 million. Henry Haack went on to manage his parents’ interests and also partnered with Sherrill Osborne (seeOsborne Street) in a realty firm. He married thrice: first to Marie Petit, cousin ofPetit Avenue‘s namesake; then to singer Amber Fay, who bore him a daughter (also named Amber) but left him for a fellow warbler; and finally to Mabel Gardner.",https://lastreetnames.com/wp-content/uploads/2024/01/kelowna-street-map.png
https://lastreetnames.com/street/kenilworth-avenue/,Kenilworth Avenue,Silver Lake,"Kenilworth is a village and (ruined) castle in Warwickshire, England, but most places that share its name were inspired by Sir Walter Scott’s 1821 novelKenilworth, set in 1575 during Queen Elizabeth’s visit to the castle. Our Kenilworth Avenue made its debut on the 1887Ivanhoetract, which of course was also named for a Scott novel. A separate tract called Kenilworth soon followed, located near Griffith J.Griffith‘s ostrich farm, which was run by English naturalist Dr. Charles Sketchley. In fact the farm – now Griffith Park’s Crystal Springs Picnic Area – was known as the Kenilworth Ostrich Farm. Although short-lived as a tourist attraction (1885-1889), it instigated the development of this part of town: That canyon-like stretch ofSunset Boulevardthrough Silver Lake and Echo Park was carved out for the train that brought downtowners to the giant birds. Neighborhoods soon popped up along the tracks.",https://lastreetnames.com/wp-content/uploads/2022/04/kenilworth-avenue-map.png
https://lastreetnames.com/street/kenmore-avenue/,Kenmore Avenue,East Hollywood,"First named between 4th andWilshireby the Chapman brothers: Frank (1849-1909), Charles (1853-1944), and Samuel (1862-1935). They were born in Macomb, IL but made their names as publishers and hoteliers in Chicago, where there also happens to be a Kenmore Avenue. In fact Frank himself lived on the Windy City’s Kenmore in 1892, so there’s your probable cause. (“Kenmore” is Scottish in origin; it’s been theorized that the Chicago-based Sears borrowed the street’s name for its brand of appliances.) After their hotel business failed, the Chapmans came to SoCal in 1894 and made it big as citrus growers. Charles would later give his name to Orange County’s Chapman University. He and Samuel opened the Chapman Park Hotel here on their property in 1927 – it’s long gone, but their 1929 Chapman Market still stands. In 1912, the City decreed that the originalHolmbyAvenue (named for department store king Arthur Letts’s Los Feliz mansion), Windermere Avenue, and El Molino Street (the “E” betweenDewey‘s “D” andFedora‘s “F”) all become part of Kenmore Ave.",https://lastreetnames.com/wp-content/uploads/2023/02/kenmore-avenue-map.png
https://lastreetnames.com/street/kenneth-road/,Kenneth Road,Burbank,"Walter Kenneth Dow (1868-1960) was born in Massachusetts and raised in Chicago, where his father Albert (1841-1911) ran a large paint company. The Dows moved to North Glendale in 1896 and lived on a 10 acre citrus grove for fourteen years. (They weren’t just humble farmers: when Albert died, his obituary called him “one of the wealthiest ranchers and residents of this valley”.) The grove was at the corner of Central Avenue and an unnamed dirt lane. As the story goes, a county supervisor up for reelection visited the Dows in 1900 and asked if there was anything he could do for them. Walter jokingly requested that the dirt lane be called “Kenneth Road”, after his middle name. One week later, he found a brand new street sign reading exactly that. I don’t know if the tale is true, but the Dows definitely lived on Kenneth Road; in fact they owned much additional land along the street. (1902 marked its earliest mention in the press; 1923 was when it consumed Burbank’s 8th Street.) Walter Kenneth Dow never married, but a woman named Jennie Cornwell (1874-1960) lived with him for decades. The 1910 census listed her as the Dows’ cook, but the 1940 and 1950 censuses called her Walter’s “sister”. The true nature of their relationship remains a mystery. Regardless, Walter died just two weeks after her.",https://lastreetnames.com/wp-content/uploads/2022/07/kenneth-road-map.png
https://lastreetnames.com/street/l-ron-hubbard-way/,L. Ron Hubbard Way,East Hollywood,"In 1996, a block ofBerendo Streetwas renamed for Lafayette Ron Hubbard (1911-1986), founder of the Church of Scientology. As the only child of a Navy officer, Hubbard grew up all around the country. While settled in Washington, D.C. in the 1930s, he began writing short stories and novels, which eventually earned him a living. He then published his bestsellerDianeticsin 1950 and began lecturing in Los Angeles that summer. Hubbard established the Church of Scientology in late 1953-early 1954; by 1955, the church had an office in Hollywood. It has owned the big blue building along L. Ron Hubbard Way since 1977. (It was previously the Cedars of Lebanon Hospital, which closed the year before.) The church’s petition to rename this bit of Berendo for its beloved “Commodore” was met with little resistance: City Council voted 8-3 in favor of it, with four council members conveniently absent for the vote. Thanks to the Scientologists, L. Ron Hubbard Way is one of the only brick-lined streets in L.A., afterOlvera Street,Sanchez Street, andPowers Place.",https://lastreetnames.com/wp-content/uploads/2022/04/l.-ron-hubbard-way-map.png
https://lastreetnames.com/street/la-brea-avenue/,La Brea Avenue,Los Angeles (Citywide),"La breameans “the tar” in Spanish, and La Brea Avenue derives its name from the old Rancho La Brea, whose famous tar deposits first coated native canoes, then the roofs of adobes. The rancho was deeded in 1828 to the Rocha family, who, after California’s 1850 statehood, went broke in legal fees trying to prove ownership. Who was owed those fees? The Rochas’ lawyer, HenryHancock. And who wound up with their rancho as a result? You guessed it: Henry Hancock. This happened in 1860. Years after Henry’s 1883 death, his son George Allan Hancock discovered oil on the property – the tar, of course, gave him a clue – and bled it dry before developing part of it into pricy Hancock Park. As for La Brea Avenue, in its infancy it was called Plummer Street, after John C. Plummer (c. 1825-1909), an English sea captain who bought 160 acres from Hancock the elder in 1874. (West Hollywood’s Plummer Park sits on the ranch run by John’s son Eugene (1852-1943), a beloved local character; the Valley’sPlummer Streethonors a grandson.) The street was renamed La Brea in 1906, likely by the Hancocks.",https://lastreetnames.com/wp-content/uploads/2022/07/la-brea-avenue-map.png
https://lastreetnames.com/street/la-cienega-boulevard/,La Cienega Boulevard,Los Angeles (Citywide),"It only sort of means “swamp” in Spanish:ciénegamore specifically refers to the kind of wetland system once common in Los Angeles, before development. Such wetlands existed at both Rancho La Ciénega, deeded in 1823 to FranciscoÁvila(1772-1832; his adobe still sits onOlvera Street), and the nearby Rancho Ciénega o Paso dela Tijera, deeded to VicenteSánchez(1785-1846) in 1843. Spanish linguists will note that the word is properly spelledciénaga. Presumably some early ranchero or surveyor misspelled it – and the mistake became the rule. At any rate, La Cienega Boulevard was first announced in 1922, but it took at least six years just to complete the thoroughfare’s initial 4 mile stretch betweenWashingtonandSanta Monicaboulevards. It reached its current 13 mile length in 1961.",https://lastreetnames.com/wp-content/uploads/2022/04/la-cienega-boulevard-map.png
https://lastreetnames.com/street/la-collina-drive/,La Collina Drive,Beverly Hills,"A private street named for a mansion. La Collina (Italian for “the hill”) was built in 1924 for well-connected banker Ben R. Meyer (1879-1957). Its architect was Gordon B. Kaufmann (1888-1949), who went on to design the Hoover Dam, Scripps College, the L.A. Times Building, the Hollywood Palladium, and Beverly Hills’s own Greystone Mansion (seeDoheny Road).",https://lastreetnames.com/wp-content/uploads/2022/04/la-collina-drive-map.png
https://lastreetnames.com/street/la-cuarta-street/,La Cuarta Street,Whittier,"Cuartais the Spanish feminine translation of “fourth”, in this case referring tola cuarta calle: “the fourth street”. So was La Cuarta Street originally known as 4th Street? Yes – and as another street as well. First, about Fourth: maps from the time are nonexistent, but 4th Street was probably laid out in late 1887 on the East Whittier townsite; newspapers first mentioned it in 1893. (The folks behind East Whittier were not theWhittierQuakers but a group of Michiganders: seeMichigan Avenue.) La Cuarta Street itself was named in 1941 on the Friendly Hills tract as an extension of 4th Street – the Friendly Hills developers wanted its name to fit in with their Spanish-themed avenues, e.g.,Enramada. Meanwhile, back on the original Whittier townsite, the western stretch of La Cuarta was christened Short Street back in 1887. Both Short Street and 4th Street kept their names all the way until 1966, when the entire thoroughfare became La Cuarta. See2nd Streetfor the tortuous history of East Whittier’s ordinal streets.",https://lastreetnames.com/wp-content/uploads/2024/01/la-cuarta-street-map.png
https://lastreetnames.com/street/la-fayette-road/,La Fayette Road,Mid-City,"The name references La Fayette Square, the nearby housing tract laid out in 1912 by real estate maven George La FayetteCrenshawand his sonCharles. Yet La Fayette Road wasn’t squeezed in until 1921, apparently on non-Crenshaw land. As for “La Fayette”, it’s surely taken from George and Charles Crenshaw’s shared middle name, although early ads for the tract included portraits of the Marquis de Lafayette. You’ll note the difference between “La Fayette” and “Lafayette”, by the way.",https://lastreetnames.com/wp-content/uploads/2022/07/la-fayette-road-map.png
https://lastreetnames.com/street/la-fetra-drive/,La Fetra Drive,Glendora,"This 1960 cul-de-sac honors a pioneerGlendorafamily. It all started in 1875, when Ohioans Lawson LaFetra (1844-1907) and his brother Milton (1846-1903) came to Los Angeles, reportedly for Lawson’s health. Their parents and most of their siblings soon joined them. Lawson co-owned a grocery store in DTLA while Milton co-owned a hardware store. In or around 1883, the brothers acquired 400 acres in present-day Glendora, sold their interest in their stores, and resettled here to farm – seeMilton Avenuefor more – but it’s another LaFetra brother, Tylee (1853-1930), a former schoolteacher in Chile, whose offspring left the biggest impact on the region: son Clem (1905-1963) and Clem’s wife Mary (1909-1989) founded the Rain Bird sprinkler company here in 1935. Their neighbor Orton Englehart allowed them to sell his invention: a pulsing, rotating sprinkler head that would revolutionize irrigation and make the LaFetras rich. Mary LaFetra served as Rain Bird’s president until 1978, when she passed the torch to her son Tony (1940-2021). He ran the company, now headquartered inAzusa, for the rest of his life.",https://lastreetnames.com/wp-content/uploads/2024/01/la-fetra-drive-map.png
https://lastreetnames.com/street/la-grange-avenue/,La Grange Avenue,West L.A.,"Named for Oscar Hugh La Grange (1837-1915), governor of “Soldiers’ Home” – forerunner to theVAMedical Center – which housed over 1,000 Civil War veterans. The New York-born, Wisconsin-raised La Grange was a veteran himself: as a colonel in the Union Army, he fought in several of the Civil War’s thickest and bloodiest battles. He ultimately received the rank of brigadier general. La Grange, who had studied law, came to California after the war and was elected district attorney of Alameda County. In 1869, he was appointed superintendent of the San Francisco Mint, which ended in accusations that employee malfeasance was happening under his nose. He then briefly served as New York Fire Commissioner before assuming his post at Soldiers’ Home in 1899. La Grange Avenue was named less than two years into O.H. La Grange’s nine year stint here.",https://lastreetnames.com/wp-content/uploads/2022/04/la-grange-avenue-map.png
https://lastreetnames.com/street/la-jolla-avenue/,La Jolla Avenue,Beverly Grove,"This 1922 street was named after the beachside San Diego community of La Jolla, probably because La Jolla was by then already recognized as a lovely and relaxing destination – and who wouldn’t want to live on a lovely and relaxing street? As for the etymology of “La Jolla”, coined by 1870 if not earlier, there is some disagreement. Laypeople believe it’s an old-fashioned spelling ofla joya, Spanish for “the jewel”. More learned scholars say it’s a corruption ofla hoya, meaning “the hole” or “the hollow”. That was how Spanish-speaking settlers translated a local Kumeyaay word for that area, pockmarked as it is with coastal caves.",https://lastreetnames.com/wp-content/uploads/2022/07/la-jolla-avenue-map.png
https://lastreetnames.com/street/la-peer-drive/,La Peer Drive,Beverly Grove,"La Peer Drive was born with the more prosaic moniker of Lapeer Street. This missing space is crucial in determining the origin of the name: almost definitely Lapeer, Michigan, a city and county east of Flint. (Other than a tiny village in upstate New York, there’s no other likely Lapeer.) The name is said to derive from a local pronunciation ofla pierre, French for “the stone”, referring to a large rock in the Flint River. I assume some homesick Michigander christened Lapeer Street, which existed by 1908 between present-dayBeverly BoulevardandBurton Wayduring the town ofSherman‘s heyday. At some point in the 1920s, it was upgraded to the fancier-sounding La Peer Drive.",https://lastreetnames.com/wp-content/uploads/2022/07/lapeer-drive-map.png
https://lastreetnames.com/street/la-porte-street/,La Porte Street,Arcadia,"When Elias Jackson “Lucky”Baldwin(1828-1909) establishedArcadiain 1887, he named several downtown streets in honor of his childhood home in Indiana. St Joseph Street is for St. Joseph County, where his parents’ farm was located. (They lived in a tiny community called Terre Coupee, within the county’s Olive Township.) La Porte Street is for La Porte, IN, a small city 15 miles west of the farm, in a county of the same name. Naturally, Arcadia has an Indiana Street as well.",https://lastreetnames.com/wp-content/uploads/2022/05/la-porte-street-map.png
https://lastreetnames.com/street/la-prada/,La Prada,Highland Park,"Named in 1906 on the La Prada Park subdivision, owned by James Shelly Green (1870-1946), a recent transplant from Pottsville, PA.La pradadoesn’t mean anything in Spanish, so maybe Green – and/or his sales agent Mira MacKay – actually meantel prado: “the meadow”. (The fashion brand Prada was founded in Milan in 1913 by Mario Prada, so this street predates that!) La Prada’s unusual width was intentional, with no plans for streetcar tracks up the middle: La Prada Park’s earliest ads touted its 100 foot wide “boulevard” with “beautiful bearing orange trees” along its median. Likewise, Green never considered an identifier such as “Avenue” or “Court”. This street was always La Prada, period.",https://lastreetnames.com/wp-content/uploads/2023/07/la-prada-street-map.png
https://lastreetnames.com/street/la-presa-drive/,La Presa Drive,Hollywood Hills,"La presameans three very different things in Spanish: “the prey”, “the female prisoner”, and “the dam”. While the first two definitions might symbolize life in Hollywood for some people, in this case let’s go with “the dam” – La Presa Drive was named in 1925, shortly after the completion of theMulhollandDam that created Lake Hollywood. It’s probably not a coincidence.",https://lastreetnames.com/wp-content/uploads/2022/04/la-presa-drive-map.png
https://lastreetnames.com/street/la-rue-street/,La Rue Street,San Fernando,"La rueis French for “the street”, but unless someone planned for some awkward redundancy here (“The Street Street”?), La Rue Street more likely honors Eugene Clyde LaRue (1879-1947), a Riverside boy who grew up to be a top hydraulic engineer with the U.S. Geological Survey. The street was named (as La Rue Avenue) in 1920, before LaRue’s work with aqueducts and dams would make him an obvious namesake for a street in the thirsty SFV, but he was prominent in the California water industry by 1913 and he and his family moved from Salt Lake City to Pasadena in 1917, so it’s a fair argument. At any rate, E.C. LaRue is remembered for his efforts in surveying and controlling the Colorado River. He fell out with the USGS in 1927 over his opposition to the Hoover Dam and spent the rest of his career as flood control engineer for L.A. County.",https://lastreetnames.com/wp-content/uploads/2022/04/la-rue-street-map.png
https://lastreetnames.com/street/la-tijera-boulevard/,La Tijera Boulevard,Inglewood,"In today’s Spanish lesson,la tijerameans “the scissors” – not “the scissor”. The plurallas tijerasis more commonly used today, but we’re talking about the Spanish of yesteryear here. La Tijera Boulevard is on the site of the 4,219 acre Rancho Ciénega o Paso de la Tijera – “Marshland Ranch or Scissors Pass”. Deeded in 1843 to Los Angelesalcalde(mayor) VicenteSánchez(1785-1846), then managed by his widow María Victoria (1787-1870) and grandson Tomás after his death, the rancho’s untidy name came from its two defining features: acres of marshland (ciénega) and a pass, apparently resembling a pair of scissors, through today’s Baldwin Hills. “Baldwin”, by the way, refers to Elias “Lucky” Baldwin, the millionaire speculator who purchased the rancho in 1875. SeeBaldwin Ave.for a lot more about him.",https://lastreetnames.com/wp-content/uploads/2022/05/la-tijera-boulevard-map.png
