street_url,street_name,neighborhood,description,map_url
https://lastreetnames.com/street/ramona-boulevard-road/,Ramona Boulevard/Road,Monterey Park,"Several streets in Los Angeles County owe their name to a book:Ramona, the 1884 novel by Helen Hunt Jackson (1830-1885). The first bestseller set in Southern California,Ramonais ostensibly a romance about an orphaned “halfbreed” woman who falls in love with a Native American man, but it endures as a candid account of the hardships indigenous Californians faced after 1850 statehood, when white capitalists, in collusion with the federal government, took their land and removed them from their homes. Some have comparedRamonatoUncle Tom’s Cabinin its effect of awakening white readers to the plight of a disenfranchised people, yet Jackson’s evocative descriptions of the SoCal landscape would only attract more white settlers to the state. Selling hundreds of thousands of copies and receiving five big-screen adaptations, the novel was such a blockbuster that seemingly every town in California had to have a street named Ramona. In fact Interstate 10 through the San Gabriel Valley was previously known as the Ramona Freeway.",https://lastreetnames.com/wp-content/uploads/2023/09/ramona-road-map.png
https://lastreetnames.com/street/ramona-boulevard-rosemead/,Ramona Boulevard,Rosemead,"Several streets in Los Angeles County owe their name to a book:Ramona, the 1884 novel by Helen Hunt Jackson (1830-1885). The first bestseller set in Southern California,Ramonais ostensibly a romance about an orphaned “halfbreed” woman who falls in love with a Native American man, but it endures as a candid account of the hardships indigenous Californians faced after 1850 statehood, when white capitalists, in collusion with the federal government, took their land and removed them from their homes. Some have comparedRamonatoUncle Tom’s Cabinin its effect of awakening white readers to the plight of a disenfranchised people, yet Jackson’s evocative descriptions of the SoCal landscape would only attract more white settlers to the state. Selling hundreds of thousands of copies and receiving five big-screen adaptations, the novel was such a blockbuster that seemingly every town in California had to have a street named Ramona. In fact Interstate 10 through the San Gabriel Valley was previously known as the Ramona Freeway.",https://lastreetnames.com/wp-content/uploads/2022/07/ramona-boulevard-map.png
https://lastreetnames.com/street/ramona-court/,Ramona Court,Carthay Circle,"When J. HarveyMcCarthylaid out Carthay Center in 1922, he and landscape architects Wilbur David Cook Jr. and George Duffield Hall included a unique feature: five pedestrian-only shortcuts through the tract’s residential blocks. Each “way” is named after a California mission: Capistrano, Carmel, San Diego, San Gabriel, and Santa Ynez. These are all paved public sidewalks with streetlights and City of Los Angeles road signs. Neighborhood wanderers will also spot signage for White Esplanade, which honors SenatorStephen M. White(D-CA), and Ramona Court, a nod to the local “RamonaParlor” chapter of the Native Sons of the Golden West, who advised McCarthy on naming his streets after historic Californians.",https://lastreetnames.com/wp-content/uploads/2022/09/ramona-court-map.png
https://lastreetnames.com/street/ramona-street/,Ramona Street,San Gabriel,"Several streets in Los Angeles County owe their name to a book:Ramona, the 1884 novel by Helen Hunt Jackson (1830-1885). The first bestseller set in Southern California,Ramonais ostensibly a romance about an orphaned “halfbreed” woman who falls in love with a Native American man, but it endures as a candid account of the hardships indigenous Californians faced after 1850 statehood, when white capitalists, in collusion with the federal government, took their land and removed them from their homes. Some have comparedRamonatoUncle Tom’s Cabinin its effect of awakening white readers to the plight of a disenfranchised people, yet Jackson’s evocative descriptions of the SoCal landscape would only attract more white settlers to the state. Selling hundreds of thousands of copies and receiving five big-screen adaptations, the novel was such a blockbuster that seemingly every town in California had to have a street named Ramona. In fact Interstate 10 through the San Gabriel Valley was previously known as the Ramona Freeway.",https://lastreetnames.com/wp-content/uploads/2022/04/ramona-street-map-1.png
https://lastreetnames.com/street/ramona-street-bellflower/,Ramona Street,Bellflower,"Whereas many of the Southland’s Ramona-themed streets were inspired by an 1884 bestseller (seeRamona Boulevard), I believe Bellflower’s Ramona Street was likely named for a developer’s stepdaughter. Ramona Inez Bodell (1901-1991) was born in Waterloo, Iowa to Claude and Eda Bodell. In 1906, Charles McWilliams partnered with Frank E.Woodruffto develop what would become the city ofBellflower. McWilliams, who was from Waterloo as well, then married Ramona’s mother Eda in L.A. in March 1908 – she was a divorcée, he a widower. Ramona Street was named nine months later, and I found no likelier Ramonas to have served as inspiration. (Tragic side note: her stepsister Madeline died in 1922 from tuberculosis.) Ramona Bodell married real estate broker Charles Lafayette Hilliard in 1921, and they clearly did well financially: their names grace an endowed professorship at USC, which is no cheap thing. The childfree couple spent their golden years in Palm Desert.",https://lastreetnames.com/wp-content/uploads/2022/05/ramona-street-map.png
https://lastreetnames.com/street/ramona-street-pasadena/,Ramona Street,Pasadena,"Several streets in Los Angeles County owe their name to a book:Ramona, the 1884 novel by Helen Hunt Jackson (1830-1885). The first bestseller set in Southern California,Ramonais ostensibly a romance about an orphaned “halfbreed” woman who falls in love with a Native American man, but it endures as a candid account of the hardships indigenous Californians faced after 1850 statehood, when white capitalists, in collusion with the federal government, took their land and removed them from their homes. Some have comparedRamonatoUncle Tom’s Cabinin its effect of awakening white readers to the plight of a disenfranchised people, yet Jackson’s evocative descriptions of the SoCal landscape would only attract more white settlers to the state. Selling hundreds of thousands of copies and receiving five big-screen adaptations, the novel was such a blockbuster that seemingly every town in California had to have a street named Ramona. In fact Interstate 10 through the San Gabriel Valley was previously known as the Ramona Freeway.",https://lastreetnames.com/wp-content/uploads/2022/04/ramona-street-map.png
https://lastreetnames.com/street/rampart-boulevard/,Rampart Boulevard,Echo Park,"A rampart is a fortified wall outside a castle, settlement, etc. L.A. never had such a thing, so where did this street get its name? From New Orleans, naturally. Back in 1887, three roads were established on the West End Terrace tract, near Westlake: Rampart Street, Baronne Street, andCarondelet Street. All three also happen to be historic thoroughfares in NOLA’s Central Business District, laid out in the same order. (And yes, colonial New Orleans indeed had a fortified wall where their Rampart Street now lies.) The tract was co-owned by Los Angeles Police Commissioner George Crockett Knox (1841-1890), who had lived in NOLA as a young man. Residents had Baronne renamedCoronado Streetin 1894; Rampart got upgraded to boulevard status in 1905.",https://lastreetnames.com/wp-content/uploads/2022/07/rampart-boulevard-map.png
https://lastreetnames.com/street/randolph-street/,Randolph Street,Glendale,"In 1904, Leslie CoombsBrand(1859-1925) laid out the Glendale Boulevard tract and anointed its streets with names that had personal meaning to him:Louisefor his wife;DrydenandStockerfor his sisters;Campbellfor his dearest friend. As for Randolph Street, there are two potential namesakes. The first is Randolph County, MO. Brand lived there in the city of Moberly for several years, and it’s where he learned the ins and outs of title insurance – the field that made him a fortune. The second is “Colonel” Epes Randolph (1856-1921), the Virginia-born railroad tycoon famous for developing Tucson, AZ. Randolph worked with Henry E.Huntingtonon the Pacific Electric Railway… and Huntington, who partnered with Brand on several ventures (see theotherBrand Blvd.), co-owned this tract. Brand himself had ties to the “Colonel” in 1904, so it’s possible that he named this street for him in tribute. But it’s hard to believe Brand would have valued Epes Randolph as highly as he did his own wife and sisters.",https://lastreetnames.com/wp-content/uploads/2022/05/randolph-street-map.png
https://lastreetnames.com/street/raymer-street/,Raymer Street,Northridge,"Raymer was the name of a train station built here in 1898 (supposedly; the earliest reference I found was in 1907). Then in 1913 there came the Raymer tract. Raymer Street itself was named in 1917. So who was this Raymer? No one knows. The most prominent Angeleno by that name was Amos Raymer (1853-1928), an insurance man who speculated in real estate and mining. Those qualifications would make him a no-brainer namesake in those days, yet he had no apparent connections to the Valley or to the railroad. A distant second would be George Raymer of the Chicago, Burlington & Quincy Railroad, but only because the tiny Colorado town of Raymer was named for him in 1888. He may have never come to California – his railroad didn’t – so he’s a stretch. Yet no other Raymer comes close. Showbiz trivia: Talk show host Conan O’Brien unsuccessfully lobbied to get a portion of Raymer Street named for him in 2011. I don’t think he was very serious about it.",https://lastreetnames.com/wp-content/uploads/2022/04/raymer-street-map.png
https://lastreetnames.com/street/raymond-avenue/,Raymond Avenue,Alhambra,"Boston-born hotelier Walter Raymond (1851-1934) arrived in L.A. in 1883 with the express intent of establishing the Raymond Hotel, a luxury resort, in South Pasadena. It took him three years – Raymond Avenue was named during that time – but Raymond finally opened his hotel in 1886, thus transforming rural boondocks into holiday destination. (BaconHill, upon which the hotel was constructed, was soon rechristened Raymond Hill.) On Easter Sunday, 1895, an ember from one of its eighty chimneys burned the Raymond down, but Walter had it rebuilt by 1901, even bigger and better. Years later, the Raymond was knocked out by the one-two punch of the popularHuntingtonHotel and the less-popular Great Depression; it was demolished in 1934 to make room for apartment buildings. Walter Raymond, weakened by a stroke, died in his cottage on the Raymond’s grounds while his majestic hotel was being torn down around him.",https://lastreetnames.com/wp-content/uploads/2022/07/raymond-avenue-map.png
https://lastreetnames.com/street/saginaw-avenue/,Saginaw Avenue,Eagle Rock,"Named on 1908’s Saginaw Heights tract, owned by Cornelius Martin Myers (1833-1914), whose son William developed several other Eagle Rock tracts (seeAvoca Street). Myers the elder worked in education for many years, first as night school superintendent in his hometown of Paterson, NJ, then as department chair atHartwickSeminary near Cooperstown, NY, where he married local girl Margaret Helen Jones (1834-1919) and had one child with her: William. Myers then got a job as a school principal in Saginaw, MI. Despite the brevity of his sojourn there – arrived no earlier than 1867 and departed for Lanark, IL by 1870 – the city obviously left enough of an impression that he named this street after it. TheMyerses moved to Anita, IA in 1876 and gave up education for banking: unusual for the time, the Bank of Anita listed Margaret as its president and Cornelius as its cashier. They joined their son in Los Angeles c. 1903.",https://lastreetnames.com/wp-content/uploads/2023/05/saginaw-avenue-map.png
https://lastreetnames.com/street/saltair-avenue/,Saltair Avenue,Brentwood,"Saltair is likely just a compound of “salt air”, a reference to the sea breeze, although Saltair Avenue is three miles inland. Born on theWestgatedevelopment, Saltair was named in 1905, when there was already a more site-appropriate Saltair Avenue in Venice. (That one’s now called Topsail Street.) This newer Saltair might have been inspired by the Saltair resort on Utah’s Great Salt Lake, a popular destination at the time, or else someone simply copied the name from Venice. South ofWilshire, this road was originally called Wabash Street. It took in the Saltair in 1926.",https://lastreetnames.com/wp-content/uploads/2022/07/saltair-avenue-map.png
https://lastreetnames.com/street/samoa-avenue/,Samoa Avenue,Sunland-Tujunga,"Samoa Avenue was born San Ysidro Road in 1913, when William E. Smythe – head of the “Little Landers” movement of utopian farm communities – and Tujunga godfather Marshall V. Hartranft opened a Little Landers colony here. The street’s name was surely a reference to the California border town that Smythe had developed four years earlier: the first Little Landers colony. Alas, in 1932, whenTujungawas annexed by the City of Los Angeles, all street names that had duplicates in L.A. had to be changed to avoid postal conflicts. Since there was already aSan Ysidro Drivein the hills east ofBenedict Canyon, Tujunga’s San Ysidro needed a new name. Why Samoa? No special reason; civil engineers often replaced street names with those starting with the same letters, so they probably just combed through their “idea file” of potential names and saw that Samoa, which also started with “Sa”, was available.",https://lastreetnames.com/wp-content/uploads/2024/02/samoa-avenue-map-1.png
https://lastreetnames.com/street/san-diego-way/,San Diego Way,Carthay Circle,"When J. HarveyMcCarthylaid out Carthay Center in 1922, he and landscape architects Wilbur David Cook Jr. and George Duffield Hall included a unique feature: five pedestrian-only shortcuts through the tract’s residential blocks. Each “way” is named after a California mission: Capistrano, Carmel, San Diego, San Gabriel, and Santa Ynez. These are all paved public sidewalks with streetlights and City of Los Angeles road signs. Neighborhood wanderers will also spot signage for White Esplanade, which honors SenatorStephen M. White(D-CA), and Ramona Court, a nod to the local “RamonaParlor” chapter of the Native Sons of the Golden West, who advised McCarthy on naming his streets after historic Californians.",https://lastreetnames.com/wp-content/uploads/2022/09/san-diego-way-map.png
https://lastreetnames.com/street/san-dimas-avenue/,San Dimas Avenue,San Dimas,"San Dimas is the Spanish variant of Saint Dismas, the penitent thief who was crucified next to Jesus. The old story goes that the name came to this region when YgnacioPalomares, who owned this land in the mid 19th century, was besieged by thieves – penitent or not – who either stole or left his livestock in a nearby canyon. He thus dubbed the canyon “San Dimas” as a Catholic joke. True? There’s no documentation from the time, so I can’t say. What I can say is that while the canyon was named by 1871 (and presumably years earlier), the city of San Dimas started out around 1866 as the humble village of Mud Springs, so-named for a nearbyciénega. It was reestablished in 1887 as San Dimas, as was this avenue. The town was founded by theSan JoseRanch Company, run by Moses L.Wicksand Howard W. Mills.",https://lastreetnames.com/wp-content/uploads/2022/09/san-dimas-avenue-map.png
https://lastreetnames.com/street/san-gabriel-way/,San Gabriel Way,Carthay Circle,"When J. HarveyMcCarthylaid out Carthay Center in 1922, he and landscape architects Wilbur David Cook Jr. and George Duffield Hall included a unique feature: five pedestrian-only shortcuts through the tract’s residential blocks. Each “way” is named after a California mission: Capistrano, Carmel, San Diego, San Gabriel, and Santa Ynez. These are all paved public sidewalks with streetlights and City of Los Angeles road signs. Neighborhood wanderers will also spot signage for White Esplanade, which honors SenatorStephen M. White(D-CA), and Ramona Court, a nod to the local “RamonaParlor” chapter of the Native Sons of the Golden West, who advised McCarthy on naming his streets after historic Californians.",https://lastreetnames.com/wp-content/uploads/2022/09/san-gabriel-way-map.png
https://lastreetnames.com/street/san-juan-avenue/,San Juan Avenue,Venice,"On July 4th, 1905, entrepreneurAbbot Kinneyopened his “Venice of America” resort, centered around eight canals modeled after those in Venice, Italy. The six canals you see today were laid out by different developers that same year; Kinney’s canals werefinitoby 1930 thanks to a number of factors: L.A.’s growing automobile usage making them inconvenient; tourists finding more amusements on the shore than in the canal boats; and the poorly-drained canals becoming increasingly filthy and expensive to maintain. Kinney deeded them to the City of Venice (when it was still its own municipality) in 1912, basically to make taxpayers pay for their upkeep. After he died in 1920, there began a demand to convert his canals into streets. Venice set the plans in motion in March 1925 and coined new street names that June: Grand and Rialto canals, which took their names from Italy’s Venice, were to be renamed Grand Boulevard and Rialto Avenue. Venus, Aldebaran, and Altair canals – named after heavenly bodies – would now beSan Juan Avenue, Market Street, and Altair Place, respectively. Lion Canal would become an extension ofWindward Avenue, Cabrillo Canal would be Cabrillo Avenue, and Coral Canal would be Second Avenue (now part of Santa Monica’sMain Street). It took four more years, the City of L.A. annexing Venice, and numerous legal snags, but the canals were finally filled in and paved by January 29th, 1930.",https://lastreetnames.com/wp-content/uploads/2023/03/san-juan-avenue-map.png
https://lastreetnames.com/street/san-marino-avenue/,San Marino Avenue,San Gabriel,"The “San Marino” name was imported from the Italian Peninsula – via Maryland. James De BarthShorb, who founded the town (originally a ranch) in 1877, named it after his childhood home: the San Marino plantation in Emmitsburg, MD. Said plantation took its name from the Republic of San Marino, the tiny nation surrounded by Italy, supposedly because it had the same acreage. And the Republic of San Marino took its own name from Saint Marinus, who in the year 301 established a monastery where the country now stands. Our San Marino, incorporated in 1913, employs parts of the republic’s flag in its city seal. Pasadena’s San Marino Avenue was named by 1889.",https://lastreetnames.com/wp-content/uploads/2022/04/san-marino-avenue-map.png
https://lastreetnames.com/street/san-pedro-street/,San Pedro Street,Los Angeles (Citywide),"Juan Rodríguez Cabrillo didn’t christen San Pedro Bay in 1542 – he called it Bay of the Smokes and/or Bay of the Fires. Later explorer Sebastián Vizcaíno didn’t name it either: he dubbed it San Andrés in 1602. (He did however name SantaCatalinaIsland.) The most likely story is that Admiral José González Cabrera Bueno read Vizcaíno’s diary, noted that the bay was named on November 26th – the feast day of Saint Peter of Alexandria – and, correcting what he felt was Vizcaíno’s mistake, wrote down “San Pedro” in his 1734 treatiseSpeculative and Practical Navigation. At any rate, that’s when it first appeared in terms of a SoCal place name. Fifty years later, the Spanish Crown deeded the 75,000 acre Rancho San Pedro to Juan JoséDomínguez; his family would own it for generations. A port at San Pedro was operating by the 1830s. San Pedro Street itself was named by 1853, obviously because it connected Los Angeles to San Pedro. It doesn’t anymore: it merges intoAvalon Blvd.just north ofAlondra.",https://lastreetnames.com/wp-content/uploads/2022/09/san-pedro-street-map.png
https://lastreetnames.com/street/san-vicente-boulevard-central/,San Vicente Boulevard (Central),Beverly Grove,"L.A.’s two San Vicente Boulevards are five miles apart at their closest points. Where they ever meant to connect? Unlikely. The one between Brentwood and Santa Monica – seeSan Vicente Boulevard (Westside)– definitely came first, in 1905. This one got its start in 1922, and while a real estate ad that April promised that this new San Vicente was “continuing the extension of this double boulevard to the sea”, I found no evidence of it being a serious plan. In any event, this San Vicente went through a couple of name changes. Up until 1929, the stretch betweenFairfaxandLa Cienegawas called Eulalia Boulevard, apparently after legendary SoCal centenarian Eulalia Peréz de Guillén. (This was the doing of Carthay Center developer J. HarveyMcCarthy, who named his streets after historic Californians.) Meanwhile, since the road straddled the Pacific Electric tracks up leading up to theShermanrail yards – today’s Pacific Design Center – San Vicente originally went no further thanSanta Monica Boulevard. The road north of there was calledClark Streetuntil 1968, when it finally adopted the San Vicente name. It’s still called Clark north ofSunset.",https://lastreetnames.com/wp-content/uploads/2022/07/san-vicente-boulevard-map.png
https://lastreetnames.com/street/san-vicente-boulevard-westside/,San Vicente Boulevard (Westside),Brentwood,"Los Angeles has two entirely separate San Vicente Boulevards. This entry concerns the one that runs between Brentwood and Santa Monica; for the one between Mid-City and WeHo, seeSan Vicente Boulevard (Central). Laid out in 1905 on the newWestgatetownsite, this San Vicente was named after Rancho San Vicente ySanta Monica, the land grant deeded to FranciscoSepúlvedain 1839. (Much of present-day Santa Monica sits on this old rancho, whose boundaries had been disputed for years.) It’s not known which Saint Vincent was honored by the rancho, but it was probably St. Vincent de Paul (1581-1660). At any rate, San Vicente Boulevard was designed to connect Santa Monica toSawtelleand Soldiers’ Home (now theVAcampus), with the tracks of the Los Angeles-Pacific Railroad – later the Pacific Electric – lining the median. Coral trees and grass replaced those tracks in 1950.",https://lastreetnames.com/wp-content/uploads/2022/07/san-vicente-boulevard-map-1.png
https://lastreetnames.com/street/sanborn-avenue/,Sanborn Avenue,Silver Lake,"Sanborn Avenue was born DeFrees Street in 1887. In 1906, the Pacific Electric Railway established a streetcar stop at DeFrees andSunsetand called it “Sanborn Junction”. You know it today as Sunset Junction. Since conductors and passengers kept referring to DeFrees as “Sanborn”, the City gave in and changed the street’s name officially in 1914. So where did “Sanborn” come from? I found the answer in a WWI draft card belonging to a John DeFrees Sanborn (1882-1943), a one-eyed realtor who lived with his parents at 4002 Sunset Blvd – smack dab in the middle of Sunset Junction. Said parents were Dr. Francis Asbury Sanborn (1837-1921) and Georgiana DeFrees Sanborn (1842-1919): DeFrees was her maiden name. They came here from Ohio in the 1880s to take part in L.A.’s real estate boom. In fact DeFrees Street originated on the couple’sManzanitaHeights tract.",https://lastreetnames.com/wp-content/uploads/2022/04/sanborn-avenue-map.png
https://lastreetnames.com/street/sanchez-street/,Sanchez Street,DTLA,"It’s not much of a street per se – just an alley in the El Pueblo de Los Angeles Plaza Historic District – but it memorializes Vicente Sánchez (1785-1846),alcalde(mayor) of Los Angeles in 1831-1832. As a former soldier during Alta California’s days as a Mexican territory, Sánchez was deeded the land grant known as RanchoCiénegao Paso dela Tijera, but he preferred city life over being a ranchero, so he lived in an adobe on this very street, named in his memory by 1864. His home was the first two-story structure in Los Angeles.",https://lastreetnames.com/wp-content/uploads/2022/05/sanchez-street-map.png
https://lastreetnames.com/street/sanchez-street-montebello/,Sanchez Street,Montebello,"Named for rancher Juan Matias Sánchez (1808-1885). Sánchez hailed from Taos, New Mexico, where he first worked for English-born pioneer WilliamWorkman. The two developed a close bond and Sánchez later joined Workman in California as his ranch foreman. In 1851, Workman gave Sánchez half of Ranchola Merced, located here, after he took the property from his debtor CasildaSotode Lobo. (The other half went to F.P.F.Temple.) Sánchez later acquired part of RanchoPotrero Grandeand ultimately owned over 3,000 acres of land. However, in 1875, when William Workman desperately needed a loan from LuckyBaldwinto save his failing bank, the ever-loyal Sánchez put up his land as collateral. It was a bad decision: Workman couldn’t pay off the loan, which drove him to suicide, and Sánchez was forced to cede all but 200 acres to Baldwin. Hisadobestill stands as Montebello’s oldest structure.",https://lastreetnames.com/wp-content/uploads/2022/07/sanchez-street-map.png
