store_code,sku,item_title,primary_image,primary_image_url,sales_size,sales_uom_description,final_price,retail_price,fun_tags,item_characteristics,category_hierarchy,name,store_number,drop,prod_cat,prod_cat_type,prod_cat_desc
648,075091,Reusable Sponge Cloths,/content/dam/trjo/products/m501/75091.png,/content/dam/trjo/products/m501/75091.png,1.0,Each,3.99,3.99,"Backpack Ready, Giftable, The ""X"" Factor",,Products > Everything Else > Household Essentials,Trader Joe's North Potomac ,648,Products , Everything Else , Household Essentials,
648,077316,Sesame Miso Salad with Salmon,/content/dam/trjo/products/m20501/77316.png,/content/dam/trjo/products/m20501/77316.png,10.25,Oz,6.99,6.99,"Alfresco Dining, Dinner Hack, Picnic",,"Products > Food > Fresh Prepared Foods > Salads, Soups & Sides",Trader Joe's North Potomac ,648,Products , Food , Fresh Prepared Foods ," Salads, Soups & Sides"
648,077429,Green Goddess Salad,/content/dam/trjo/products/m20501/77429.png,/content/dam/trjo/products/m20501/77429.png,9.75,Oz,5.99,5.99,"Dinner Hack, Picnic",,"Products > Food > Fresh Prepared Foods > Salads, Soups & Sides",Trader Joe's North Potomac ,648,Products , Food , Fresh Prepared Foods ," Salads, Soups & Sides"
648,061445,Fresh Mozzarella Cheese Log,/content/dam/trjo/products/m20201/61445.png,/content/dam/trjo/products/m20201/61445.png,16.0,Oz,5.99,5.99,"Alfresco Dining, Dinner Hack, Picnic, Rain or Shine, Time-pressed",Kosher,"Products > Food > Cheese > Slices, Shreds, Crumbles",Trader Joe's North Potomac ,648,Products , Food , Cheese ," Slices, Shreds, Crumbles"
648,062234,Organic Raw Apple Cider Vinegar,/content/dam/trjo/products/m20904/62234.png,/content/dam/trjo/products/m20904/62234.png,16.9,Fl Oz,2.49,2.49,"A Long Finish, The ""X"" Factor","Kosher, Organic",Products > Food > For the Pantry > Oils & Vinegars,Trader Joe's North Potomac ,648,Products , Food , For the Pantry , Oils & Vinegars
648,021509,Organic Hearty Vegetable Broth,/content/dam/trjo/products/m20908/21509.png,/content/dam/trjo/products/m20908/21509.png,32.0,Fl Oz,1.99,1.99,"Chance of Rain, Cold Front, Dinner Hack, Time-pressed, Welcoming","Gluten Free, Organic, Kosher","Products > Food > For the Pantry > Soup, Chili & Meals",Trader Joe's North Potomac ,648,Products , Food , For the Pantry ," Soup, Chili & Meals"
648,055238,Organic Coconut Milk,/content/dam/trjo/products/m20905/55238.png,/content/dam/trjo/products/m20905/55238.png,13.5,Fl Oz,1.69,1.69,"Feeling Adventurous, Let's Bake!, Rain or Shine","Organic, Kosher",Products > Food > For the Pantry > For Baking & Cooking,Trader Joe's North Potomac ,648,Products , Food , For the Pantry , For Baking & Cooking
648,075079,Chocolate Hazelnut Ground Coffee,/content/dam/trjo/products/m304/75079.png,/content/dam/trjo/products/m304/75079.png,12.0,Oz,6.99,6.99,"Alfresco Dining, Brunch All Day, Effortless Entertaining, Feeling Fancy, Glass Half Full, Rise & Shine",Kosher,Products > Beverages > Coffee & Tea,Trader Joe's North Potomac ,648,Products , Beverages , Coffee & Tea,
648,075961,Gluten Free Tagliatelle Pasta,/content/dam/trjo/products/m20901/75961.png,/content/dam/trjo/products/m20901/75961.png,8.8,Oz,2.49,2.49,"Alfresco Dining, Dinner Hack, In Lieu of Pizza, Pair With Wine",Gluten Free,Products > Food > For the Pantry > Pastas & Grains,Trader Joe's North Potomac ,648,Products , Food , For the Pantry , Pastas & Grains
648,075423,Organic Plain Cream Cheese Spread,/content/dam/trjo/products/m20204/75423.png,/content/dam/trjo/products/m20204/75423.png,8.0,Oz,3.49,3.49,"Alfresco Dining, Brunch All Day, Cheese Board, Rise & Shine","Organic, Kosher",Products > Food > Cheese > Cream and Creamy Cheeses,Trader Joe's North Potomac ,648,Products , Food , Cheese , Cream and Creamy Cheeses
648,058643,"Gluten Free 
Egg Fettuccine Pasta",/content/dam/trjo/products/m20503/58643.png,/content/dam/trjo/products/m20503/58643.png,9.0,Oz,3.99,3.99,"Alfresco Dining, Dinner Hack, In Lieu of Pizza, Pair With Wine, The ""X"" Factor","Gluten Free, Kosher",Products > Food > Fresh Prepared Foods > Entrées & Center of Plate,Trader Joe's North Potomac ,648,Products , Food , Fresh Prepared Foods , Entrées & Center of Plate
648,003029,Orzo Italian Pasta,/content/dam/trjo/products/m20901/03029.png,/content/dam/trjo/products/m20901/03029.png,1.0,Lb,0.99,0.99,"Alfresco Dining, Family Style, Pair With Wine",Kosher,Products > Food > For the Pantry > Pastas & Grains,Trader Joe's North Potomac ,648,Products , Food , For the Pantry , Pastas & Grains
648,045226,Roasted Garlic Marinara Sauce,/content/dam/trjo/products/m20402/45226.png,/content/dam/trjo/products/m20402/45226.png,24.0,Oz,1.99,1.99,"Alfresco Dining, Dinner Hack, Family Style, Pair With Wine",Kosher,"Products > Food > Dips, Sauces & Dressings > BBQ, Pasta, Simmer",Trader Joe's North Potomac ,648,Products , Food ," Dips, Sauces & Dressings "," BBQ, Pasta, Simmer"
648,073711,Almond Chipotle Dip,/content/dam/trjo/products/m20404/73711.png,/content/dam/trjo/products/m20404/73711.png,9.0,Oz,3.49,3.49,"Alfresco Dining, Cheese Board, Crack a Beer, Feeling Adventurous, Game Night, Midday Snacks, Picnic",Vegan,"Products > Food > Dips, Sauces & Dressings > Dip/Spread",Trader Joe's North Potomac ,648,Products , Food ," Dips, Sauces & Dressings ", Dip/Spread
648,091755,Cut Butternut Squash,/content/dam/trjo/products/m20702/91755.png,/content/dam/trjo/products/m20702/91755.png,20.0,Oz,3.99,2.69,"Alfresco Dining, Dinner Hack, Fall Faves, Rain or Shine",,Products > Food > Fresh Fruits & Veggies > Veggies,Trader Joe's North Potomac ,648,Products , Food , Fresh Fruits & Veggies , Veggies
648,006223,Sour Cream,/content/dam/trjo/products/m20303/06223.png,/content/dam/trjo/products/m20303/06223.png,16.0,Oz,0.0,2.79,"Alfresco Dining, Family Style, Let's Bake!, Picnic, Rain or Shine",Kosher,"Products > Food > Dairy & Eggs > Yogurt, etc.",Trader Joe's North Potomac ,648,Products , Food , Dairy & Eggs ," Yogurt, etc."
648,027042,Organic Cane Sugar,/content/dam/trjo/products/m20905/27042.png,/content/dam/trjo/products/m20905/27042.png,2.0,Lb,3.99,3.99,Let's Bake!,"Kosher, Organic",Products > Food > For the Pantry > For Baking & Cooking,Trader Joe's North Potomac ,648,Products , Food , For the Pantry , For Baking & Cooking
648,075512,Lactose Free Cream Cheese,/content/dam/trjo/products/m20204/75512.png,/content/dam/trjo/products/m20204/75512.png,8.0,Oz,3.79,3.79,"Brunch All Day, Picnic, Rise & Shine, The ""X"" Factor",,Products > Food > Cheese > Cream and Creamy Cheeses,Trader Joe's North Potomac ,648,Products , Food , Cheese , Cream and Creamy Cheeses
648,016574,Ground Turkey,/content/dam/trjo/products/m20802/16574.png,/content/dam/trjo/products/m20802/16574.png,1.0,Lb,4.49,4.49,"Crack a Beer, Family Style, Fire Up The Grill, Fry It Up, Game Night, Picnic, Put An Egg On It, Rain or Shine",,Products,Trader Joe's North Potomac ,648,Products,,,
648,076371,Lobster Bisque,/content/dam/trjo/products/m20501/76371.png,/content/dam/trjo/products/m20501/76371.png,16.0,Oz,4.99,4.99,"Alfresco Dining, Chance of Rain, Dinner Hack, Rain or Shine",,"Products > Food > Fresh Prepared Foods > Salads, Soups & Sides",Trader Joe's North Potomac ,648,Products , Food , Fresh Prepared Foods ," Salads, Soups & Sides"
648,076277,Crunchy Chili Onion Hummus,/content/dam/trjo/products/m20404/76277.png,/content/dam/trjo/products/m20404/76277.png,10.0,Oz,3.99,3.99,"Midday Snacks, Picnic",Kosher,"Products > Food > Dips, Sauces & Dressings > Dip/Spread",Trader Joe's North Potomac ,648,Products , Food ," Dips, Sauces & Dressings ", Dip/Spread
648,075552,Reusable Silicone Food Storage Bags,/content/dam/trjo/products/m501/75552.png,/content/dam/trjo/products/m501/75552.png,1.0,Each,9.99,9.99,"Backpack Ready, Family Style, Giftable, Picnic",,Products > Everything Else > Household Essentials,Trader Joe's North Potomac ,648,Products , Everything Else , Household Essentials,
648,075233,Mango Blueberry Chia Bowl,/content/dam/trjo/products/m20602/75233.png,/content/dam/trjo/products/m20602/75233.png,7.0,Oz,3.49,3.49,"Alfresco Dining, Brunch All Day, Rise & Shine",Kosher,Products > Food > From The Freezer > Entrées & Sides,Trader Joe's North Potomac ,648,Products , Food , From The Freezer , Entrées & Sides
648,075475,Chicken Cheese & Green Chile Pupusas,/content/dam/trjo/products/m20602/75475.png,/content/dam/trjo/products/m20602/75475.png,12.0,Oz,4.79,4.79,"Alfresco Dining, Crack a Beer, Dinner Hack, Fry It Up",,Products > Food > From The Freezer > Entrées & Sides,Trader Joe's North Potomac ,648,Products , Food , From The Freezer , Entrées & Sides
648,009976,Organic Marinara Sauce,/content/dam/trjo/products/m20402/09976.png,/content/dam/trjo/products/m20402/09976.png,25.0,Oz,3.49,3.49,"Alfresco Dining, Family Style, Pair With Wine",Organic,"Products > Food > Dips, Sauces & Dressings > BBQ, Pasta, Simmer",Trader Joe's North Potomac ,648,Products , Food ," Dips, Sauces & Dressings "," BBQ, Pasta, Simmer"
648,090538,Mushroom & Black Truffle Flatbread,/content/dam/trjo/products/m20602/90538.png,/content/dam/trjo/products/m20602/90538.png,9.0,Oz,5.49,5.49,"Alfresco Dining, Crack a Beer, Date Night, Feeling Fancy, Fire Up The Grill, Pair With Wine",,Products > Food > From The Freezer > Entrées & Sides,Trader Joe's North Potomac ,648,Products , Food , From The Freezer , Entrées & Sides
648,074888,Chai Tea Mints,/content/dam/trjo/products/m21002/74888.png,/content/dam/trjo/products/m21002/74888.png,1.2,Oz,1.99,1.99,"Backpack Ready, Date Night, Desk Drawer, Giftable",Vegan,Products > Food > Snacks & Sweets > Candies & Cookies,Trader Joe's North Potomac ,648,Products , Food , Snacks & Sweets , Candies & Cookies
648,074465,Grilled Pitted Green Olives,/content/dam/trjo/products/m20902/74465.png,/content/dam/trjo/products/m20902/74465.png,11.64,Oz,3.99,3.99,"Alfresco Dining, Cheese Board, Crack a Beer, Effortless Entertaining, Finger Food, Pair With Wine, Picnic",,"Products > Food > For the Pantry > Packaged Fish, Meat, Fruit & Veg",Trader Joe's North Potomac ,648,Products , Food , For the Pantry ," Packaged Fish, Meat, Fruit & Veg"
648,073567,Portuguese Bacalhau Tartlettes,/content/dam/trjo/products/m20602/73567.png,/content/dam/trjo/products/m20602/73567.png,9.3,Oz,1.99,1.99,"Alfresco Dining, Effortless Entertaining, Feeling Adventurous",,Products > Food > From The Freezer > Entrées & Sides,Trader Joe's North Potomac ,648,Products , Food , From The Freezer , Entrées & Sides
648,075629,Peanut Butter Chocolate Granola,/content/dam/trjo/products/m20907/75629.png,/content/dam/trjo/products/m20907/75629.png,12.0,Oz,3.99,3.99,"Alfresco Dining, Backpack Ready, Brunch All Day, Desk Drawer, Midday Snacks, Rise & Shine",Kosher,Products > Food > For the Pantry > Cereals,Trader Joe's North Potomac ,648,Products , Food , For the Pantry , Cereals
648,055476,Gluten Free Cinnamon Raisin Bread,/content/dam/trjo/products/m20101/55476.png,/content/dam/trjo/products/m20101/55476.png,12.0,Oz,4.49,4.49,"Brunch All Day, Family Style, Rain or Shine, Rise & Shine","Gluten Free, Vegan, Kosher",Products > Food > Bakery > Sliced Bread,Trader Joe's North Potomac ,648,Products , Food , Bakery , Sliced Bread
648,010142,Broccoli & Cheddar Cheese Quiche,/content/dam/trjo/products/m20602/10142.png,/content/dam/trjo/products/m20602/10142.png,6.0,Oz,2.99,2.99,"Alfresco Dining, Brunch All Day, Dinner Hack, Rain or Shine, Rise & Shine",,Products > Food > From The Freezer > Entrées & Sides,Trader Joe's North Potomac ,648,Products , Food , From The Freezer , Entrées & Sides
648,076572,Chocolate Vanilla Creme Joe-Joe's,/content/dam/trjo/products/m21002/76572.png,/content/dam/trjo/products/m21002/76572.png,13.4,Oz,2.99,2.99,"Backpack Ready, Desk Drawer, Family Style, Treat Yourself",Kosher,Products > Food > Snacks & Sweets > Candies & Cookies,Trader Joe's North Potomac ,648,Products , Food , Snacks & Sweets , Candies & Cookies
648,075425,Waffle Weave Cotton Kitchen Towels,/content/dam/trjo/products/m501/75425.png,/content/dam/trjo/products/m501/75425.png,1.0,Each,7.99,7.99,"Giftable, Welcoming",,Products > Everything Else > Household Essentials,Trader Joe's North Potomac ,648,Products , Everything Else , Household Essentials,
648,074463,Lemongrass Moisturizing Shampoo,/content/dam/trjo/products/m502/74463.png,/content/dam/trjo/products/m502/74463.png,15.2,Fl Oz,4.99,4.99,Treat Yourself,,Products > Everything Else > For the Face & Body,Trader Joe's North Potomac ,648,Products , Everything Else , For the Face & Body,
648,074464,Lemongrass Moisturizing Conditioner,/content/dam/trjo/products/m502/74464.png,/content/dam/trjo/products/m502/74464.png,15.2,Fl Oz,4.99,4.99,Treat Yourself,,Products > Everything Else > For the Face & Body,Trader Joe's North Potomac ,648,Products , Everything Else , For the Face & Body,
648,075760,Fudgy Cookie Dough Ice Cream,/content/dam/trjo/products/m20604/75760.png,/content/dam/trjo/products/m20604/75760.png,1.0,Pint,3.79,3.79,"Family Style, Heat Wave, Treat Yourself",Kosher,Products > Food > From The Freezer > Cool Desserts,Trader Joe's North Potomac ,648,Products , Food , From The Freezer , Cool Desserts
648,058871,Nutritional Yeast,/content/dam/trjo/products/m20905/58871.png,/content/dam/trjo/products/m20905/58871.png,4.0,Oz,3.49,3.49,"Feeling Adventurous, Let's Bake!, The ""X"" Factor","Gluten Free, Kosher, Vegan",Products > Food > For the Pantry > For Baking & Cooking,Trader Joe's North Potomac ,648,Products , Food , For the Pantry , For Baking & Cooking
648,095520,Jumbo Yellow Onions,/content/dam/trjo/products/m20702/95520.png,/content/dam/trjo/products/m20702/95520.png,1.0,Each,0.99,1.19,Yes!,,Products > Food > Fresh Fruits & Veggies > Veggies,Trader Joe's North Potomac ,648,Products , Food , Fresh Fruits & Veggies , Veggies
648,091327,Seedless Watermelon,/content/dam/trjo/products/m20701/91327.png,/content/dam/trjo/products/m20701/91327.png,1.0,Each,5.99,5.99,"Alfresco Dining, Brunch All Day, Family Style, Fire Up The Grill, Heat Wave, Picnic, Rain or Shine",,Products > Food > Fresh Fruits & Veggies > Fruits,Trader Joe's North Potomac ,648,Products , Food , Fresh Fruits & Veggies , Fruits
648,020669,Cantaloupe,/content/dam/trjo/products/m20701/20669.png,/content/dam/trjo/products/m20701/20669.png,1.0,Each,3.49,3.49,"Alfresco Dining, Brunch All Day, Fire Up The Grill, Heat Wave, Picnic, Rise & Shine",,Products > Food > Fresh Fruits & Veggies > Fruits,Trader Joe's North Potomac ,648,Products , Food , Fresh Fruits & Veggies , Fruits
648,075255,Sri Lankan Organic Mango Chutney,/content/dam/trjo/products/m20903/75255.png,/content/dam/trjo/products/m20903/75255.png,8.5,Oz,2.99,2.99,"Alfresco Dining, Cheese Board, Pour It On, The ""X"" Factor","Kosher, Organic",Products > Food > For the Pantry > Nut Butters & Fruit Spreads,Trader Joe's North Potomac ,648,Products , Food , For the Pantry , Nut Butters & Fruit Spreads
648,076839,Unexpected Cheddar Cheese Spread with Hatch Chile,/content/dam/trjo/products/m20204/76839.png,/content/dam/trjo/products/m20204/76839.png,9.0,Oz,4.99,4.99,"Alfresco Dining, Cheese Board, Crack a Beer, Game Night, Picnic",,Products > Food > Cheese > Cream and Creamy Cheeses,Trader Joe's North Potomac ,648,Products , Food , Cheese , Cream and Creamy Cheeses
648,076369,Tiniest Chocolate Chip Cookies,/content/dam/trjo/products/m21002/76369.png,/content/dam/trjo/products/m21002/76369.png,8.0,Oz,3.99,3.99,"Backpack Ready, Desk Drawer, Family Style, Finger Food, Treat Yourself",Kosher,Products > Food > Snacks & Sweets > Candies & Cookies,Trader Joe's North Potomac ,648,Products , Food , Snacks & Sweets , Candies & Cookies
648,076869,Little Gem Lettuce,/content/dam/trjo/products/m20702/76869.png,/content/dam/trjo/products/m20702/76869.png,1.0,Each,3.49,3.49,"Alfresco Dining, Cut The Mustard, Picnic",,Products > Food > Fresh Fruits & Veggies > Veggies,Trader Joe's North Potomac ,648,Products , Food , Fresh Fruits & Veggies , Veggies
648,058039,Nectarines,/content/dam/trjo/products/m20701/58039.png,/content/dam/trjo/products/m20701/58039.png,2.0,Lb,3.49,3.49,"Backpack Ready, Midday Snacks",,Products > Food > Fresh Fruits & Veggies > Fruits,Trader Joe's North Potomac ,648,Products , Food , Fresh Fruits & Veggies , Fruits
648,076917,Organic Romaine & Chicory Blend,/content/dam/trjo/products/m20702/76917.png,/content/dam/trjo/products/m20702/76917.png,7.0,Oz,2.49,2.49,"Alfresco Dining, Dinner Hack, Picnic, Rain or Shine",Organic,Products > Food > Fresh Fruits & Veggies > Veggies,Trader Joe's North Potomac ,648,Products , Food , Fresh Fruits & Veggies , Veggies
648,077563,Organic Free Range Boneless Skinless Thin Sliced Chicken Breast Fillets,/content/dam/trjo/products/m20802/77563.png,/content/dam/trjo/products/m20802/77563.png,1.0,Lb,7.99,7.99,"Fire Up The Grill, Fry It Up, In Lieu of Pizza",Antibiotic Free,"Products > Food > Meat, Seafood & Plant-based > Chicken & Turkey",Trader Joe's North Potomac ,648,Products , Food ," Meat, Seafood & Plant-based ", Chicken & Turkey
648,075253,Organic Dried Ataulfo Mango Slices,/content/dam/trjo/products/m21003/75253.png,/content/dam/trjo/products/m21003/75253.png,6.0,Oz,4.99,4.99,"Backpack Ready, Desk Drawer, Finger Food, Midday Snacks","Kosher, Organic","Products > Food > Snacks & Sweets > Nuts, Dried Fruits, Seeds",Trader Joe's North Potomac ,648,Products , Food , Snacks & Sweets ," Nuts, Dried Fruits, Seeds"
648,074755,Organic Assam Black Tea,/content/dam/trjo/products/m304/74755.png,/content/dam/trjo/products/m304/74755.png,48.0,Bag,4.49,4.49,"Alfresco Dining, Brunch All Day, Rise & Shine",Organic,Products > Beverages > Coffee & Tea,Trader Joe's North Potomac ,648,Products , Beverages , Coffee & Tea,
648,074702,Italian Sparkling Mineral Water,/content/dam/trjo/products/m302/74702.png,/content/dam/trjo/products/m302/74702.png,25.4,Fl Oz,1.99,1.99,"Alfresco Dining, Family Style",,Products > Beverages > Water (Sparkling & Still),Trader Joe's North Potomac ,648,Products , Beverages , Water (Sparkling & Still),
648,073030,Chicken Karaage,/content/dam/trjo/products/m20602/73030.png,/content/dam/trjo/products/m20602/73030.png,18.97,Oz,6.49,6.49,"Crack a Beer, Feeling Adventurous, In Lieu of Pizza",,Products > Food > From The Freezer > Entrées & Sides,Trader Joe's North Potomac ,648,Products , Food , From The Freezer , Entrées & Sides
648,037786,Romaine Hearts,/content/dam/trjo/products/m20702/37786.png,/content/dam/trjo/products/m20702/37786.png,18.0,Oz,2.99,2.99,"Alfresco Dining, Family Style, In Lieu of Pizza, Picnic, Rain or Shine",,Products > Food > Fresh Fruits & Veggies > Veggies,Trader Joe's North Potomac ,648,Products , Food , Fresh Fruits & Veggies , Veggies
648,066299,Dairy-Free Mozzarella Style Shreds,/content/dam/trjo/products/m20201/66299.png,/content/dam/trjo/products/m20201/66299.png,7.0,Oz,3.99,3.99,"The ""X"" Factor","Dairy Free, Vegan","Products > Food > Cheese > Slices, Shreds, Crumbles",Trader Joe's North Potomac ,648,Products , Food , Cheese ," Slices, Shreds, Crumbles"
648,065062,Dairy-Free Cheddar Style Slices,/content/dam/trjo/products/m20201/65062.png,/content/dam/trjo/products/m20201/65062.png,7.0,Oz,3.99,3.99,"Cut The Mustard, The ""X"" Factor","Dairy Free, Vegan","Products > Food > Cheese > Slices, Shreds, Crumbles",Trader Joe's North Potomac ,648,Products , Food , Cheese ," Slices, Shreds, Crumbles"
648,076269,Non-Dairy Vanilla Bean Oat Frozen Dessert,/content/dam/trjo/products/m20604/76269.png,/content/dam/trjo/products/m20604/76269.png,1.0,Pint,3.99,3.99,"Heat Wave, Treat Yourself","Dairy Free, Kosher",Products > Food > From The Freezer > Cool Desserts,Trader Joe's North Potomac ,648,Products , Food , From The Freezer , Cool Desserts
648,075231,Root Beer Float Bars,/content/dam/trjo/products/m20604/75231.png,/content/dam/trjo/products/m20604/75231.png,15.0,Fl Oz,3.49,3.49,"Family Style, Heat Wave, Treat Yourself",Kosher,Products > Food > From The Freezer > Cool Desserts,Trader Joe's North Potomac ,648,Products , Food , From The Freezer , Cool Desserts
648,076020,S'Mores Bars,/content/dam/trjo/products/m20604/76020.png,/content/dam/trjo/products/m20604/76020.png,7.5,Oz,4.99,4.99,"Alfresco Dining, Family Style, Heat Wave, Treat Yourself",Kosher,Products > Food > From The Freezer > Cool Desserts,Trader Joe's North Potomac ,648,Products , Food , From The Freezer , Cool Desserts
648,091072,Organic Kosher Sandwich Pickles,/content/dam/trjo/products/m20902/91072.png,/content/dam/trjo/products/m20902/91072.png,16.0,Fl Oz,3.99,3.99,"Alfresco Dining, Cut The Mustard, Family Style, Picnic","Organic, Kosher","Products > Food > For the Pantry > Packaged Fish, Meat, Fruit & Veg",Trader Joe's North Potomac ,648,Products , Food , For the Pantry ," Packaged Fish, Meat, Fruit & Veg"
648,066571,Orange Peach Mango Juice,/content/dam/trjo/products/m301/66571.png,/content/dam/trjo/products/m301/66571.png,52.0,Fl Oz,3.49,3.49,"Alfresco Dining, Brunch All Day, Family Style, Rise & Shine",,Products > Beverages > Juices & More,Trader Joe's North Potomac ,648,Products , Beverages , Juices & More,
648,067303,Hand & Body Cream with Moroccan Argan Oil,/content/dam/trjo/products/m502/67303.png,/content/dam/trjo/products/m502/67303.png,16.0,Fl Oz,3.99,3.99,Treat Yourself,,Products > Everything Else > For the Face & Body,Trader Joe's North Potomac ,648,Products , Everything Else , For the Face & Body,
648,061610,Hand Twisted Cinnamon Sugar Bread,/content/dam/trjo/products/m20105/61610.png,/content/dam/trjo/products/m20105/61610.png,16.0,Oz,4.99,4.49,"Alfresco Dining, Brunch All Day, Family Style, Rain or Shine, Rise & Shine, Welcoming",Kosher,Products > Food > Bakery > Sweet Stuff,Trader Joe's North Potomac ,648,Products , Food , Bakery , Sweet Stuff
648,014627,Whole Wheat English Muffins,/content/dam/trjo/products/m20102/14627.png,/content/dam/trjo/products/m20102/14627.png,12.0,Oz,1.99,1.99,"Brunch All Day, Put An Egg On It, Rise & Shine",Kosher,"Products > Food > Bakery > Loaves, Rolls, Buns",Trader Joe's North Potomac ,648,Products , Food , Bakery ," Loaves, Rolls, Buns"
648,058040,Yellow Peaches,/content/dam/trjo/products/m20701/58040.png,/content/dam/trjo/products/m20701/58040.png,2.0,Lb,3.49,3.49,"Alfresco Dining, Backpack Ready, Brunch All Day, Heat Wave, Midday Snacks, Picnic",,Products > Food > Fresh Fruits & Veggies > Fruits,Trader Joe's North Potomac ,648,Products , Food , Fresh Fruits & Veggies , Fruits
648,091984,Red and Green Grapes Duo,/content/dam/trjo/products/m20701/91984.png,/content/dam/trjo/products/m20701/91984.png,2.0,Lb,6.49,6.49,"Alfresco Dining, Cheese Board, Finger Food, Midday Snacks, Picnic",,Products > Food > Fresh Fruits & Veggies > Fruits,Trader Joe's North Potomac ,648,Products , Food , Fresh Fruits & Veggies , Fruits
648,070588,Cut and Peeled Carrots,/content/dam/trjo/products/m20702/70588.png,/content/dam/trjo/products/m20702/70588.png,24.0,Oz,1.69,1.99,"Alfresco Dining, Backpack Ready, Finger Food, Midday Snacks, Picnic",Kosher,Products > Food > Fresh Fruits & Veggies > Veggies,Trader Joe's North Potomac ,648,Products , Food , Fresh Fruits & Veggies , Veggies
648,050828,Sriracha Sauce,/content/dam/trjo/products/m20403/50828.png,/content/dam/trjo/products/m20403/50828.png,18.25,Oz,3.99,3.99,"Alfresco Dining, Feeling Adventurous, Mouth On Fire",,"Products > Food > Dips, Sauces & Dressings > Salsa & Hot Sauce",Trader Joe's North Potomac ,648,Products , Food ," Dips, Sauces & Dressings ", Salsa & Hot Sauce
648,062146,Gluten Free Multigrain Bread,/content/dam/trjo/products/m20101/62146.png,/content/dam/trjo/products/m20101/62146.png,15.2,Oz,4.49,4.49,"Alfresco Dining, Brunch All Day, Cut The Mustard, Picnic, Put An Egg On It, Rise & Shine, The ""X"" Factor","Gluten Free, Kosher",Products > Food > Bakery > Sliced Bread,Trader Joe's North Potomac ,648,Products , Food , Bakery , Sliced Bread
648,093617,Pesto Chicken Breast,/content/dam/trjo/products/m20802/93617.png,/content/dam/trjo/products/m20802/93617.png,1.0,Lb,8.99,8.99,"Fire Up The Grill, In Lieu of Pizza, Pair With Wine",,"Products > Food > Meat, Seafood & Plant-based > Chicken & Turkey",Trader Joe's North Potomac ,648,Products , Food ," Meat, Seafood & Plant-based ", Chicken & Turkey
648,074437,Tiny Fruity Cuties Cereal,/content/dam/trjo/products/m20907/74437.png,/content/dam/trjo/products/m20907/74437.png,16.0,Oz,3.99,3.99,"Family Style, Finger Food, Rise & Shine",Kosher,Products > Food > For the Pantry > Cereals,Trader Joe's North Potomac ,648,Products , Food , For the Pantry , Cereals
648,075767,Grilled Chicken Strips,/content/dam/trjo/products/m20602/75767.png,/content/dam/trjo/products/m20602/75767.png,16.0,Oz,8.99,8.99,"Dinner Hack, Fry It Up, Yes!",,Products > Food > From The Freezer > Entrées & Sides,Trader Joe's North Potomac ,648,Products , Food , From The Freezer , Entrées & Sides
648,175201,Cranberry Clementine Sparkling Water,/content/dam/trjo/products/m302/75201.png,/content/dam/trjo/products/m302/75201.png,12.0,Fl Oz,3.49,3.49,"Alfresco Dining, Glass Half Full",Kosher,Products > Beverages > Water (Sparkling & Still),Trader Joe's North Potomac ,648,Products , Beverages , Water (Sparkling & Still),
648,056995,Raw Almond Butter Creamy No Salt,/content/dam/trjo/products/m20903/56995.png,/content/dam/trjo/products/m20903/56995.png,16.0,Oz,6.49,6.49,"Alfresco Dining, Family Style, Picnic, Rain or Shine",Kosher,Products > Food > For the Pantry > Nut Butters & Fruit Spreads,Trader Joe's North Potomac ,648,Products , Food , For the Pantry , Nut Butters & Fruit Spreads
648,052293,Crunchy Almond Butter Salted,/content/dam/trjo/products/m20903/52293.png,/content/dam/trjo/products/m20903/52293.png,16.0,Oz,5.99,5.99,"Alfresco Dining, Family Style, Rain or Shine",Kosher,Products > Food > For the Pantry > Nut Butters & Fruit Spreads,Trader Joe's North Potomac ,648,Products , Food , For the Pantry , Nut Butters & Fruit Spreads
