store_code,sku,item_title,primary_image,primary_image_url,sales_size,sales_uom_description,final_price,retail_price,fun_tags,item_characteristics,category_hierarchy,name,store_number,drop,prod_cat,prod_cat_type,prod_cat_desc
648,057474,Thai Style Red Curry Sauce,/content/dam/trjo/products/m20402/57474.png,/content/dam/trjo/products/m20402/57474.png,11.0,Oz,3.49,3.49,"Dinner Hack, Feeling Adventurous, Pour It On",,"Products > Food > Dips, Sauces & Dressings > BBQ, Pasta, Simmer",Trader Joe's North Potomac ,648,Products , Food ," Dips, Sauces & Dressings "," BBQ, Pasta, Simmer"
648,077726,All Natural Fresh Mozzarella Cheese,/content/dam/trjo/products/m20203/77726.png,/content/dam/trjo/products/m20203/77726.png,0.5,Lb,3.99,3.99,"Alfresco Dining, Family Style, Welcoming",Kosher,"Products > Food > Cheese > Wedges, Wheels, Loaves, Logs",Trader Joe's North Potomac ,648,Products , Food , Cheese ," Wedges, Wheels, Loaves, Logs"
648,057632,Fully Cooked Uncured Bavarian Bratwurst,/content/dam/trjo/products/m20801/57632.png,/content/dam/trjo/products/m20801/57632.png,12.0,Oz,4.99,4.99,"Crack a Beer, Cut The Mustard, Fire Up The Grill",,"Products > Food > Meat, Seafood & Plant-based > Beef, Pork & Lamb",Trader Joe's North Potomac ,648,Products , Food ," Meat, Seafood & Plant-based "," Beef, Pork & Lamb"
648,079358,Organic Broccoli Slaw,/content/dam/trjo/products/m20702/79358.png,/content/dam/trjo/products/m20702/79358.png,12.0,Oz,1.99,2.49,"Alfresco Dining, Dinner Hack","Kosher, Organic",Products > Food > Fresh Fruits & Veggies > Veggies,Trader Joe's North Potomac ,648,Products , Food , Fresh Fruits & Veggies , Veggies
648,093417,Battered Fish Nuggets,/content/dam/trjo/products/m20602/93417.png,/content/dam/trjo/products/m20602/93417.png,16.0,Oz,5.99,5.99,"Dinner Hack, Family Style, Finger Food",,Products > Food > From The Freezer > Entrées & Sides,Trader Joe's North Potomac ,648,Products , Food , From The Freezer , Entrées & Sides
648,099069,Organic Diced & Fire Roasted Tomatoes with Green Chiles,/content/dam/trjo/products/m20902/99069.png,/content/dam/trjo/products/m20902/99069.png,14.5,Oz,1.99,1.99,Dinner Hack,Organic,"Products > Food > For the Pantry > Packaged Fish, Meat, Fruit & Veg",Trader Joe's North Potomac ,648,Products , Food , For the Pantry ," Packaged Fish, Meat, Fruit & Veg"
648,055562,All Natural Ground Chicken,/content/dam/trjo/products/m20802/55562.png,/content/dam/trjo/products/m20802/55562.png,1.0,Lb,4.49,4.49,"Family Style, Fry It Up",Antibiotic Free,"Products > Food > Meat, Seafood & Plant-based > Chicken & Turkey",Trader Joe's North Potomac ,648,Products , Food ," Meat, Seafood & Plant-based ", Chicken & Turkey
648,072051,Rosemary Croissant Croutons,/content/dam/trjo/products/m21001/72051.png,/content/dam/trjo/products/m21001/72051.png,4.5,Oz,3.99,3.99,"Backpack Ready, Desk Drawer, Midday Snacks",Vegan,"Products > Food > Snacks & Sweets > Chips, Crackers & Crunchy Bites",Trader Joe's North Potomac ,648,Products , Food , Snacks & Sweets ," Chips, Crackers & Crunchy Bites"
648,058033,Seasonal Bouquet,/content/dam/trjo/products/m4/58033.png,/content/dam/trjo/products/m4/58033.png,1.0,Each,9.99,9.99,"Alfresco Dining, Giftable",,Products > Bouquets,Trader Joe's North Potomac ,648,Products , Bouquets,,
648,065400,Multi-Purpose Cleaner Cedarwood & Sage,/content/dam/trjo/products/m501/65400.png,/content/dam/trjo/products/m501/65400.png,34.0,Fl Oz,3.99,3.99,Welcoming,,Products > Everything Else > Household Essentials,Trader Joe's North Potomac ,648,Products , Everything Else , Household Essentials,
648,058328,Liquid Dish Soap Lavender Tea Tree Scent,/content/dam/trjo/products/m501/58328.png,/content/dam/trjo/products/m501/58328.png,25.0,Fl Oz,2.99,2.99,"Welcoming, Yes!",,Products > Everything Else > Household Essentials,Trader Joe's North Potomac ,648,Products , Everything Else , Household Essentials,
648,080665,Freeze Dried Strawberries,/content/dam/trjo/products/m21003/80665.png,/content/dam/trjo/products/m21003/80665.png,1.2,Oz,2.99,2.99,"Backpack Ready, Desk Drawer, Finger Food",,"Products > Food > Snacks & Sweets > Nuts, Dried Fruits, Seeds",Trader Joe's North Potomac ,648,Products , Food , Snacks & Sweets ," Nuts, Dried Fruits, Seeds"
648,063164,Gluten Free Everything Bagels,/content/dam/trjo/products/m20103/63164.png,/content/dam/trjo/products/m20103/63164.png,14.0,Oz,4.49,4.49,"Brunch All Day, Put An Egg On It, Rise & Shine","Gluten Free, Kosher",Products > Food > Bakery > Bagels,Trader Joe's North Potomac ,648,Products , Food , Bakery , Bagels
648,082338,Finely Shredded Mexican Style Cheese Blend,/content/dam/trjo/products/m20201/82338.png,/content/dam/trjo/products/m20201/82338.png,12.0,Oz,3.69,3.69,"Family Style, Game Night, Put An Egg On It, Rain or Shine, Welcoming",,"Products > Food > Cheese > Slices, Shreds, Crumbles",Trader Joe's North Potomac ,648,Products , Food , Cheese ," Slices, Shreds, Crumbles"
648,052148,Vegetable Fried Rice,/content/dam/trjo/products/m20602/52148.png,/content/dam/trjo/products/m20602/52148.png,16.0,Oz,2.99,2.99,"Family Style, Put An Egg On It, Yes!",Vegan,Products > Food > From The Freezer > Entrées & Sides,Trader Joe's North Potomac ,648,Products , Food , From The Freezer , Entrées & Sides
648,072968,Blueberry Muffin Mix,/content/dam/trjo/products/m20905/72968.png,/content/dam/trjo/products/m20905/72968.png,18.1,Oz,4.49,4.49,"Brunch All Day, Family Style, Rise & Shine, Treat Yourself",,Products > Food > For the Pantry > For Baking & Cooking,Trader Joe's North Potomac ,648,Products , Food , For the Pantry , For Baking & Cooking
648,025122,Jumbo Pitted Greek Kalamata Olives,/content/dam/trjo/products/m20902/25122.png,/content/dam/trjo/products/m20902/25122.png,12.0,Fl Oz,2.99,2.99,"Cheese Board, Finger Food",Vegan,"Products > Food > For the Pantry > Packaged Fish, Meat, Fruit & Veg",Trader Joe's North Potomac ,648,Products , Food , For the Pantry ," Packaged Fish, Meat, Fruit & Veg"
648,071253,Organic Balsamic Vinegar,/content/dam/trjo/products/m20904/71253.png,/content/dam/trjo/products/m20904/71253.png,8.45,Fl Oz,5.99,5.99,"Alfresco Dining, Pour It On",Organic,Products > Food > For the Pantry > Oils & Vinegars,Trader Joe's North Potomac ,648,Products , Food , For the Pantry , Oils & Vinegars
648,072321,Sesame Teriyaki Beef Skirt Steak,/content/dam/trjo/products/m20801/72321.png,/content/dam/trjo/products/m20801/72321.png,1.0,Lb,16.99,16.99,"Dinner Hack, Fire Up The Grill",,"Products > Food > Meat, Seafood & Plant-based > Beef, Pork & Lamb",Trader Joe's North Potomac ,648,Products , Food ," Meat, Seafood & Plant-based "," Beef, Pork & Lamb"
648,071519,Oat Non-Dairy Frozen Dessert Sandwiches,/content/dam/trjo/products/m20604/71519.png,/content/dam/trjo/products/m20604/71519.png,14.8,Fl Oz,3.69,3.69,"Heat Wave, Treat Yourself","Kosher, Vegan",Products > Food > From The Freezer > Cool Desserts,Trader Joe's North Potomac ,648,Products , Food , From The Freezer , Cool Desserts
648,065874,Cacio e Pepe Ravioli,/content/dam/trjo/products/m20503/65874.png,/content/dam/trjo/products/m20503/65874.png,8.8,Oz,3.99,3.99,"Dinner Hack, Effortless Entertaining, Pair With Wine",,Products > Food > Fresh Prepared Foods > Entrées & Center of Plate,Trader Joe's North Potomac ,648,Products , Food , Fresh Prepared Foods , Entrées & Center of Plate
648,057879,Organic Tomato & Roasted Red Pepper Soup,/content/dam/trjo/products/m20908/57879.png,/content/dam/trjo/products/m20908/57879.png,32.0,Fl Oz,3.49,3.49,"Cold Front, Desk Drawer, Rain or Shine","Gluten Free, Organic, Vegetarian, Kosher","Products > Food > For the Pantry > Soup, Chili & Meals",Trader Joe's North Potomac ,648,Products , Food , For the Pantry ," Soup, Chili & Meals"
648,054571,Ultra Moisturizing Hand Cream,/content/dam/trjo/products/m502/54571.png,/content/dam/trjo/products/m502/54571.png,3.0,Oz,4.99,4.99,"The ""X"" Factor, Treat Yourself",,Products > Everything Else > For the Face & Body,Trader Joe's North Potomac ,648,Products , Everything Else , For the Face & Body,
648,058329,Liquid Dish Soap Citrus Scent,/content/dam/trjo/products/m501/58329.png,/content/dam/trjo/products/m501/58329.png,25.0,Fl Oz,2.99,2.99,Yes!,,Products > Everything Else > Household Essentials,Trader Joe's North Potomac ,648,Products , Everything Else , Household Essentials,
648,065405,Liquid Laundry Detergent Lavender Scent,/content/dam/trjo/products/m501/65405.png,/content/dam/trjo/products/m501/65405.png,100.0,Fl Oz,10.99,10.99,Yes!,,Products > Everything Else > Household Essentials,Trader Joe's North Potomac ,648,Products , Everything Else , Household Essentials,
648,072810,Dark Chocolate Almond Butter Pretzel Nuggets,/content/dam/trjo/products/m21002/72810.png,/content/dam/trjo/products/m21002/72810.png,8.0,Oz,3.79,3.79,"Desk Drawer, Finger Food, Treat Yourself",Kosher,Products > Food > Snacks & Sweets > Candies & Cookies,Trader Joe's North Potomac ,648,Products , Food , Snacks & Sweets , Candies & Cookies
648,072159,Dark Chocolate Bamba Snacks,/content/dam/trjo/products/m21002/72159.png,/content/dam/trjo/products/m21002/72159.png,5.0,Oz,2.99,2.99,"Backpack Ready, Finger Food, Midday Snacks",Kosher,Products > Food > Snacks & Sweets > Candies & Cookies,Trader Joe's North Potomac ,648,Products , Food , Snacks & Sweets , Candies & Cookies
648,063076,Double Dozen Tulips,/content/dam/trjo/products/m4/63076.png,/content/dam/trjo/products/m4/63076.png,1.0,Each,12.99,12.99,"Date Night, Giftable",,Products > Single Varietals,Trader Joe's North Potomac ,648,Products , Single Varietals,,
648,011999,Creamy Salted Peanut Butter,/content/dam/trjo/products/m20903/11999.png,/content/dam/trjo/products/m20903/11999.png,16.0,Oz,2.49,2.49,"Family Style, Picnic",Kosher,Products > Food > For the Pantry > Nut Butters & Fruit Spreads,Trader Joe's North Potomac ,648,Products , Food , For the Pantry , Nut Butters & Fruit Spreads
648,056016,Premium Milk & Dark Chocolate Covered Almonds,/content/dam/trjo/products/m21002/56016.png,/content/dam/trjo/products/m21002/56016.png,16.0,Oz,6.99,6.99,"Desk Drawer, Treat Yourself",Kosher,Products > Food > Snacks & Sweets > Candies & Cookies,Trader Joe's North Potomac ,648,Products , Food , Snacks & Sweets , Candies & Cookies
648,044575,Cocoa Truffles,/content/dam/trjo/products/m21002/44575.png,/content/dam/trjo/products/m21002/44575.png,8.8,Oz,3.49,3.49,"Date Night, Giftable, Treat Yourself","Gluten Free, Kosher",Products > Food > Snacks & Sweets > Candies & Cookies,Trader Joe's North Potomac ,648,Products , Food , Snacks & Sweets , Candies & Cookies
648,012564,Pretzel Sticks,/content/dam/trjo/products/m21001/12564.png,/content/dam/trjo/products/m21001/12564.png,12.0,Oz,2.49,2.49,"Crack a Beer, Desk Drawer, Finger Food, Midday Snacks",Kosher,"Products > Food > Snacks & Sweets > Chips, Crackers & Crunchy Bites",Trader Joe's North Potomac ,648,Products , Food , Snacks & Sweets ," Chips, Crackers & Crunchy Bites"
648,065060,Raspberry Mousse Cakes,/content/dam/trjo/products/m20105/65060.png,/content/dam/trjo/products/m20105/65060.png,5.0,Oz,3.99,3.99,"Date Night, Feeling Fancy, Treat Yourself",Kosher,Products > Food > Bakery > Sweet Stuff,Trader Joe's North Potomac ,648,Products , Food , Bakery , Sweet Stuff
648,069754,Marinated Artichokes On The Go,/content/dam/trjo/products/m20902/69754.png,/content/dam/trjo/products/m20902/69754.png,1.58,Oz,1.29,1.29,"Alfresco Dining, Backpack Ready, Cheese Board",Kosher,"Products > Food > For the Pantry > Packaged Fish, Meat, Fruit & Veg",Trader Joe's North Potomac ,648,Products , Food , For the Pantry ," Packaged Fish, Meat, Fruit & Veg"
648,072525,Organic Fusilli Corti Bucati Pasta,/content/dam/trjo/products/m20901/72525.png,/content/dam/trjo/products/m20901/72525.png,1.0,Lb,1.99,1.99,"Cold Front, Rain or Shine","Kosher, Organic",Products > Food > For the Pantry > Pastas & Grains,Trader Joe's North Potomac ,648,Products , Food , For the Pantry , Pastas & Grains
648,052954,Quattro Formaggi,/content/dam/trjo/products/m20201/52954.png,/content/dam/trjo/products/m20201/52954.png,12.0,Oz,5.49,5.49,"Alfresco Dining, Family Style",,"Products > Food > Cheese > Slices, Shreds, Crumbles",Trader Joe's North Potomac ,648,Products , Food , Cheese ," Slices, Shreds, Crumbles"
648,065569,Glazed Sour Cream Donuts,/content/dam/trjo/products/m20105/65569.png,/content/dam/trjo/products/m20105/65569.png,20.1,Oz,4.49,4.49,"Brunch All Day, Rise & Shine, Treat Yourself",Kosher,Products > Food > Bakery > Sweet Stuff,Trader Joe's North Potomac ,648,Products , Food , Bakery , Sweet Stuff
648,074911,Uncured Apple Smoked Bacon,/content/dam/trjo/products/m20801/74911.png,/content/dam/trjo/products/m20801/74911.png,12.0,Oz,6.49,6.49,"Brunch All Day, Rise & Shine",Antibiotic Free,"Products > Food > Meat, Seafood & Plant-based > Beef, Pork & Lamb",Trader Joe's North Potomac ,648,Products , Food ," Meat, Seafood & Plant-based "," Beef, Pork & Lamb"
648,061707,Organic No Joke Ginger Juice Shot,/content/dam/trjo/products/m301/61707.png,/content/dam/trjo/products/m301/61707.png,2.0,Fl Oz,1.99,1.99,"Backpack Ready, The ""X"" Factor",Organic,Products > Beverages > Juices & More,Trader Joe's North Potomac ,648,Products , Beverages , Juices & More,
648,061708,Organic Mighty Turmeric Juice Shot,/content/dam/trjo/products/m301/61708.png,/content/dam/trjo/products/m301/61708.png,2.0,Fl Oz,1.99,1.99,"Backpack Ready, The ""X"" Factor",Organic,Products > Beverages > Juices & More,Trader Joe's North Potomac ,648,Products , Beverages , Juices & More,
648,058191,Cranberry & Herb Supplement Drops,/content/dam/trjo/products/M504/58191.png,/content/dam/trjo/products/M504/58191.png,15.0,Each,1.49,1.49,Cold Front,,Products > Everything Else > Nutritional Supplements,Trader Joe's North Potomac ,648,Products , Everything Else , Nutritional Supplements,
648,058192,Honey Lemon Cough Drops,/content/dam/trjo/products/M504/58192.png,/content/dam/trjo/products/M504/58192.png,15.0,Each,1.49,1.49,Cold Front,,Products > Everything Else > Nutritional Supplements,Trader Joe's North Potomac ,648,Products , Everything Else , Nutritional Supplements,
648,057972,Organic Moroccan Mint Green Tea,/content/dam/trjo/products/m304/57972.png,/content/dam/trjo/products/m304/57972.png,20.0,Bag,2.99,2.99,"Alfresco Dining, Desk Drawer","Kosher, Organic",Products > Beverages > Coffee & Tea,Trader Joe's North Potomac ,648,Products , Beverages , Coffee & Tea,
648,056397,Organic Ginger Turmeric Herbal Tea,/content/dam/trjo/products/m304/56397.png,/content/dam/trjo/products/m304/56397.png,20.0,Bag,2.99,2.99,"Cold Front, Desk Drawer, Rise & Shine","Kosher, Organic",Products > Beverages > Coffee & Tea,Trader Joe's North Potomac ,648,Products , Beverages , Coffee & Tea,
648,071740,Organic Joe Medium Roast Ground Coffee,/content/dam/trjo/products/m304/71740.png,/content/dam/trjo/products/m304/71740.png,14.0,Oz,6.49,6.49,"Alfresco Dining, Rise & Shine","Kosher, Organic",Products > Beverages > Coffee & Tea,Trader Joe's North Potomac ,648,Products , Beverages , Coffee & Tea,
648,097926,Greek Yogurt with Honey,/content/dam/trjo/products/m20303/97926.png,/content/dam/trjo/products/m20303/97926.png,32.0,Oz,5.49,5.49,"Brunch All Day, Midday Snacks, Rise & Shine",Kosher,"Products > Food > Dairy & Eggs > Yogurt, etc.",Trader Joe's North Potomac ,648,Products , Food , Dairy & Eggs ," Yogurt, etc."
648,006219,Small Curd Cottage Cheese,/content/dam/trjo/products/m20303/06219.png,/content/dam/trjo/products/m20303/06219.png,16.0,Oz,2.99,2.99,"Brunch All Day, Midday Snacks",Kosher,"Products > Food > Dairy & Eggs > Yogurt, etc.",Trader Joe's North Potomac ,648,Products , Food , Dairy & Eggs ," Yogurt, etc."
648,062883,Organic Petite Potato Medley,/content/dam/trjo/products/m20702/62883.png,/content/dam/trjo/products/m20702/62883.png,24.0,Oz,3.49,3.49,Yes!,Organic,Products > Food > Fresh Fruits & Veggies > Veggies,Trader Joe's North Potomac ,648,Products , Food , Fresh Fruits & Veggies , Veggies
648,073199,Ready Veggies,/content/dam/trjo/products/m20702/73199.png,/content/dam/trjo/products/m20702/73199.png,12.0,Oz,2.99,2.99,"Alfresco Dining, Dinner Hack",,Products > Food > Fresh Fruits & Veggies > Veggies,Trader Joe's North Potomac ,648,Products , Food , Fresh Fruits & Veggies , Veggies
648,092558,Organic Ground Beef 85/15,/content/dam/trjo/products/m20801/92558.png,/content/dam/trjo/products/m20801/92558.png,1.0,Lb,7.49,7.49,Fire Up The Grill,"Antibiotic Free, Grass Fed, Organic","Products > Food > Meat, Seafood & Plant-based > Beef, Pork & Lamb",Trader Joe's North Potomac ,648,Products , Food ," Meat, Seafood & Plant-based "," Beef, Pork & Lamb"
648,063550,Organic Free Range Boneless Skinless Chicken Breasts,/content/dam/trjo/products/m20802/63550.png,/content/dam/trjo/products/m20802/63550.png,1.0,Lb,6.99,6.99,Fire Up The Grill,Organic,"Products > Food > Meat, Seafood & Plant-based > Chicken & Turkey",Trader Joe's North Potomac ,648,Products , Food ," Meat, Seafood & Plant-based ", Chicken & Turkey
648,058808,Tomato Feta Soup,/content/dam/trjo/products/m20501/58808.png,/content/dam/trjo/products/m20501/58808.png,20.0,Oz,4.49,4.49,Cold Front,,"Products > Food > Fresh Prepared Foods > Salads, Soups & Sides",Trader Joe's North Potomac ,648,Products , Food , Fresh Prepared Foods ," Salads, Soups & Sides"
648,056650,Kettle Cooked Chicken Soup,/content/dam/trjo/products/m20501/56650.png,/content/dam/trjo/products/m20501/56650.png,24.0,Oz,4.99,4.99,Cold Front,,"Products > Food > Fresh Prepared Foods > Salads, Soups & Sides",Trader Joe's North Potomac ,648,Products , Food , Fresh Prepared Foods ," Salads, Soups & Sides"
648,095231,Spinach Tortellini,/content/dam/trjo/products/m20503/95231.png,/content/dam/trjo/products/m20503/95231.png,10.0,Oz,2.99,2.99,"Dinner Hack, In Lieu of Pizza",,Products > Food > Fresh Prepared Foods > Entrées & Center of Plate,Trader Joe's North Potomac ,648,Products , Food , Fresh Prepared Foods , Entrées & Center of Plate
648,061902,Vanilla Overnight Oats,/content/dam/trjo/products/m20503/61902.png,/content/dam/trjo/products/m20503/61902.png,5.5,Oz,1.99,1.99,"Backpack Ready, Rise & Shine","Gluten Free, Kosher",Products > Food > Fresh Prepared Foods > Entrées & Center of Plate,Trader Joe's North Potomac ,648,Products , Food , Fresh Prepared Foods , Entrées & Center of Plate
648,053893,All Natural Fully Cooked Maple Chicken Breakfast Sausage,/content/dam/trjo/products/m20802/53893.png,/content/dam/trjo/products/m20802/53893.png,12.0,Oz,4.69,4.69,Rise & Shine,Antibiotic Free,"Products > Food > Meat, Seafood & Plant-based > Chicken & Turkey",Trader Joe's North Potomac ,648,Products , Food ," Meat, Seafood & Plant-based ", Chicken & Turkey
648,070721,Almond Butter Filled Pretzel Nuggets,/content/dam/trjo/products/m21001/70721.png,/content/dam/trjo/products/m21001/70721.png,12.0,Oz,4.49,4.49,"Backpack Ready, Desk Drawer, Finger Food",Kosher,"Products > Food > Snacks & Sweets > Chips, Crackers & Crunchy Bites",Trader Joe's North Potomac ,648,Products , Food , Snacks & Sweets ," Chips, Crackers & Crunchy Bites"
648,064957,Organic Unsweetened Almond Beverage,/content/dam/trjo/products/m303/64957.png,/content/dam/trjo/products/m303/64957.png,32.0,Fl Oz,1.99,1.99,Glass Half Full,"Dairy Free, Gluten Free, Kosher, Organic, Vegan",Products > Beverages > Non-Dairy Bev,Trader Joe's North Potomac ,648,Products , Beverages , Non-Dairy Bev,
648,069919,Organic Papperdelle Pasta Nests,/content/dam/trjo/products/m20901/69919.png,/content/dam/trjo/products/m20901/69919.png,17.64,Oz,3.49,3.49,"Family Style, Pair With Wine","Organic, Kosher",Products > Food > For the Pantry > Pastas & Grains,Trader Joe's North Potomac ,648,Products , Food , For the Pantry , Pastas & Grains
648,071109,Kitchari,/content/dam/trjo/products/m20908/71109.png,/content/dam/trjo/products/m20908/71109.png,10.0,Oz,2.49,2.49,"Backpack Ready, Feeling Adventurous",Kosher,"Products > Food > For the Pantry > Soup, Chili & Meals",Trader Joe's North Potomac ,648,Products , Food , For the Pantry ," Soup, Chili & Meals"
648,001070,Chocolate Lava Cakes,/content/dam/trjo/products/m20604/01070.png,/content/dam/trjo/products/m20604/01070.png,7.6,Oz,3.79,3.79,"Date Night, Gild The Lily, Treat Yourself",Kosher,Products > Food > From The Freezer > Cool Desserts,Trader Joe's North Potomac ,648,Products , Food , From The Freezer , Cool Desserts
648,070784,Eggwich Breadless Breakfast Sandwich,/content/dam/trjo/products/m20602/70784.png,/content/dam/trjo/products/m20602/70784.png,7.8,Oz,5.49,5.49,"Brunch All Day, Rise & Shine",Gluten Free,Products > Food > From The Freezer > Entrées & Sides,Trader Joe's North Potomac ,648,Products , Food , From The Freezer , Entrées & Sides
648,053276,Quinoa Cowboy Veggie Burgers,/content/dam/trjo/products/m20602/53276.png,/content/dam/trjo/products/m20602/53276.png,12.0,Oz,3.99,3.99,"Crack a Beer, Make It Meatless",,Products > Food > From The Freezer > Entrées & Sides,Trader Joe's North Potomac ,648,Products , Food , From The Freezer , Entrées & Sides
648,071622,Garlic Bread Cheese,/content/dam/trjo/products/m20203/71622.png,/content/dam/trjo/products/m20203/71622.png,6.0,Oz,4.29,4.29,"Feeling Adventurous, Pair With Wine, The ""X"" Factor, Unexpected",Gluten Free,"Products > Food > Cheese > Wedges, Wheels, Loaves, Logs",Trader Joe's North Potomac ,648,Products , Food , Cheese ," Wedges, Wheels, Loaves, Logs"
648,065291,Black Bean & Cheese Taquitos,/content/dam/trjo/products/m20602/65291.png,/content/dam/trjo/products/m20602/65291.png,16.0,Oz,3.99,3.99,"In Lieu of Pizza, Make It Meatless",,Products > Food > From The Freezer > Entrées & Sides,Trader Joe's North Potomac ,648,Products , Food , From The Freezer , Entrées & Sides
648,098740,Maple Leaf Cookies,/content/dam/trjo/products/m21002/98740.png,/content/dam/trjo/products/m21002/98740.png,11.4,Oz,3.99,3.99,"Desk Drawer, Midday Snacks, Stuff of Dreams",Kosher,Products > Food > Snacks & Sweets > Candies & Cookies,Trader Joe's North Potomac ,648,Products , Food , Snacks & Sweets , Candies & Cookies
648,072392,"Organic Creamy Cashew Cultured Yogurt Alternative, Plain Unsweetened",/content/dam/trjo/products/m20303/72392.png,/content/dam/trjo/products/m20303/72392.png,24.0,Oz,4.99,4.99,"Alfresco Dining, Brunch All Day, Rise & Shine","Dairy Free, Kosher, Organic, Vegan","Products > Food > Dairy & Eggs > Yogurt, etc.",Trader Joe's North Potomac ,648,Products , Food , Dairy & Eggs ," Yogurt, etc."
648,073297,Impossible™ Chicken Nuggets,/content/dam/trjo/products/m20602/73297.png,/content/dam/trjo/products/m20602/73297.png,13.5,Oz,6.99,6.99,"Cut The Mustard, Family Style, Finger Food",Vegetarian,Products > Food > From The Freezer > Entrées & Sides,Trader Joe's North Potomac ,648,Products , Food , From The Freezer , Entrées & Sides
648,072937,Organic Shelled Hemp Seeds,/content/dam/trjo/products/m20907/72937.png,/content/dam/trjo/products/m20907/72937.png,8.0,Oz,6.49,6.49,Yes!,,Products > Food > For the Pantry > Cereals,Trader Joe's North Potomac ,648,Products , Food , For the Pantry , Cereals
648,072757,Vegan Creamy Dill Dressing,/content/dam/trjo/products/m20405/72757.png,/content/dam/trjo/products/m20405/72757.png,11.0,Fl Oz,3.99,3.99,"Alfresco Dining, Picnic, The ""X"" Factor",Vegan,"Products > Food > Dips, Sauces & Dressings > Dressing & Seasoning",Trader Joe's North Potomac ,648,Products , Food ," Dips, Sauces & Dressings ", Dressing & Seasoning
648,072306,Organic Lentil Vegetable Soup,/content/dam/trjo/products/m20908/72306.png,/content/dam/trjo/products/m20908/72306.png,15.0,Oz,2.49,2.49,"Cold Front, Desk Drawer, Rain or Shine","Gluten Free, Organic, Vegan","Products > Food > For the Pantry > Soup, Chili & Meals",Trader Joe's North Potomac ,648,Products , Food , For the Pantry ," Soup, Chili & Meals"
648,071782,Vegan Buttery Spread,/content/dam/trjo/products/m20302/71782.png,/content/dam/trjo/products/m20302/71782.png,8.82,Oz,2.99,2.99,"The ""X"" Factor",Vegan,Products > Food > Dairy & Eggs > Butter,Trader Joe's North Potomac ,648,Products , Food , Dairy & Eggs , Butter
648,071498,Organic Chunky Homestyle Guacamole,/content/dam/trjo/products/m20404/71498.png,/content/dam/trjo/products/m20404/71498.png,10.0,Oz,4.49,4.49,"Alfresco Dining, Crack a Beer, Effortless Entertaining","Kosher, Organic","Products > Food > Dips, Sauces & Dressings > Dip/Spread",Trader Joe's North Potomac ,648,Products , Food ," Dips, Sauces & Dressings ", Dip/Spread
648,059248,Organic Hummus,/content/dam/trjo/products/m20404/59248.png,/content/dam/trjo/products/m20404/59248.png,8.0,Oz,2.99,2.99,"Alfresco Dining, Effortless Entertaining, Game Night, Midday Snacks, Picnic","Organic, Kosher","Products > Food > Dips, Sauces & Dressings > Dip/Spread",Trader Joe's North Potomac ,648,Products , Food ," Dips, Sauces & Dressings ", Dip/Spread
648,090642,Mediterranean Style Hummus,/content/dam/trjo/products/m20404/90642.png,/content/dam/trjo/products/m20404/90642.png,16.0,Oz,3.99,3.99,"Alfresco Dining, Cheese Board, Effortless Entertaining",Kosher,"Products > Food > Dips, Sauces & Dressings > Dip/Spread",Trader Joe's North Potomac ,648,Products , Food ," Dips, Sauces & Dressings ", Dip/Spread
648,050261,Organic Garbanzo Beans,/content/dam/trjo/products/m20902/50261.png,/content/dam/trjo/products/m20902/50261.png,15.5,Oz,1.09,1.09,Dinner Hack,"Kosher, Organic","Products > Food > For the Pantry > Packaged Fish, Meat, Fruit & Veg",Trader Joe's North Potomac ,648,Products , Food , For the Pantry ," Packaged Fish, Meat, Fruit & Veg"
648,054875,Italian Lagorai Semi-Soft Cheese,/content/dam/trjo/products/m20203/54875.png,/content/dam/trjo/products/m20203/54875.png,1.0,Lb,10.49,10.49,Cheese Board,,"Products > Food > Cheese > Wedges, Wheels, Loaves, Logs",Trader Joe's North Potomac ,648,Products , Food , Cheese ," Wedges, Wheels, Loaves, Logs"
