date,url,author,post,image,fulldate,time
2021-04-05,https://www.donaldjtrump.com/desk/desk-hrwxh3nfcf80,Donald J. Trump,"In yet another highly partisan story, the failing New York Times wrote a completely misleading, one-sided attack piece this weekend that tried to disparage our record-setting grassroots fundraising operation during the 2020 campaign. Except for massive voter fraud, this was a campaign that was easily won by your favorite Republican President, me!
Our support in 2020 was so big—never before seen (received more votes than any sitting President in history, by far), that it has become a major threat to the Democrat Party, which explains why the New York Times immediately rushed to defend their Radical Left allies. Before our two campaigns, 2016 and 2020, Republicans would always lose small dollar donations. Now we win, or do very well, because we are the Party of Working Americans, and we beat the Democrats at their own game. We learned from liberal ActBlue—and now we’re better than they are! In fact, many people were so enthusiastic that they gave over and over, and in certain cases where they would give too much, we would promptly refund their contributions. Our overall dispute rate was less than 1% of total online donations, a very low number. This is done by Dems also.
The New York Times knew this but buried these details in their story—they didn’t talk about, however, how the CHEATING Democrats circumvented State Legislatures (approval is required by the U.S. Constitution) in Swing States to rig the 2020 Presidential Election, or how Democrats paid for votes in many Urban Centers, in a little thing called “walking around money,” how Democrats threatened Union Members with the loss of their jobs if they didn’t vote Democrat, massive Fake Mail-In Ballots, illegal immigrants and dead people who voted (for Dems), and much more. Our fundraising efforts, working together with the Republican party, were all done legally, and all with the goal of ensuring that my Administration could continue to Make America Great Again. The Election on the other hand, was massively rigged and stolen—and now look what is happening to our Country, and in particular at our southern border.
If you are one of the record-setting 75 million Americans who voted for me, donated or volunteered, THANK YOU! The best is yet to come!",,2021-04-05 14:01:00,14:01:00
2021-04-05,https://www.donaldjtrump.com/desk/desk-hrgtrj3ngh79,Donald J. Trump,"Too bad the desperately needed election reforms in Georgia didn’t go further, as their originally approved Bill did, but the Governor and Lt. Governor would not go for it. The watered-down version, that was just passed and signed by Governor Kemp, while better than before, doesn’t have Signature Matching and many other safety measures, which were sadly left out. This Bill should have been passed before the 2020 Presidential Election, not after. It is now reported that chain of custody records for over 400,000 Absentee Ballots are missing or not being shown. I wonder why? Show them now! The Democrats in Georgia really push the Republicans around, like the so-called Consent Decree, which was illegally signed by the Secretary of State without Legislative Approval—a Democrat DREAM. Boycott all of the woke companies that don’t want Voter I.D. and Free and Fair Elections. ",,2021-04-05 13:55:00,13:55:00
2021-04-04,https://www.donaldjtrump.com/desk/desk-tdk2vgpnyj78,Donald J. Trump,"Happy Easter to ALL, including the Radical Left CRAZIES who rigged our Presidential Election, and want to destroy our Country!",,2021-04-04 13:54:00,13:54:00
2021-04-03,https://www.donaldjtrump.com/desk/desk-ae2jaqddhq77,Donald J. Trump,"For years the Radical Left Democrats have played dirty by boycotting products when anything from that company is done or stated in any way that offends them. Now they are going big time with WOKE CANCEL CULTURE and our sacred elections. It is finally time for Republicans and Conservatives to fight back—we have more people than they do—by far! Boycott Major League Baseball, Coca-Cola, Delta Airlines, JPMorgan Chase, ViacomCBS, Citigroup, Cisco, UPS, and Merck. Don’t go back to their products until they relent. We can play the game better than them. They didn’t even get approval of State Legislatures, which is mandated under the U.S. Constitution. They rigged and stole our 2020 Presidential Election, which we won by a landslide, and then, on top of that, boycott and scare companies into submission. Never submit, never give up! The Radical Left will destroy our Country if we let them. We will not become a Socialist Nation. Happy Easter!",,2021-04-03 12:10:00,12:10:00
2021-04-02,https://www.donaldjtrump.com/desk/desk-kf5nbsmmsp76,Donald J. Trump,"Baseball is already losing tremendous numbers of fans, and now they leave Atlanta with their All-Star Game because they are afraid of the Radical Left Democrats who do not want voter I.D., which is desperately needed, to have anything to do with our elections. Boycott baseball and all of the woke companies that are interfering with Free and Fair Elections. Are you listening Coke, Delta, and all!",,2021-04-02 12:09:00,12:09:00
2021-04-02,https://www.donaldjtrump.com/desk/desk-b3nyvdeg9h75,Donald J. Trump,"Why is it that every time the 2020 ELECTION FRAUD is discussed, the Fake News Media consistently states that such charges are baseless, unfounded, unwarranted, etc.? Sadly, there was massive fraud in the 2020 Presidential Election, and many very angry people understand that. With each passing day, and unfortunately for the Radical Left CRAZIES, more and more facts are coming out.
Other than that, Happy Easter!",,2021-04-02 12:09:00,12:09:00
2021-03-30,https://www.donaldjtrump.com/desk/desk-dekxas85jy73,Donald J. Trump,"Drew McKissick has done an outstanding job as South Carolina GOP Chairman, electing more Republicans in 2020 than in over 140 years. Drew fought all the way to the Supreme Court to defend our voting laws—and WON. He will continue to grow the party and help Conservatives get elected in the Great State of South Carolina. Drew has my Complete and Total Endorsement for re-election!",,2021-03-30 12:07:00,12:07:00
2021-03-26,https://www.donaldjtrump.com/desk/desk-mtjva563ct72,Donald J. Trump,"Congratulations to Georgia and the Georgia State Legislature on changing their voter Rules and Regulations. They learned from the travesty of the 2020 Presidential Election, which can never be allowed to happen again. Too bad these changes could not have been done sooner!",,2021-03-26 12:05:00,12:05:00
2021-03-24,https://www.donaldjtrump.com/desk/desk-zbesdfnxrd71,Donald J. Trump,"David Shafer did a phenomenal job as Chairman of the Georgia Republican Party, recruiting and training a record number of volunteers. No one in Georgia fought harder for me than David! He NEVER gave up! He has my Complete and Total Endorsement for re-election.",,2021-03-24 12:05:00,12:05:00
