updated_date,updated_time,story_headline,story_copy,image_caption,image_url,more_news,story_url
2022-09-13,4:57 PM PT,Australia to replace Queen’s image on coins,"Australia to replace Queen’s image on coinsCANBERRA, AUSTRALIA – APRIL 22: New money awaits counting and bagging at the Royal Australian Mint April 22, 2005 in Canberra, Australia. The Royal Australian Mint celebrated its 40th Anniversary by opening its doors to the public to allow a closer than usual look at its minting process. (Photo by Mark Nolan/Getty Images)OAN NewsroomUPDATED 4:57 PM PT – Tuesday, September 13, 2022The Australian government has vowed to replace the late Queen’s image on its $5 note with Australian figures.The Royal Australian Mint’s flags fly at half-mast and production of coins has been halted for today as the Mint joins Australia and its fellow Commonwealth nations in honouring and paying respect to Her Majesty Queen Elizabeth II on the occasion of her passing. pic.twitter.com/IpGWQa1kTZ— RoyalAustralianMint (@RoyalAustMint) September 9, 2022In a statement on Tuesday, Australian officials said the note would not automatically be replaced by the image of King Charles III. Officials added that the Queen’s face was not put on its currency due to her title but it was put on it because of her personality.Royal Australian Mint, the sole producer of coins in the country, said they will no longer issue coins with the Queen’s image on it. Leigh Gordon, the CEO of Australian Mint made the announcement.“We do not intend to mint any coins in 2023 with the Queen’s effigy on it but we are in a period of transition,” she said. “There are some coins that are out there now with a 2023 date and the Queen on it. They are collectable and investment coins being released as we do normally in September each year for the following year.”Queen Elizabeth’s death has reignited debates about Australia’s future as a constitutional monarchy after voters narrowly chose to maintain the British monarch as its Head of State in 1999.","CANBERRA, AUSTRALIA – APRIL 22: New money awaits counting and bagging at the Royal Australian Mint April 22, 2005 in Canberra, Australia. The Royal Australian Mint celebrated its 40th Anniversary by opening its doors to the public to allow a closer than usual look at its minting process. (Photo by Mark Nolan/Getty Images)",https://d2pd5v545ww278.cloudfront.net/wp-content/uploads/2022/09/GettyImages-52680904.jpg, Attorney Ken Starr Passes Away At 76TOPICS:AustraliacoinsMONEYnews. politics. queen ElizabethOANOANNqueenRoyal Australian Mint SHARETWEETPINSHARE,https://www.oann.com/australia-to-replace-queens-image-on-coins/
2022-09-13,4:23 PM PT,Attorney Ken Starr passes away at 76,"Attorney Ken Starr passes away at 76Ken Starr, a member of U.S. President Donald Trump’s legal team, leaves the U.S. Capitol in Washington, D.C., on Monday, Feb. 3, 2020.Amanda Andrade-Rhoades | Bloomberg | Getty ImagesOAN NewsroomUPDATED 4:23 PM PT – Tuesday, September 13, 2022Former US Solicitor General Ken Starr has passed away at the age of 76.In Memoriam:Kenneth W. Starr, 1946-2022(President, Baylor University, 2010-16) pic.twitter.com/BPWrxxu2O2— Baylor University (@Baylor) September 13, 2022On Tuesday, Baylor University officials announced Starr’s passing at the St. Luke’s Medical Center in Houston, Texas. Officials noted that Starr had died from complications which ensued during surgery.Starr garnered national attention during the trials of Bill and Hillary Clinton in the 1990’s. The former US solicitor general’s Whitewater investigation uncovered then-President Bill Clinton’s affair, which led to Clinton’s impeachment for lying under oath. More recently, Starr served as a member of 45th President Donald J. Trump’s defense team during his impeachment trials. Starr served as the President of Baylor University until his retirement in 2016. He is survived by his wife Alice and three children.","Ken Starr, a member of U.S. President Donald Trump’s legal team, leaves the U.S. Capitol in Washington, D.C., on Monday, Feb. 3, 2020.Amanda Andrade-Rhoades | Bloomberg | Getty Images",https://d2pd5v545ww278.cloudfront.net/wp-content/uploads/2022/09/107117972-1663100489491-GettyImages-1198408519r.webp, Harris: Border Is Secure And SCOTUS Is DangerousTOPICS:Baylor UniversitydeadKen StarrKenneth StarrnewsOANOANNpolitics SHARETWEETPINSHARE,https://www.oann.com/attorney-ken-starr-passes-away-at-76/
2022-09-13,3:33 PM PT,Harris: Border is secure and SCOTUS is dangerous,"Harris: Border is secure and SCOTUS is dangerousVice President Kamala Harris listens during a meeting with civil rights and reproductive rights leaders in the Diplomatic Reception Room on the White House complex in Washington, Monday, Sept. 12, 2022. (AP Photo/Susan Walsh)OAN NewsroomUPDATED 3:33 PM PT – Tuesday, September 13, 2022The White House’s second in command has a very different vision for America than its founders. Vice President Kamala Harris said that the southern border is secure but has claimed that the Supreme Court is a threat to the United States.Harris made these statements while on Meet the Press with Chuck Todd over the weekend. There, Todd pressed the border czar on the nearly two million known border crossings during her tenure. The Vice President asserted that the nation’s boundaries are stable. She blamed the Trump administration for the influx of illegal immigrants.“We have a secure border and that is a priority for any nation including ours in our administration,” Harris said. “But there are still a lot of problems that we are trying to fix given the deterioration that has happened over the last four years. We also have to put in place a law and a plan for a pathway for citizenship.”Harris also blamed Republican governors for playing politics with people’s lives. The Democrat asserted that Americans should be more concerned than they are with the recent rulings from the Supreme Court. She called the judicial body an activist court and then lambasted them for returning the abortion policy back to the states. The Californian claimed such a decision to be a threat to the American system. Harris said Democrats must eliminate the filibuster to protect democracy by ramming their agenda through both houses with a slim majority.“The President has been clear on this issue and on a very important issue in addition to that important issue which is voting rights,” The Vice President said. “And the President has been very clear, he will sign into law and not let the filibuster get in the way, the John Lewis Voting Rights Advancement Acts and the Freedom to Vote Act.” Harris also warned that election deniers pose a threat to the country. This comes as she and the Democrats gear up to increase their majorities in the House and Senate. However, when Todd asked Harris why Democrats elevated Republican opponents who question the 2020 election, the Vice President dodged the question and touted her own campaign record.""You’re not worried that this reflects poorly on the Democrats?"" Chuck Todd grills VP Harris over Democrats backing hard right candidates in the hopes of better general election chances. pic.twitter.com/kAdtIMjYpt— Virginia Kruta (@VAKruta) September 11, 2022Harris was polling in the single digits before exiting the 2020 Democrat presidential primary. She bowed out before she could appear on a ballot in her home state of California. According to Five Thirty Eight, as Vice President, she has an approval rating of 38-percent.","Vice President Kamala Harris listens during a meeting with civil rights and reproductive rights leaders in the Diplomatic Reception Room on the White House complex in Washington, Monday, Sept. 12, 2022. (AP Photo/Susan Walsh)",https://d2pd5v545ww278.cloudfront.net/wp-content/uploads/2022/09/AP22255804866691.jpg, Biden Announces Next Steps In Fight To Cure CancerTOPICS:democratharriskamalaKamala HarrisnewsOANOANNpoliticsSCOTUSSupreme CourtUnited StatesVice President SHARETWEETPINSHARE,https://www.oann.com/harris-border-is-secure-and-scotus-is-dangerous/
2022-09-13,"Chanel Rion — OAN Chief White House Correspondent
10:27 AM PT",Cringe Optics: Biden Takes Victory Lap During Economic Nosedive,"Cringe Optics: Biden Takes Victory Lap During Economic NosediveChanel Rion — OAN Chief White House CorrespondentUPDATED 10:27 AM PT – Tuesday, September 13, 2022An optically difficult day for the White House – as the economy tanks at news of roaring inflation and a higher than expected CPI rate, Biden staffers assembled the President for a photo op taking the bow for his inflation reduction efforts.The White House found itself stuck in a corner Tuesday. Having slated the day for “thousands of supporters” to stand in “celebration” of Biden’s efforts to fight inflation, the Consumer Price Index delivered a shocking blow.August inflation rates surged against expectations bringing the average inflation rate – excluding food and energy – to 8.3%. This is double the core CPI forecast. But in spite of the evidence, the White House plowed forward, taking a victory lap:With the Inflation Reduction Act, the American people won and the special interests lost.Today, we celebrate its passage at the White House. pic.twitter.com/FQDRLkKK1m— President Biden (@POTUS) September 13, 2022Many economists – and in turn the White House – expected the August CPI numbers to actually go down due to the decline in oil and gas prices from the previous month. Gas is down nearly 10%. But Tuesday’s numbers proved not only was this drop in gas prices not enough to stave off economic woes – but the economy is deteriorating at a much faster rate than expected. The average American can’t keep up.The typical American household now pays $460 MORE per month on the same goods and services they were paying for last year, according to the Wall Street Journal. That’s over $5500 more per year per household.President Biden, ahead of his Inflation Reduction Act signing event at the White House, was forced to release a statement insisting his policies are taking America in the right direction despite the evidence:Today’s data show more progress in bringing global inflation down in the US economy.  Overall, prices have been essentially flat in our country these last two months: that is welcome news for American families, with more work still to do.  Gas prices are down an average of $1.30 a gallon since the beginning of the summer.Undergirding Biden’s insistence of “progress” in the US economy are three big narratives;  real wages are up, gas is down, and inflation was not cause by Biden’s $1.9 Trillion spending bill.But wages are not up: Average hourly pay, adjusted for inflation are down -2.8%.A closer look at individual necessities only make the picture worse; Eggs are up nearly 40% since last year, food and basic costs are gobbling up any small gains being made in US salaries. The US economy has now suffered 17 consecutive months under Biden spending policies where inflation outpaced wage growth.That basic costs for virtually everything are spiking significantly cancels out any good news on the gas front. While gas prices have gone down 10% in the last month, compared to this time last year, gas prices are still up a whopping 25% year over year. Utilities are up 33% since last year.Even the head of Obama’s Council of Economic Advisors confronted the bad news bluntly: “CPI report not pretty.”CPI report not pretty. Headline fine (0.1% CPI for Aug or a 1.4% annual rate in that month, with prices up 8.3% over the last year).Problem is excluding volatile food and energy and was ugly (0.6% for Aug or a 7.0% annual rate).Broad-based relief not coming. pic.twitter.com/WVODxYmrYm— Jason Furman (@jasonfurman) September 13, 2022And since the passage of Biden’s $1.9 Trillion spending bill, inflation has only been aggravated month after month contradicting the Biden position insisting inflation would only be temporary:Happy 1 year anniversary of Biden lying about inflation only being ""temporary."" pic.twitter.com/p4KZO9eDSx— Tim Young (@TimRunsHisMouth) July 19, 2022Just last month, Biden was mocked for claiming there was zero inflation – touting a slight decrease in inflation that has since been cancelled out.Tuesday, Biden took to social media to encourage Americans to join him in celebrating his Inflation Reduction Act.Exactly four weeks ago, I signed the Inflation Reduction Act into law.So today, we're celebrating.Tune in at 3 PM ET as I deliver remarks and welcome the leaders and advocates who made it happen to the People's House.— President Biden (@POTUS) September 13, 2022At the time of Biden’s tweet, the Nasdaq plunged by over 840 points into the red. SHARETWEETPINSHARE",SHARE,https://hnwebcontent.s3-us-west-1.amazonaws.com/oann/wp-content/uploads/2020/11/parler_white.png,,https://www.oann.com/cringe-optics-biden-takes-victory-lap-during-economic-nosedive/
2022-09-13,12:45 PM PT,"Election day begins in R.I., N.H., Del.","Election day begins in R.I., N.H., Del.People vote at the Greenspring Retirement center during the mid-term election day in Fairfax, Virginia on November 6, 2018. (Photo by ANDREW CABALLERO-REYNOLDS / AFP) (Photo credit should read ANDREW CABALLERO-REYNOLDS/AFP via Getty Images)OAN NewsroomUPDATED 12:45 PM PT – Tuesday, September 13, 2022Tuesday’s elections are the last primaries for this midterm cycle.In Delaware, Democrat representative Lisa Blunt Rochester and Republican nominee Lee Murphy have filed with no opposition within their own parties.In New Hampshire, former President Trump has yet to endorse anyone for Senate. However, Republican Governor Chris Sununu endorsed State Senate President Chuck Morse. Sununu believes that he has the best chance at defeating the incumbent Maggie Hassan. In the State’s 1st Congressional District, the Republican party is split between two young former Trump employees. Matt Mowers and Karoline Leavitt are duking it out to see who can carry on the mantle of Trump.In Rhode Island, Republicans are hoping to flip a key Democrat-held house seat. Several candidates are in the running to replace Rhode Island’s outgoing Democrat representative Jim Langevin. A Republican contender for Rhode Island’s 2nd Congressional District is the former Mayor of Cranston, Allan Fung. He has the potential to turn this district red for the first time in 30-years. Fung says he’s focused on fixing the ripple effects of the Biden administration’s rampant energy and inflation crisis.“Right now, I’m focused on the people’s priorities and that’s how to get by in this crippling economy that’s been put forward by the policies from President Biden and his administration, Nancy Pelosi (D-Calif.) and the members of Congress spending’s have been out of control leading to this rapid inflation,” Fung said. “We gotta drive those costs down. Energy prices are out of control, oil and gas, it’s containable. We’re talking about these prices bumping up over $5 a gallon… this is crazy. I want to run to fix a lot of these problems and make us energy independent again.” The 2nd District has been in Democrat hands since 1990. Despite this, history shows that it has the potential to turn red as it has made a gradual shift to the right in recent years.Meanwhile, Langevin has endorsed Rhode Island Democrat and General Treasurer Seth Magaziner to replace him. This comes after Magaziner abandoned his race for Governor to run in the 2nd District primary.“I say that we need to hold this seat in Democratic hands and we need a candidate on the Democratic ticket who has run in the district, won in the district, represented the district for the last seven years as I have as State Treasurer,” Magaziner said. “We need to maximize our chances of winning the seat.” Polls currently show Magaziner losing to Fung by six points. Fung also has statewide recognition due to his two runs for governor against Gina Raimondo in 2014 and in 2018.","People vote at the Greenspring Retirement center during the mid-term election day in Fairfax, Virginia on November 6, 2018. (Photo by ANDREW CABALLERO-REYNOLDS / AFP) (Photo credit should read ANDREW CABALLERO-REYNOLDS/AFP via Getty Images)",https://d2pd5v545ww278.cloudfront.net/wp-content/uploads/2022/09/GettyImages-1058086836.jpg, Cringe Optics: Biden Takes Victory Lap During Economic NosediveTOPICS:DELAWAREElection DaymidtermsNew HampshirenewsOANOANNpoliticsRhode Island SHARETWEETPINSHARE,https://www.oann.com/election-day-begins-in-r-i-n-h-del/
2022-09-13,8:06 AM PT,US inflation for August shows up 8.3% year-over-year,"US inflation for August shows up 8.3% year-over-yearAmerican flags hang outside of the New York Stock Exchange Tuesday, Feb. 16, 2021. (AP Photo/Frank Franklin II)OAN NewsroomUPDATED 8:06 AM PT – Tuesday, September 13, 2022The Consumer Price Index report for August is out, showing inflation is up 8.3 percent from a year ago. Economists were expecting 8.1 percent year-over-year. The Labor Department released the report Tuesday, indicating inflation is slightly up by 0.1 percent from July.The CPI measures a range of prices for a typical basket of goods while core inflation does not include food and energy. The report shows inflation still remains near its highest levels in more than 40-years. The Federal Reserve has taken an aggressive approach to raise interest rates to combat inflation and will likely continue to raise rates following the latest report.President Joe Biden has continued to boast revving up America’s economy, despite data showing he’s only ramping up inflation. As long as Biden says the economy is booming, it has to be true right?On Monday, Senate Minority Leader Mitch McConnell (R-Ky.) gave Democrats in the upper chamber a reality check when he detailed how Biden’s economic policies are actually affecting Americans.“And poll after poll has shown they’re overwhelmingly dissatisfied with what President Biden and his party have done since then,” he stated. “One survey found five consecutive times that more than 70 percent of Americans say our country is headed in the wrong direction, but that hasn’t stopped Washington Democrats from following the same disastrous play over and over and over again.”McConnell went on to squawk at Democrats for constantly proposing and passing bloated spending bills through Congress, stressing overspending by the federal government is causing of inflation. He pointed out after GOP warnings of skyrocketing inflation from the American Rescue Plan and Biden’s Build Back Better agenda, Democrats last month rolled out yet another bloated bill with the so-called Inflation Reduction Act.The Kentucky Republican claims that legislation only continues Biden’s war on American energy, weaponizes the IRS against average Americans and prioritizes the Biden climate agenda over the American public.“But the American people don’t want tens-of billions of dollars in wish fulfillment for climate activist, they want affordable gas and electricity,” McConnell noted. “The American people don’t want a bloated IRS, they want stronger support for law enforcement at the southern border and their communities. Washington Democrats have consistently misunderstood what the American people have asked them to do.”Meanwhile, Americans are still struggling to buy gas, food and other basic needs. Reports say more than half of Americans are admitting they are struggling financially while nearly 60 percent are reportedly living paycheck to paycheck. Financial experts also say this is affecting the middle class a lot harder than before inflation began lift-off.Additionally, retirees are lamenting they have had to go back to work over their depleted incomes, which couldn’t stretch further amid the inflation of the dollar. In the meantime, while Wall Street and top government officials can tout a slight downturn of inflation and gas priced, doom still looms for America’s economy.An economist at the Federal Reserve warned a severe recession is nearing as the Fed is mulling over a new batch of interest rate hikes. This has caused many officials, including New York City Mayor Eric Adams, to warn of future belt tightening among their governments in anticipation of a rocky road to economic recovery.The Consumer Price Index report appears to shows a recession is an impending phenomenon, which likely can’t be avoided.","American flags hang outside of the New York Stock Exchange Tuesday, Feb. 16, 2021. (AP Photo/Frank Franklin II)",https://d2pd5v545ww278.cloudfront.net/wp-content/uploads/2021/02/AP21047614851011.jpg, Biden Goes Bipartisan Route In Ohio After Labeling MAGA Americans As ‘Threats To Democracy’TOPICS:American Rescue PlanBBBBuild Back Betterclimate agendaConsumer Price IndexCPIdemocratseconomistsECONOMYenergyEric AdamsFederal Reservegreen energyinflationInflation Reduction Actinterest rateIRSJoe BidenLabor DepartmentMitch McConnellNew York CitynewsOANOANNpoliticsSouthern borderspendingWall Street SHARETWEETPINSHARE,https://www.oann.com/us-inflation-for-august-shows-up-8-3-year-over-year/
2022-09-13,11:08 AM PT,Ill. small town mayor upset by bus of migrants sent to city without notice,"Ill. small town mayor upset by bus of migrants sent to city without noticeMigrants, who boarded a bus in Texas, listen to volunteers offering assistance after being dropped off within view of the US Capitol building in Washington, DC, on August 11, 2022. (Photo by STEFANI REYNOLDS/AFP via Getty Images)OAN NewsroomUPDATED 11:08 AM PT – Tuesday, September 13, 2022The mayor of a small Illinois town is reeling after dozens of migrants are bussed to his town without notice. Elk Grove Village Mayor Craig Johnson said he recently received a call from Illinois Governor J.B. Pritzker’s office, informing him ”a bus” full of migrants would be arriving in the city that evening.When he asked for more information such as how many migrants and which hotel they were headed to, Johnson said the office claimed “no details were available.” The small town mayor then questioned whether these migrants had been subjected to any health screenings or background checks, but given no answer. Johnson said he would provide food and water for the migrants, but not allow them off the bus.“We started doing some homework. The State of Texas has no clue where Elk Grove Village is. They were not going to Elk Grove Village. They were going to the city of Chicago. She wants to probably say politically: ‘I’m a sanctuary city. I welcome you with open arms.’ But when reality checks, if five bus loads shows up in her city, she can’t handle it. So let’s give them to Elk Grove Village. That’s wrong…We’re not against migrants. We’re not against helping them, but we should work together. Our frustration is, no well-advance knowledge, no involvement in communication discussing how we can handle it.” –Mayor Craig Johnson – Elk Grove Village, Illinois This comes as Illinois Democrat leadership, including Chicago Mayor Lori Lightfoot have attempted to play off the influx of migrants from Texas as ”racism” by Texas Governor Greg Abbott.","Migrants, who boarded a bus in Texas, listen to volunteers offering assistance after being dropped off within view of the US Capitol building in Washington, DC, on August 11, 2022. (Photo by STEFANI REYNOLDS/AFP via Getty Images)",https://d2pd5v545ww278.cloudfront.net/wp-content/uploads/2022/08/GettyImages-1242435608-e1661895269543.jpg, Trump: We Won Big In 2020 But Dead People VotedTOPICS:Border CrisisBorder SecurityCraig JohnsonElk Grove VillageIllinoisimmigrationJ.B. PritzkerLori Lightfootmigrant busmigrantsOANOANNSouthern border SHARETWEETPINSHARE,https://www.oann.com/ill-small-town-mayor-upset-by-bus-of-migrants-sent-to-city-without-notice/
