updated_date,updated_time,story_headline,story_copy,image_caption,image_url,more_news,story_url
2022-09-06,7:23 AM PT,Biden admin. doubles down on attacks against MAGA GOP,"Biden admin. doubles down on attacks against MAGA GOPPresident Joe Biden listens as Vice President Kamala Harris speaks after meeting with leaders from Georgia’s Asian-American and Pacific Islander community, Friday, March 19, 2021, at Emory University in Atlanta. (AP Photo/Patrick Semansky)OAN NewsroomUPDATED 7:23 AM PT – Tuesday, September 6, 2022The Biden administration has continued its crusade against the MAGA movement. The President appears to keep choosing divisiveness as he rails against Trump supporters.While speaking at a rally on Monday, Biden accused the MAGA movement of being anti-Semitic, comparing them to the Ku Klux Klan and Nazis. His remarks came in spite of him running on a campaign of being a “great unifier,” but has recently proved otherwise by calling America First Republicans semi-fascist and a threat to democracy.“But then we moved to this place where all of a sudden, the reason that made me run I decided was when you saw those people come out of the fields down in Virginia carrying torches, literally coming out of the fields, carrying torches with swastikas, chanting the same anti-Semitic bylaws chanted in literally the same anti-Semitic bile, chanted in Germany in the thirties by the Ku Klux Klan,” Biden stated. “And the guy that I beat in this last election, and when they asked what he thought, he said there were really fine people on both sides. This is something really wrong. Something is changing. “Meanwhile, in the city of Boston, Vice President Kamala Harris voiced her frustration at Republican states trying to maintain the integrity of their elections. These include measures that ban the use of ballot drop boxes and requiring voters to show some form of identification.“We travel to do the work of reminding folks that when they stood in those lines for four hours, when they had to find childcare to drop off their ballot, when they navigated the obstacles that certain states are putting up for them to have access to the vote, when they put in their order in 2020 for what they wanted,” Harris noted. “We gave them most of what they asked for, but we need to see it through.”However, Biden maintained that not all Republicans supported the America First agenda, referring to lawmakers such as Rep. Liz Cheney (R-Wyo.) and Senate Minority Leader Mitch McConnell (R-Ky.) who have been labeled as RINOs by 45th President Donald Trump.“I want to be very clear up front, not every Republican is MAGA Republican,” Biden stated. “Not every Republican embraces that extreme ideology. I know because I’ve been able to work with mainstream Republicans in my whole career, but the extreme MAGA Republicans in Congress have chosen to go backwards. Full of anger, violence, hate and division. But together, we can and we must choose a different path forward.”In the meantime, a red wave is expected to hit in this year’s midterm elections with many Trump-endorsed candidates competing to take control of Congress.","President Joe Biden listens as Vice President Kamala Harris speaks after meeting with leaders from Georgia’s Asian-American and Pacific Islander community, Friday, March 19, 2021, at Emory University in Atlanta. (AP Photo/Patrick Semansky)",https://d2pd5v545ww278.cloudfront.net/wp-content/uploads/2022/09/AP21078795278581.jpg, Rep. Greene: Left Has Agenda To ‘Sexualize’ ChildrenTOPICS:America FirstBiden AdministrationBOSTONCongressDonald TrumpELECTIONSGOPgreat unifierJoe BidenKamala HarrisKu Klux KlanLiz CheneyMAGAMAGA GOPMAGA Movementmidterm electionsmidtermsMitch McConnellNazisnewsOANOANNpoliticsred waveREPUBLICANSRINORINOssemi-fascistVOTING SHARETWEETPINSHARE,https://www.oann.com/biden-admin-doubles-down-on-attacks-against-maga-gop/
2022-09-06,7:03 AM PT,Poll: 64% of Americans expect a rise in political violence,"Poll: 64% of Americans expect a rise in political violencePresident Joe Biden speaks outside Independence Hall, Thursday, Sept. 1, 2022, in Philadelphia. (AP Photo/Matt Slocum)OAN NewsroomUPDATED 7:03 AM PT – Tuesday, September 6, 2022A growing number of Americans are worried about mounting threats of political violence. A new poll by CBS News and YouGov found 64 percent of respondents believe America will see further rise in political violence in coming years. This compared to just 51 percent who expected an increase in political violence in January 2021.The Biden administration is now under fire for labeling Donald Trump supporters as “dangerous extremists,” which critics say fuels more political division. Republicans are asserting that Biden should work to solve the crises he created, instead of pitting Americans against one another.“I was stunned at how divisive this speech was last night,” said Virginia Governor Glenn Youngkin (R) in regards to President Biden’s recent primetime address. “And at a time where people across America, I know in Virginia, are worried about some of the most basic issues: rising inflation and trying to make ends meet, crime and oh by the way education challenges. And it’s a time when, in fact, we’ve gotta focus on these issues and our President jumped out and was incredibly divisive, trying to pit Americans against one another.”Joe Biden is an anti-worker president: •Real wages are down•56% of Americans say their financial situation is getting WORSE•The average American has $11,000 LESS in savings than last yearBiden does not care about working Americans.— GOP (@GOP) September 6, 2022The poll also found only 10 percent of Americans expect political violence to subside moving forward.","President Joe Biden speaks outside Independence Hall, Thursday, Sept. 1, 2022, in Philadelphia. (AP Photo/Matt Slocum)",https://d2pd5v545ww278.cloudfront.net/wp-content/uploads/2022/09/AP22245026536485-1620x1080.jpg," Kari Lake Responds To Biden’s Dark Speech, Torches Him For Dividing The CountryTOPICS:Biden AdministrationDonald TrumpeducationGlenn YoungkininflationJoe BidennewsOANOANNpoliticalpolitical violencepoliticspollviolence SHARETWEETPINSHARE",https://www.oann.com/poll-64-of-americans-expect-a-rise-in-political-violence/
2022-09-05,9:38 AM PT,Judge grants Trump request for special master,"Judge grants Trump request for special masterPages from a Department of Justice court filing on Aug. 30, 2022, in response to a request from the legal team of former President Donald Trump for a special master to review the documents seized during the Aug. 8 search of Mar-a-Lago, are photographed early Wednesday, Aug. 31, 2022. Included in the filing was a FBI photo of documents that were seized during the search. (AP Photo/Jon Elswick)OAN NewsroomUPDATED 9:38 AM PT – Monday, September 5, 2022On Monday in Florida, federal Judge Aileen Cannon ruled on appointing a special master to review the documents taken from 45th President Donald J. Trump’s Mar-a-Lago residence.FLASH: Judge Aileen Cannon rules in favor of Trump's motion for ""special master"" to review items seized from Mar-a-lagoAnd orders Justice Dept to cease review of materials ""pending resolution of the special master’s review process"", though nat'l security assessment can continue pic.twitter.com/CHGf0qiw1G— Scott MacFarlane (@MacFarlaneNews) September 5, 2022The appointee will “review the seized property for personal items and documents and potentially privileged material subject to claims of attorney client and or executive privilege.”The Department of Justice (DOJ), which has staunchly opposed the review, must now halt their own review of the materials. Both sides will now have to come up with offers on how the process will proceed. This includes deciding who will serve as the special master. Their proposals must be submitted by Friday.","Pages from a Department of Justice court filing on Aug. 30, 2022, in response to a request from the legal team of former President Donald Trump for a special master to review the documents seized during the Aug. 8 search of Mar-a-Lago, are photographed early Wednesday, Aug. 31, 2022. Included in the filing was a FBI photo of documents that were seized during the search. (AP Photo/Jon Elswick)",https://d2pd5v545ww278.cloudfront.net/wp-content/uploads/2022/09/AP22243183718033.jpg," 45th Pres. Trump Holds Rally In Wilkes-Barre, Pa.TOPICS:Aileen CannonDepartment of JusticeDOJMar-a-LagonewsOANOANNpoliticsSpecial Master SHARETWEETPINSHARE",https://www.oann.com/judge-grants-trump-request-for-special-master/
2022-09-05,4:38 PM PT,ISIS terrorist attacks Russian Embassy in Kabul,"ISIS terrorist attacks Russian Embassy in KabulTaliban fighters near the Russian embassy following an explosion, in Kabul on Sept. 5.Photographer: Wakil Kohsar/AFP/Getty ImagesOAN NewsroomUPDATED 4:38 PM PT – Monday, September 5, 2022The terrorist group Islamic State (ISIS) has claimed responsibility for the deadly bombing at the Russian Embassy in Kabul.‼️Police in #Kabul reports that a suicide bomber blew himself up at the gate of the #Russian Embassy.There is no information on the number of casualties. pic.twitter.com/VGvnGO6wUH— NEXTA (@nexta_tv) September 5, 2022According to Reuters on Monday, ISIS terrorists had sent a suicide bomber to the Russian Embassy. The bombing resulted in the deaths of two employees. One of the employees who died was a Russian diplomat. So far, the total death toll from the bombing has reached 25-people.Local reports have suggested that the ISIS terrorist detonated his vest. It was also reported that the terrorist was mainly targeting Afghan citizens who were lining up for Russian visas. Russian Foreign Minister Sergei Lavrov announced that security has been tightened at the Embassy since the attack.“Immediately (after the attack) steps were taken to tighten security around the outer perimeter and bring in additional Taliban forces and the Afghan intelligence and counterintelligence services,” Lavrov said. “Let us hope that the organizers of this terrorist attack and its perpetrators will soon face the punishment they deserve.”Terrorist group ISIS-K is currently active in Afghanistan. The group has been fighting against the Taliban government following its takeover of the Country last year.","Taliban fighters near the Russian embassy following an explosion, in Kabul on Sept. 5.Photographer: Wakil Kohsar/AFP/Getty Images",https://d2pd5v545ww278.cloudfront.net/wp-content/uploads/2022/09/800x-1.jpg, Project Veritas Exposes Woke Curriculum At Trinity SchoolTOPICS:BOMBINGdeathISISKabulnewsOANOANNpoliticsRussian EmbassyRussian embassy in Kabulterriost SHARETWEETPINSHARE,https://www.oann.com/isis-terrorist-attacks-russian-embassy-in-kabul/
2022-09-05,3:42 PM PT,Colo. Senate race among tightest polling races,"Colo. Senate race among tightest polling racesFILE – Joe O’Dea, Republican nominee for the U.S. Senate seat held by Democrat Michael Bennet, speaks during a primary election night watch party, late June 28, 2022, in Denver.  (AP Photo/David Zalubowski, File)OAN NewsroomUPDATED 3:42 PM PT – Monday, September 5, 2022As the midterms enter the final stretch, some races are catching experts by surprise with just how close they are. Colorado Senator Michael Bennet (D-Colo.)  faces a surprisingly strong election challenge in his bid to represent the Centennial State for another term. Bennet has represented Colorado as a Democrat since being first appointed to the seat in 2009.Among his top priorities, if he wins re-election, include pushing for the greater adoption of so-called green energy, gun control and passing the Equality Act. The Act would expand civil rights protections for gender identity. As well, he would like to end congress members being able to make stock trades. Bennet claimed it would help American democracy.“That’s why I’m fighting to ban members of congress from ever becoming lobbyists,” Bennet said. “Why I’m not taking a dime in corporate PAC money. And why I’m working to stop senators and congressmen from making personal stock trades.”His opponent is Republican Joe O’Dea, the owner of a construction business. O’Dea has worked his way from being a union carpenter to be where he is today. The top issues that O’Dea’s would like to see tackled in a new Republican majority include ending late-term abortions, stopping the defund the police movement in its tracks and he would like to unify Coloradans from across the political spectrum. He also wants to prioritize reversing the expansion of the IRS, which he blames Bennet for.“The last thing we need to do is spend more money,” O’Dea stated. “The bottom line is that that’s going to transcend down and it’s going to get carried by working Americans here and we’re going to end up paying for that.”The race was originally expected to have Bennet cruise to re-election. However, as the election has drawn closer O’Dea has closed the gap. It’s now leading to a toss-up. If O’Dea can snatch the seat from Bennet the Democrat path to a Senate majority would be significantly narrowed.Colorado sends a mail-in ballot to every registered voter in the weeks before election day. The State also allows in-person voting. Voters must return their ballots to a polling station prior to their closing at 7:00 PM on election day.","FILE – Joe O’Dea, Republican nominee for the U.S. Senate seat held by Democrat Michael Bennet, speaks during a primary election night watch party, late June 28, 2022, in Denver.  (AP Photo/David Zalubowski, File)",https://d2pd5v545ww278.cloudfront.net/wp-content/uploads/2022/09/WireAP_49f1fd06b042428786621133b4311495_16x9_992-777x437.jpg, Project Veritas Exposes Woke Curriculum At Trinity SchoolTOPICS:BennetColoradodemocratmidtermsnewsO'DeaOANOANNpoliticsre-electionRepublican SHARETWEETPINSHARE,https://www.oann.com/colo-senate-race-among-tightest-polling-races/
2022-09-05,1:48 PM PT,Project Veritas exposes woke curriculum at Trinity School,"Project Veritas exposes woke curriculum at Trinity SchoolNATIONAL HARBOR, MD – FEBRUARY 28: James O’Keefe, an American conservative political activist and founder of Project Veritas, meets with supporters during the Conservative Political Action Conference 2020 (CPAC) hosted by the American Conservative Union on February 28, 2020 in National Harbor, MD. (Photo by Samuel Corum/Getty Images)OAN NewsroomUPDATED 1:48 PM PT – Monday, September 5, 2022Project Veritas has exposed yet another school teaching children far-left propaganda. On Thursday, the latest episode of Secret Curriculum featured Jennifer Norris. She is the Director of Student Activities at Trinity School in New York City.In the video obtained by an undercover journalist, Norris stated that white male Republicans are unredeemable and need to be eliminated. The Director of Student Activities also boasted that she and other teachers sneak their personal beliefs in the curriculum. One example she provided included teaching children about social justice during detention.The director was very open that Republican views are not welcome at the school.“It’s a 300-year-old school, so I mean, clearly based on white supremacy and it was started in Trinity Church, which was built by slaves,” Norris said. “And they’re starting to grapple with the history of their school, I think people know… I mean, we’re not as left as I am, for sure but it’s definitely a school where Conservatives would not feel comfortable.”The Trinity School is an elite K-through-12th academy. The intuition charges almost $60,000 a year in tuition.","NATIONAL HARBOR, MD – FEBRUARY 28: James O’Keefe, an American conservative political activist and founder of Project Veritas, meets with supporters during the Conservative Political Action Conference 2020 (CPAC) hosted by the American Conservative Union on February 28, 2020 in National Harbor, MD. (Photo by Samuel Corum/Getty Images)",https://d2pd5v545ww278.cloudfront.net/wp-content/uploads/2022/09/GettyImages-1204060878.jpg," 1 Dead, 9 Missing After Float Plane Crashes Off Wash. CoastTOPICS:Jennifer NorrisNew YorkNYCProject VeritasRepublicanSocial JusticeTrinity School SHARETWEETPINSHARE",https://www.oann.com/project-veritas-exposes-woke-curriculum-at-trinity-school/
2022-09-05,12:14 PM PT,"1 dead, 9 missing after float plane crashes off Wash. coast","1 dead, 9 missing after float plane crashes off Wash. coastA U.S. Coast Guard plane searches area Monday, Sept. 5, 2022, near Freeland, Wash., on Whidbey Island north of Seattle where a chartered floatplane crashed the day before. The plane was carrying 10 people and was en route from Friday Harbor, Wash., to Renton, Wash. (AP Photo/Stephen Brashear)OAN NewsroomUPDATED 12:14 PM PT – Monday, September 5, 2022Search and recovery efforts are underway after a float plane crashed off of the Washington State coast. The plane was carrying 10 people, including a child, when it crashed into the Mutiny Bay on Sunday. Currently, it has been reported that one person has been killed. The nine remaining passengers are missing.WATCH: On Whidbey Island, a float plane carrying ten people, including a child, crashed into Mutiny Bay. The Coast Guard and emergency personnel will continue to search for the plane until further notice. Only one person has been so far found. pic.twitter.com/9FaCcUGp1r— BNN Newsroom (@BNNBreaking) September 5, 2022The Coast Guard is using helicopters and boats in their search for the missing. Authorities have announced that they have recovered the body of the deceased individual. Jon Gabelein, a firefighter at South Whidbey Fire/EMS spoke to the public about the latest developments in the search. “Once we got out there, we found one individual and we brought that on a rescue boat here to the boat launch,” Gabelein said. “And our search effort continues. Moving with the tide in the current.”Officials say crews have recovered parts of the wreckage. There’s no word yet on the cause of the crash.","A U.S. Coast Guard plane searches area Monday, Sept. 5, 2022, near Freeland, Wash., on Whidbey Island north of Seattle where a chartered floatplane crashed the day before. The plane was carrying 10 people and was en route from Friday Harbor, Wash., to Renton, Wash. (AP Photo/Stephen Brashear)",https://d2pd5v545ww278.cloudfront.net/wp-content/uploads/2022/09/AP22248608546083.jpg, Trump: Fox News Pushing Democrat AgendaTOPICS:crashfloat planemissingnewsOANOANN SHARETWEETPINSHARE,https://www.oann.com/1-dead-9-missing-after-float-plane-crashes-off-wash-coast/
2022-09-05,10:44 AM PT,Trump: Fox News pushing Democrat agenda,"Trump: Fox News pushing Democrat agendaFormer President Donald Trump speaks at a rally in Wilkes-Barre, Pa., Saturday, Sept. 3, 2022. (AP Photo/Mary Altaffer)OAN NewsroomUPDATED 10:44 AM PT – Monday, September 5, 202245th President Donald J. Trump slammed Fox News on Sunday. He claimed that the news organization is pushing a Democrat agenda.In a Truth Social post, Trump said that the one-time Conservative network gives Democrats softball questions in interviews. He claimed that their Republican counterparts “get creamed” by the hosts.Trump says he is willing to help the new CNN beat Fox in the ratings. pic.twitter.com/74BJDDOf6t— Ron Filipkowski 🇺🇦 (@RonFilipkowski) September 4, 2022The Republican also said that contributor Karl Rove is unwatchable but is on all of the time regardless.Trump said that if CNN ever decided to become Conservative, they’d massively improve their ratings. He announced that he’s willing to help the news network should they decide to lean right.","Former President Donald Trump speaks at a rally in Wilkes-Barre, Pa., Saturday, Sept. 3, 2022. (AP Photo/Mary Altaffer)",https://d2pd5v545ww278.cloudfront.net/wp-content/uploads/2022/09/AP22247059220452-656x437.jpg, Biden Has Spent 41% Of His Time In Office On VacationTOPICS:45CNNDonald TrumpFOXnewsOANOANNpoliticsTrumpTruth Social SHARETWEETPINSHARE,https://www.oann.com/trump-fox-news-pushing-democrat-agenda/
